news_outlet,provenance,query_keywords,creation_date,last_modified,crawl_date,author_person,author_organization,news_keywords,content_title,content_description,content_body,Fake News,Extreme bias,clickbait,credible,body_len,has_label
bild,https://www.bild.de/politik/inland/politik-inland/naechster-ampel-zoff-fdp-stoppt-lieferketten-gesetz-der-spd-86996840.bild.html,"spd, fdp, umweltschutz, christian lindner",2024-02-01,2024-02-01,2024-10-20,,BILD,"FDP, die Gruenen, SPD, Lindner Christian, Djir-Sarai Bijan Dr., Heil Hubertus, Ampelkoalition, Europaeische Kommission, Buschmann Marco, texttospeech",Naechster Ampel-Zoff: FDP stoppt Lieferketten-Gesetz der SPD,Naechster Keil zwischen den Ampel-Parteien! Zwei FDP-Minister gehen auf einen SPD-Kollegen los. Es geht um das europaeische Lieferketten-Gesetz.,"Naechster Keil zwischen den Ampel-Parteien!  Die FDP verweigert ihre Zustimmung zum auf EU-Ebene bereits ausverhandelten Lieferketten-Gesetz, duepiert damit den Koalitionspartner SPD, der fuer das Gesetz gekaempft hat.  In einem Brief an Wirtschaftsverbaende (liegt BILD vor) faellen Finanzminister Christian Lindner (45) und Justizminister Marco Buschmann (46) ein verheerendes Urteil ueber das Gesetz, das eigentlich Standards bei Menschenrechten und Umweltschutz sichern soll.  Es sei zu ungenau und buerokratisch und mit erheblichem finanziellem Mehraufwand fuer deutsche Unternehmen verbunden. Und noch schlimmer: durch gesteigerte Pruef- und Sorgfaltspflichten geradezu existenzbedrohend fuer kleine und mittelstaendische Unternehmen bestimmter Branchen.  Da die FDP-Ministerien das vorliegende Verhandlungs-Ergebnis nicht mittragen, muss sich Deutschland im EU-Rat enthalten, was im Ergebnis wie eine â€šnein '-Stimme wirkt, wie die Minister schreiben. In ihrem Brief steckt auch ein vergiftetes Lob an die SPD. Arbeitsminister Hubertus Heil (51, SPD) habe bei den Verhandlungen zwischen EU-Kommission, Parlament und Mitgliedslaendern kraftvoll und engagiert gearbeitet.  Doch dann volle Breitseite von Lindner und Buschmann gegen den Kollegen Hubertus Heil: Gleichwohl kommen das Bundesministerium der Finanzen und das Bundesministerium der Justiz zu dem Ergebnis, dass das Ergebnis den Anforderungen fuer eine gute Loesung objektiv nicht entspricht. Lindner und Buschmann betonen die wirtschaftlichen Herausforderungen fuer die EU zwischen den Maechten USA und China. Sie schliessen: Im Kampf fuer unsere Werte brauchen wir als EU aber auch einen neuen Realismus und duerfen uns nicht durch buerokratische Regelungen in falscher Weise selbst fesseln. Denn damit waere niemandem geholfen. Nicht der erste Pfeil der FDP in Richtung SPD. Am selben Tag knoepfte sich der Generalsekretaer der Liberalen, Bijan Djir-Sarai (47), seine Koalitionspartner vor. Im Fokus der Attacke: SPD-Fraktionschef Rolf Muetzenich (64). Djir-Sarai unterstellte ihm und den Gruenen, dass deren Politikverstaendnis Gift fuer den Wirtschaftsstandort Deutschland sei. Schuldenpolitik und immer wiederkehrende Versuche, die Schuldenbremse zu umgehen, machten in der Ampel den Unterschied zwischen SPD und Gruenen und eben der FDP, so Djir-Sarai. ",,,,,2326,False
bild,https://www.bild.de/politik/inland/politik-inland/aufschrei-der-anstaendigen-jetzt-sprechen-die-buerger-uns-reichts-80435538.bild.html,"migration, rki, spd, cdu",2022-06-18,2022-06-18,2024-10-20,"Oliver Grothmann, Stephan Kuerthy, Michael Engelberg, Nikolaus Harbusch, Florian Kain, FRank Schneider und Albert Link",,"Berlin, Organisiertes Verbrechen, Bushido, Rassismus, Diskriminierung, Faeser Nancy, Polizei, Familienclans, Link Albert, Islamismus, Geldwaesche, Kuerthy Stephan, Harbusch Nikolaus, Grothmann Oliver, Engelberg Michael, Kain Florian",Aufschrei der Anstaendigen - Jetzt sprechen die Buerger: Uns reicht's!,"Es reicht  das sagen immer mehr von denen, die den Laden am Laufen halten. Die an diesen Staat glauben, sich fuer die Gesellschaft starkmachen.","Es rumort unter Deutschlands Buergern.  Es reicht  das sagen immer mehr von denen, die den Laden am Laufen halten. Die an diesen Staat glauben, sich fuer die Gesellschaft starkmachen. Und die oft genug die Haende ueberm Kopf zusammenschlagen, wenn sie die Nachrichten in der Zeitung lesen: â–º Da ist die Innenministerin Nancy Faeser (51, SPD), die sich Islamisten und tuerkische Nationalisten zur Preis-Verleihung ins Haus holt. â–º Da soll eine Frau wie Ferda Ataman Anti-Diskriminierungsbeauftragte werden, die nichts dabei findet, dass Menschen ohne Migrationshintergrund als Kartoffeln verspottet werden  und Heimatfreunde als Blut und Boden-Ideologen verteufelt.  â–º Und da ist der Spross eines Clan-Chefs, der mal eben 7,4 Millionen fuer die zwangsversteigerte Villa seines Vaters hinblaettert  und keiner prueft, ob das Geld aus kriminellen Geschaeften stammt, obwohl gegen ihn schon wegen Geldwaesche-Verdacht ermittelt wurde. In BILD sagen gesellschaftlich engagierte Buerger: Uns reicht's! Diplom-Kaufmann Deniz Guener (43, CDU) aus Duisburg-Marxloh: Die Clans haben in Deutschland ein zu leichtes Spiel. Deutschland ist im Allgemeinen ein Geldwaescheparadies. Dies betrifft alle organisierten kriminellen Strukturen jeglicher Art. Solange in Deutschland nicht die Beweislastumkehrpflicht in der Geldwaeschebekaempfung gilt, werden uns die Kriminellen auf der Nase tanzen. Wir werden fuer unsere laschen Geldwaeschegesetze ausgelacht. Uschi Froehmer (74) fuehrt seit 1979 das Geschaeft Tracht und Heimat in Muenchen: Das ist ein richtiger Schmarrn, was die Frau Ataman ueber Heimat sagt. Heimat ist nicht ,Blut und Boden´. Heimat bedeutet in Bayern, da fuehlen wir uns ,dahoam '. Heimat ist fuer innen und aussen, fuer den Koerper und die Seele wichtig. Es reicht mir langsam, was die Politiker in Berlin da Tag fuer Tag zusammenspinnen. Den Begriff Heimat duerfen wir auf keinen Fall aufgeben. Pfleger Mohammed Ali Slim (23), ExSoldat aus Offenburg (Mitglied der Jungen Liberalen in GrossGerau): Polizeibeamte leisten eine hervorragende Arbeit, sie setzen ihr Leben fuer uns aufs Spiel, arbeiten nachts, damit wir in Sicherheit leben koennen. Es ist untragbar, dass Menschen in Uniform angegriffen werden. Oder Dienstwagen angesteckt werden. Polizisten sind Maenner und Frauen, Vaeter und Muetter, Freund und Freundin, die sich fuer Entbehrungen bei der Berufswahl entschieden haben  was sie sich nicht gefallen lassen muessen, sind feige Angriffe in der oeffentlichkeit. Immer wieder werden Beamte Zielscheibe von brutaler Gewalt. Und die Politik? Duckt sich feige weg. Die Ampel will jetzt eine Frau zur Beauftragten fuer Antidiskriminierung machen, die nichts dagegen hat, Deutsche ohne Migrationshintergrund als Kartoffel zu verunglimpfen. Deutsche duerfen also beleidigt werden, weil sie Deutsche sind? Ist das Regierungsmeinung? Solche Aussagen tragen zur Spaltung bei. Der Paedagoge Josef Kraus (72, Ergolding) war 30 Jahre Praesident des deutschen Lehrerverbandes. Er sagt: Wer das Geschehen auf deutschen Schulhoefen kennt, den darf der Vorfall im Innenministerium nicht verwundern. An Schulen mit einem hohen Anteil muslimischer Schueler sind Einschuechterungen von Lehrerinnen oder Bedrohungen von Geschichtslehrern, die den Voelkermord an den Armeniern im Unterricht behandeln wollen, an der Tagesordnung. Geboten waere es, dass die Ministerin ab sofort die auffaelligen Teilnehmer des Verfassungsschueler-Projektes beobachten laesst. Doch dazu wird es nicht kommen: Es scheint, als habe Frau Faeser heimlich ein Herz fuer linksradikale oder islamistische Jugendliche. Es ist zum Verzweifeln! Polizist Manuel Ostermann (31, Warendorf), stellvertretender Chef der Bundespolizeigewerkschaft: Deutschland hat der organisierten Kriminalitaet viel zu lange tatenlos zugeguckt. Die Clans sehen dieses Land als Beute an und denken ueberhaupt nicht daran, sich an Recht und Gesetz zu halten. Jeder Tag der Untaetigkeit ist fatal und wird das strukturell gewachsene Problem der organisierten Kriminalitaet weiter staerken. Ich erwarte von der Politik jetzt null Toleranz und ein stringentes Vorgehen. Schluss mit der Untaetigkeit!",,,,,4146,False
bild,https://www.bild.de/politik/inland/politik-inland/pistorius-sieht-darin-kein-problem-bundeswehr-kauft-feuerwehr-autos-bei-china-fi-83870492.bild.html,"spd, inflation, cdu",2023-05-11,2023-05-11,2024-10-20,Karina Moessbauer ,,"Bundeswehr, texttospeech",Verteidigungsministerium sieht kein Problem: Bundeswehr  bekommt Feuerwehr-Autos von China-Firma,Die Bundeswehr bestellt neue Loeschfahrzeuge  ausgerechnet bei einer China-Firma!,"Verteidigungsminister Boris Pistorius (63, SPD) treibt die Beschaffung voran. Ein Posten auf der Bestellliste: neue Loeschfahrzeuge.  Brisant: Dieser Bundeswehr-Auftrag geht indirekt nach China. Hauptauftragnehmer ist die Albert Ziegler GmbH. Der Hersteller sitzt zwar in Deutschland (Giengen), gehoert inzwischen aber zum chinesischen Unternehmen China International Marine Containers Group. Am Mittwoch hatten Haushalts- und Verteidigungsausschuss die Beschaffung von 28 neuen Hilfeleistungsloeschfahrzeugen beschlossen. Bis 2027 sind dazu insgesamt 36 Millionen Euro eingeplant, wie aus der 25-Mio-Euro-Vorlage hervorgeht (liegt BILD vor).  Dort heisst es: Die Fahrzeuge dienen den militaÌˆrischen BrandschutzkraÌˆften in allen EinsatzlaÌˆndern der Bundeswehr sowie im Grundbetrieb. Die Fahrzeuge werden laut Auskunft des BMVg dringend zur AbloÌˆsung der einsatzrelevanten FeuerloÌˆsch-Kraftfahrzeuge (FLKfz) 3500 benoÌˆtigt.  Die Fahrzeuge, die aktuell im Dienst sind, sind 30 Jahre alt. Die Instandsetzung wird als nicht mehr wirtschaftlich bezeichnet. Wie auch bei anderen Bestellungen, z.B. Puma-Schuetzenpanzer, musste das BMVg nun inflationsbedingte Preissteigerungen einrechnen.  Als Unterauftragnehmerin fungiert zwar die Rheinmetall-Tochter Rheinmetall Military Vehicles GmbH,  dennoch gibt es Kritik an der Vergabe.  Der Vorgang zeigt, dass die Bundesregierung immer noch nicht in der Zeitenwende angekommen ist, kritisiert Verteidigungsexpertin Serap Gueler (41, CDU) in BILD.  In so einem sensiblen Sicherheitsbereich wie unserer Bundeswehr oder kritischen Infrastruktur darf es keinen Zugang mehr fuer auslaendische Unternehmen geben, die sicherheitspolitisch nicht zu unseren Verbuendeten gehoeren. Dies gilt ganz besonders fuer chinesische Unternehmen.  Gueler fordert die Ampel auf, hier umgehend fuer einen neuen Rechtsrahmen zu sorgen. In Pistorius' Haus sieht man das offenbar anders. Das Verteidigungsministerium (BMVg) sieht in der Verbindung nach Peking kein Hindernis fuer einen Vertragsabschluss.  Laut Papier verweist das BMVg zwar auf die Besonderheit: Die Albert Ziegler GmbH war in das 2011 aufgedeckte Feuerwehrfahrzeugkartell verstrickt, geriet dann wegen einer Geldstrafe in finanzielle Schieflage und wurde in Folge einer Insolvenz von einem chinesischen Unternehmen uebernommen, wie es in der Vorlage aus dem Finanzministerium heisst.  Das Argument: In den Vertragsverhandlungen habe die Firma ein Best and Final Offer abgegeben, also das beste Angebot gemacht.",,,,,2497,False
bild,https://www.bild.de/politik/inland/politik-inland/faeser-riskiert-den-zusammenhalt-landraete-aufstand-gegen-innenministerin-83487732.bild.html,"migration, integration, grenzen, spd, cdu",2023-04-08,2023-04-08,2024-10-20,Zara Riffler und Daniela Pfad,,"innenministerium, Politik, Politik-Inland, migration, Faeser Nancy, Migrationspolitik, Fluechtling, asyl, Fluechtlingskrise, Fluechtlinge",Faeser riskiert den Zusammenhalt! Landraete-Aufstand gegen Innenministerin,"Nachdem die Bundesinnenministerin sich gegen mehr Geld fuer Kommunen aussprach, kritisieren Landraete Faesers Fluechtlings-Politik als Realitaetsverweigerung","Wirbel um Aussagen von Bundesinnenministerin Nancy Faeser (52, SPD)! Innenministerin Nancy Faeser sprach sich in einem Interview mit Funke Medien gegen eine Migrations-Begrenzung aus und zeigte wenig Verstaendnis fuer die Forderungen der Kommunen fuer mehr Geld fuer die Unterbringung von Fluechtlingen und Migranten. Landraete vor Ort sind entsetzt! Sie fuehlen sich von Deutschland Innenministerin in Stich gelassen, nicht ernst genommen. Denn: Der Fluechtlingszustrom haelt weiter an. Ob Unterkuenfte, Kitas oder Gelder  die Kapazitaeten werden mit jeder Woche knapper. Seit Monaten fordern die Kommunen von der Ministerin konkrete Loesungen.  Ich nenne das Realitaetsverweigerung!, bilanziert Landrat Tino Schomann (CDU) aus Nordwestmecklenburg in BILD. Die Bundesinnenministerin sieht weiter nicht die Probleme und zeigt damit, dass sie fern ab der Realitaet die Kommunen weiter alleine laesst. Tino Schomann mahnt deutlich: Wenn der Bund weiter so agiert, laeuft alles noch schneller in eine Situation, die man dann so schnell nicht wieder einfangen kann. Humanitaet kennt keine Grenzen, aber Wohnflaechen und die Ressourcen. Ich bin mehr als erschuettert ueber so eine verfehlte Politik, erklaert Landrat Schomann. â–º Landraetin Tanja Schweiger (44, Freie Waehler) aus Regensburg ist sauer. Sie zu BILD: Einerseits will Frau Faeser nicht den Zustrom begrenzen, auf ausschliesslich die Menschen, die Bleiberecht bei uns bekommen. Andererseits: lehne Faeser die Verantwortung fuer die Integration der Vielzahl der Migranten ab und waelzt diese Herausforderung auf den Ruecken der Zivilgesellschaft ab.  Das ist Politik aus dem Elfenbeinturm und gefaehrdet gesellschaftlichen Zusammenhalt in Deutschland! Landrat Christian Engelhardt (50, CDU) aus Bensheim (Hessen) spricht Klartext in BILD ueber die Situation vor Ort. â–º Die Problematik vor Ort ist akut. Die Situation spitzt sich mit jeder Woche, mit jeder Zuweisung von Gefluechteten mehr zu. Es fehlt an: Unterkuenften, Klassenraeumen und Kitaplaetzen. Sowie an Personal fuer die Antragsbearbeitung, Deutschkurse, Schulunterricht und Betreuung.  In dieser Situation koennen wir KEINE Integrationsarbeit leisten, sondern die gefluechteten Menschen lediglich notduerftig mit allem Lebensnotwendigen versorgen, mahnt er.  Vom Bund komme viel zu wenig Hilfe, kritisiert Engelhardt. Seit Monaten wuerden die Kommunen darauf aufmerksam machen, dass sie die Aufnahme und Integration der Gefluechteten nicht mehr stemmen koennen. Eine irgendwie fuer uns spuerbare Hilfe ist bisher nicht passiert!. Auch Landrat Jens Marco Scherf (48, Gruene) aus Miltenberg (Bayern) kann die Aussagen der Innenministerin nicht nachvollziehen.  Wir haben Mangel bei Wohnraum, Kitas, Schulen, Sprach- und Integrationskursen  einfach ALLES ist knapp! Unter dem Strich stossen Frau Faesers Aussagen einen von den Kopf. Sie negieren die prekaere Situation vor Ort, meint der Gruenen-Landrat. Frau Faeser vermittelt den Eindruck, dass sie die Situation nicht wirklich verstanden hat, sagt Scherf. Der Landrat erklaert in Richtung Berlin das Problem:  â–º Unsere umfangreichen Kosten werden nicht erstattet. Wir bleiben auf Sach- und Personalkosten sitzen. Irgendwann muessen die Kommunen sich entscheiden, wofuer sie ihr Geld ausgeben  dann wird Geld an anderer wichtiger Stelle fehlen. â–º Die Situation Migration zu begrenzen, sei schwierig. Er koennte nicht fuer alle Landkreise sprechen, ABER: Die Lage wird auch noch in anderen Regionen prekaerer werden. Denn: In vielen Landkreisen wie bei uns kommen 25 bis 30 Menschen pro Woche. Unsere Notunterkunft platzt, wir muessen eine zweite suchen! Es wird einfach zu viel fuer uns. Das was die grosse Masse ausmacht, sind Menschen aus Afghanistan, Syrien und bisschen aus afrikanischen Staaten, klaert der Gruenen-Landrat auf.",,,,,3806,False
bild,https://www.bild.de/politik/kolumnen/kolumne/schweigen-zu-kreml-gerd-wut-auf-ukraine-botschafter-das-ist-niedertraechtig-spd-79805480.bild.html,"spd, verschwoerungstheorien, olaf scholz",2022-04-18,2022-04-18,2024-10-20,Paul Ronzheimer,,"Russland, Ukraine, putin wladimir, Scholz Olaf, Krim, Ukraine-Konflikt","Kommentar: Schweigen zu Kreml-Gerd, Wut auf Botschafter  Das ist niedertraechtig, SPD!","Die SPD schweigt zu Gerhard Schroeder, ist aber wuetend auf den Botschafter der Ukraine.","Die kalte Selbstgerechtigkeit einiger SPD-Politiker ist nicht zu fassen! Waehrend wir in Kiew wieder Sirenen-Alarm hoeren, Lemberg angegriffen und Mariupol dem Erdboden gleichgemacht wird, geht Aydan oezoguz, Abgeordnete, Vizepraesidentin des Bundestages und Mitglied im SPD-Parteivorstand, auf den ukrainischen Botschafter Andrij Melnyk los. Via Twitter schreibt sie:  In der Ukraine tobt dieser furchtbare Krieg und wir stehen fest an der Seite der Ukrainer:innen. Leider attackiert waehrend dessen der ukrainische Botschafter immer heftiger deutsche Politiker:innen. Seinem Volk hilft er damit nicht. Wir sollten uns davon nicht irritieren lassen. oezoguz ist nicht die einzige SPD-Politikerin, die Melnyk kritisiert, auch Ex-Aussenminister Sigmar Gabriel griff ihn an, warf dem Botschafter gar vor, Verschwoerungstheorien zu verbreiten. Ausgerechnet aus der Partei, die ganz entschieden fuer die Putin-Verharmlosung, Nord Stream 2 und mangelnde Sanktionen gegen Russland verantwortlich ist, werden dem Botschafter Verschwoerungstheorien vorgeworfen.  Das ist einfach bodenlos! Das ist niedertraechtig, SPD! Botschafter Melnyk, der fuer sein Land kaempft, wird von der SPD taeglich angegriffen. Doch zu den eigenen Skandalen, die jedem Sozialdemokraten die Schamroete ins Gesicht treiben sollten, wird geschwiegen.  Gas-Lobbyist Gerhard Schroeder kann sich weiter die Taschen von einem Kriegsverbrecher vollmachen lassen  aus der SPD ist kaum noch Kritik an ihm zu hoeren, ueber ein Ausschlussverfahren wird von Spitzengenossen nicht mehr gesprochen. Die Ministerpraesidentin von Mecklenburg-Vorpommern, Manuela Schwesig, liess sich ihre Politik vom Kreml-Konzern Gazprom diktieren, immer neue Enthuellungen werden dazu bekannt. Kritik aus der SPD? Fehlanzeige! Die Politiker der Kanzlerpartei wollen keine schweren Waffen an die Ukraine liefern, sie wollen kein oel- und Gasembargo  und sie wollen nicht an ihre verheerenden Fehler in der Russlandpolitik erinnert werden. Damit werden sie nicht durchkommen! Wo ist eigentlich Kanzler Olaf Scholz? Oder findet er es sogar gut, wenn Gabriel und andere den Botschafter angreifen? Wo ist SPD-Chef Lars Klingbeil, wo ist Generalsekretaer Kevin Kuehnert? Haben sie ihre Partei nicht im Griff oder finden sie es ebenfalls gut, wenn nicht ueber Krieg und Gas-Gerd, sondern ueber den ukrainischen Botschafter gesprochen wird? Es reicht nicht, dass die SPD und alle ihre fuehrenden Genossen gesagt haben, sie haetten sich in Putin geirrt. Sie muessen endlich glaubwuerdig ihre Politik und ihre Rhetorik veraendern. Alles andere wird Deutschlands Glaubwuerdigkeit in der Welt dauerhaft beschaedigen.",,,,,2642,False
bild,https://www.bild.de/unterhaltung/leute/leute/kanye-west-skandale-werdegang-privates-im-ueberblick-80893228.bild.html,verschwoerungstheorien,2023-06-22,2023-06-22,2024-10-20,,BILD,"West Kanye, Kardashian Kim, SEO-nicht-benutzen, texttospeech, personen-steckbrief","Kanye West: Skandale, Werdegang, Privates im Ueberblick","Kanye West, der Schlagzeilen-Stammgast. Alle Infos zu seinem Werdegang, was mit Kim Kardashian passiert ist & alle Skandale der letzten Jahre im Ueberblick!","Kanye West gilt als einer der praegendsten Musiker des 21. Jahrhunderts. Seine Kreativitaet brachte ihm mehr als eine Milliarde Dollar ein.  Gerade weil er so einen unglaublichen Erfolg hat, tolerierte die oeffentlichkeit seit Jahren seine Kapriolen. Doch inzwischen stellt sich die Frage: Wie viel Wahnsinn kann man mit seiner Genialitaet rechtfertigen? Lesen Sie hier alles ueber den erfolgreichen Musiker, Designer und Unternehmer! Bereits frueh entdeckte Kanye seine Leidenschaft zur Musik: In der dritten Klasse schrieb und rappte er eigene Songs. Er wuchs mit seiner alleinerziehenden Mutter Donda West in einem gutbuergerlichen Haushalt auf. Seine Mutter war Universitaetsprofessorin und hatte grossen Einfluss auf sein Leben. Nach seinem Highschool-Abschluss begann er auf Draengen seiner Mutter ein Studium an der American Academy of Art und der Chicago State University. Um sich hauptberuflich seiner Musik widmen zu koennen, brach er das Studium jedoch ab.  Seine Karriere startete, als er fuer verschiedene erfolgreiche Kuenstler als Producer taetig war. Sein Markenzeichen: Kanye benutzte die bekannten Melodien aus beinahe vergessenen Soul-Hits und verknuepfte sie mit modernen Elementen. Seine Beats weckten in Hoerern eine nostalgische Erinnerung, die man schwer zuordnen kann.  2003 veroeffentlichte Kanye seine erste eigene Solosingle Through the Wire. Ein Jahr spaeter folgte sein Debuet-Album The College Dropout, gepraegt von seinem Studienabbruch.  Mittlerweile hat Kanye West insgesamt elf Alben veroeffentlicht, die vor allem in Grossbritannien sehr erfolgreich waren. Vier seiner Alben erreichten dort Goldstatus. Kanye gilt als einer der praegendsten Musiker in der Hip-Hop-Szene.  Uebrigens hat sich Kanye im Oktober 2021 offiziell in Ye umbenennen lassen. Aber er stellt sich bereits seit 2018 mit diesem Namen in der oeffentlichkeit vor. ",,,,,1867,False
bild,https://www.bild.de/politik/inland/politik-inland/doppel-belastung-in-fluechtlingskrise-ist-nancy-faeser-ueberfordert-83212372.bild.html,"migration, csu, grenzen, abschiebung, spd, fluechtlingskrise, cdu, olaf scholz",2023-03-16,2023-03-16,2024-10-20,Zara Riffler,,"Politik, Politik-Inland, Faeser Nancy, Migrationspolitik, illegale Migration, Fluechtling, asyl, Fluechtlingskrise, Fluechtlinge, texttospeech",Doppel-Belastung in Fluechtlingskrise: Ist Nancy Faeser ueberfordert?,Wahlkampf und Fluechtlingskrise: Die CDU attackiert Innenministerin Faeser und wirft ihr Ueberforderung vor.,"Werden Wahlkampf UND Fluechtlingskrise zu viel fuer Nancy Faeser (52, SPD)? Die Bundesinnenministerin muss gleich an zwei Fronten ihr Bestes geben: In Hessen, wo sie im Oktober 2023 Ministerpraesidentin werden will, kaempft sie gegen schlechte Umfragen. Zuletzt lag ihre Partei nur auf Platz DREI   mit 17 Prozent. Gleichzeitig muss sie in Berlin die Fluechtlingskrise bekaempfen, illegale Migration stoppen und den aechzenden Kommunen helfen. Ist DAS ueberhaupt zu schaffen? Die CDU wirft der Innenministerin jetzt Ueberforderung vor  und der Kanzler macht Migration zur Chefsache! Thorsten Frei (49, CDU), Parlamentarischer Geschaeftsfuehrer der Unions-Fraktion, erklaert in BILD, dass sich so eine Aufgabe nur ganz oder gar nicht stemmen lasse.  Es zeigt sich nun: Mit ihrer halbherzigen Entscheidung fuer Hessen kann Frau Faeser ihrem Wahlkampf keinen Rueckenwind verleihen. Wer einen Machtwechsel will, muss ihn vor Ort hart erkaempfen. Mit ihrem Spagat hat sie sich keinen Gefallen getan, so Frei. Denn: Faesers Fluechtlingsgipfel im Februar entpuppte sich zur Luftnummer. Trotz Hilferufen von Ministern und Landraeten gab es weder konkrete Sofort-Massnahmen, um illegale Migration zu begrenzen und schneller abzuschieben. Noch gab es mehr Geld fuer Unterkuenfte und Versorgung. â–º Die Folge: Die Laender und Kommunen wurden groesstenteils mit der Krise alleine gelassen  insbesondere finanziell. Die Kapazitaeten sind seit Monaten am Limit. Und das Geld reicht nicht mehr aus.  Auch bei Rueckfuehrungen gibt es kein Tempo. Nur ein Drittel aller abgelehnten Asylbewerber wurde 2022 abgeschoben. 23 337 Abschiebungen konnten nicht vollstreckt werden. Stattdessen lehnt Faeser die Vorhaben der EU-Innenminister ab, Visa als Druckmittel gegen Herkunftslaendern zu nutzen, um Abschiebungen zu ermoeglichen.  Jetzt macht der Kanzler Olaf Scholz (64, SPD) offiziell die Fluechtlingskrise zur Chef-Sache. Fuer den 10. Mai lud Scholz die Laender zu einer Sonder-Ministerpraesidentenkonferenz (MPK) ins Kanzleramt ein. Eine Sprecherin der Bundesregierung erklaerte, dies ginge auf Initiative von Scholz selbst zurueck.  Kein gutes Signal fuer Faeser! Alexander Throm (54), innenpolitische Sprecher der CDU/CSU-Bundestagsfraktion zu BILD: Endlich macht Olaf Scholz die Migrationskrise zur Chefsache. Denn offenbar hat Innenministerin Faeser die Lage nicht unter Kontrolle. Ganz offensichtlich ist die Doppel-Belastung zu viel fuer Faeser: nicht die Migrationskrise im Griff  und in Hessen nur auf Platz drei! Auf der Sonder-MPK soll vor allem ueber die Kosten der Unterbringung sowie Versorgung von Fluechtlingen und Migranten beraten werden.  â–º In einer Beschlussvorlage (liegt BILD vor) fordern die Regierungschefinnen und Regierungschefs der Laender, dass der Bund die bereits fuer 2023 zugesagten Bundesmittel kurzfristig zur Verfuegung stellen soll. Auch brauche es darueber hinaus mehr Geld.  Zudem ist darin die dringende Bitte verfasst, dass die Bundesregierung die Voraussetzungen fuer Rueckfuehrungen schaffen muss. Dafuer fordern die Laender, mit den Herkunftsstaaten stabile Ruecknahme-Vereinbarungen abzuschliessen. Innenexperte Christoph de Vries (48, CDU) zu BILD: Dass Olaf Scholz es zur Chefsache macht, ist ein Beleg fuer die Ueberforderung der Innenministerin. Und jeder Tag im Amt, zeigt den Buergern in Hessen, dass sie keine geeignete Ministerpraesidentin ist.",,,,,3381,False
