news_outlet,provenance,query_keywords,creation_date,last_modified,crawl_date,author_person,author_organization,news_keywords,content_title,content_description,content_body,Fake News,Extreme bias,clickbait,credible,body_len,has_label
bild,https://www.bild.de/politik/inland/politik-inland/wirtschaftsminister-auf-usa-tour-schliesst-habeck-heute-den-anti-trump-pakt-87428300.bild.html,"wirtschaftswachstum, inflation, robert habeck",2024-03-07,2024-03-07,2024-10-20,Felix Rupprecht (zZt. in Washington),,"Trump Donald, Biden Joe, USA, Wirtschaft, Obama Barack, China, Handel, Habeck Robert Dr., texttospeech",Wirtschaftsminister auf USA-Tour: Schliesst Habeck heute den Anti-Trump-Pakt?,Gelingt Robert Habeck der Anti-Trump-Pakt in den USA? Der Wirtschaftsminister ist mit einer Wirtschaftsdelegation die USA gereist.,"Gelingt Robert Habeck der Anti-Trump-Pakt in den USA? Wirtschaftsminister Robert Habeck (54, Gruene) flog am Mittwoch mit einer Wirtschaftsdelegation in die Vereinigten Staaten. Ziel: Exporte ankurbeln, weniger Abschottung, mehr transatlantische Zusammenarbeit.  ABER: Kurz nach dem Super Tuesday scheint das in weiter Ferne: Der Erdrutsch-Sieg fuer Donald Trump (77) bei den Vorwahlen hat dessen Kandidatur fuer die Republikaner faktisch besiegelt. Wird Trump ein zweites Mal US-Praesident, haette das gravierende Folgen fuer die deutsche Wirtschaft.  Das kann nicht im Interesse der Amerikaner sein. Nationalismus schadet der Wirtschaft, schadet dem Frieden und den Menschen, so Habeck in der Nacht zu Donnerstag (deutscher Zeit) in der Deutschen Botschaft in Washington. Rueckblickend koenne Habeck sagen, dass Trump alle Kooperationsformate kaputt gehauen habe.  Hintergrund: Der amerikanische Markt ist einer der wichtigsten auslaÌˆndischen Absatzmaerkte fuÌˆr deutsche Unternehmen. Das Warenhandelsvolumen mit den USA stieg im vergangenen Jahr um ca. 1,1 Prozent auf uÌˆber 252 Milliarden Euro (im Vergleich: deutscher Warenhandel mit China liegt bei minus 15,5 Prozent, betrug 2023 insgesamt 253,1 Milliarden Euro).  Trumps geplante Zoelle auf Importe koennten ueber eine vierjaehrige Amtszeit gerechnet insgesamt einen Verlust von bis zu 150 Milliarden Euro fuer die deutsche Wirtschaft bedeuten. Das zeigt eine neue Studie des Instituts der deutschen Wirtschaft (IW). Der Handel zwischen Deutschland und den USA muss den Unternehmen wieder leichter gemacht werden! Habeck will dafuer Gleichbehandlung fuÌˆr deutsche E-Autos bei der FoÌˆrderung in den USA erreichen. Das Abkommen wird aktuell noch verhandelt. Vermeidung eines Subventionswettlaufs, hiess es vom Wirtschaftsministerium. â–º Eine vollstaendige Beendigung der US-ZoÌˆlle und der EU-GegenzoÌˆlle fuer Stahl und Aluminium soll kommen.  Daneben stehen gemeinsames Handeln in der Industriepolitik, Sicherung von Lieferketten, und Exportkontrolle auf der Agenda. Industrie-Boss Siegfried Russwurm (60) sagte in Washington zu BILD: Ich fuerchte, dass der Anti-Trump-Pakt nicht kommen wird. Dass etwa Batterien oder andere Rohstoffe laut Inflation Reduction Act aus den USA kommen muessten, sei fuer alle Marktteilnehmer schwer zu erfuellen.  Heisst: Die USA sind auch ohne Trump auf dem Weg in die Eigenbroetelei. Es gebe leider auch unter dem amtierenden US-Praesidenten Joe Biden Abschottungstendenzen, sagte Habeck. Am Ende wuerden aber beide Seiten profitieren, wenn es gelingt, die beiden grossen Wirtschaftsraeume stark zusammen zu entwickeln. Die deutsche Wirtschaft muss Habeck dabei als Junior-Partner praesentieren: Nach der Rezession im Jahr 2023 (-0,3 Prozent Wirtschaftswachstum) rechnet die Ampel in diesem Jahr mit einem Mini-Wachstum von gerade mal 0,2 Prozent. Die USA lagen zuletzt bei 2,5 Prozent. Bundesminister Habeck wird am Donnerstag in Washington u. a. US-Handelsministerin Gina Raimondo (52), Finanzministerin Janet Yellen (77) und Energieministerin Jennifer Granholm  (65) treffen.",,,,,3074,False
bild,https://www.bild.de/politik/inland/politik-inland/polizei-spricht-von-fake-news-rassistischer-mord-war-nur-erfunden-86536820.bild.html,"rassismus, israel",2023-12-24,2023-12-24,2024-10-20,,BILD,"Hamburg, Polizei, Hamas, Palaestinenser",Polizei spricht von Fake News: Rassistischer Mord war nur erfunden,Aufregung unter arabischen Aktivisten! Doch offenbar gab es keinen Mord. Die Polizei ermittelt wegen Selbstmord.,"Aufregung unter arabischen Aktivisten und Israel-Hassern! Ein Beitrag auf X, ehemals Twitter, wurde mehr als 18 000 Mal geteilt  propalaestinensische Aktivisten berichten empoert ueber einen Mord an einem Jordanier. Die Polizei spricht von Fake News. â–º Hintergrund: Am Samstag wurde vor allem durch die palaestinensisch-arabische Gemeinschaft auf X der Fall des jordanischen Studenten Mohammad B. (21) geteilt, der laut Aussage der Nutzerin Shahd Hm aufgrund seiner antiisraelischen Beitraege erschossen worden sei. Dies sei staatlich subventionierter Rassismus, fuegte sie hinzu. â–º Die Hamburger Polizei widerspricht: Ein solcher Mord hat laut den Behoerden nicht stattgefunden. Die Hamburger Polizei meldete sich noch am Samstag auf X zu Wort und teilte mit, dass es sich um Fake News handele. Laut Informationen des Nachrichtenportals t-online hat sich der junge Student in Hamburg im Hanseatic Gun Club selbst durch einen Kopfschuss getoetet. Die Polizei Hamburg bestaetigte demnach auf Anfrage des Nachrichtenportals, dass sich ein 21-jaehriger Jordanier am Dienstag mit einer Waffe in den Kopf geschossen habe und an den Folgen der Verletzung gestorben sei. Dabei handelt es sich nach Informationen von t-online um den Mann, der zuvor auf X als Mordopfer dargestellt wurde. Holger Vehren, Sprecher der Hamburger Polizei, sagte t-online, es gebe derzeit keine Hinweise auf Fremdverschulden und keine Anzeichen fuer extremistische Hintergruende. Die Staatsanwaltschaft und das LKA Hamburg ermitteln. So sei das auch der jordanischen Botschaft mitgeteilt worden. â–º Das jordanische Aussenministerium hatte zuvor eine Stellungnahme zu dem Fall veroeffentlicht. Demnach werde der Tod des jordanischen Staatsbuergers untersucht, die Botschaft sei in Kontakt mit den deutschen Behoerden. In der Stellungnahme war von einem Mord nicht die Rede. Arabische Medien und Israel-feindliche Social-Media-Nutzer berichteten jedoch davon, dass die Familie des Verstorbenen die Mitteilung erhalten habe, ihr Angehoeriger sei mit zwei Schuessen in den Kopf praktisch hingerichtet worden. Diese Informationen lassen sich nicht unabhaengig ueberpruefen. Der jordanische Student sei zudem aufgrund seiner propalaestinensischen und Israel-feindlichen Beitraege in den Sozialen Medien zuvor bedroht worden. Nachdem die Hamburger Polizei die Darstellung als Mord am Samstagabend als Fake News zurueckwies und mitteilte, dass es keine Hinweise auf ein Toetungsdelikt gebe, welches hiermit in Zusammenhang gebracht werden kann, gab es Vorwuerfe von propalaestinensischen Aktivisten, man wuerde einen Mord vertuschen. Brisant: Im Hanseatic Gun Club, wo sich der Student offenbar selbst erschoss, lernte bereits der Amoklaeufer Philipp F. das Schiessen, der am 9. Maerz sieben Menschen und sich selbst in einem Saal der Zeugen Jehovas toetete.",,,,,2825,False
bild,https://www.bild.de/geld/wirtschaft/wirtschaft/wirtschafts-prognose-fuer-2024-ist-unser-wohlstand-bedroht-86564196.bild.html,"klimaschutz, inflation",2024-01-01,2024-01-01,2024-10-20,Jasper Bitter und Patricia Platiel,,,Wirtschafts-Prognose fuer 2024: Ist unser Wohlstand bedroht?,"Wie entwickeln sich Deutschlands wichtigste Branchen, etwa die Automobilindustrie? Werden die Preise weiter steigen?","Berlin  Nahezu ALLE machen sich grosse Sorgen: Laut einer Umfrage unter 1200 Konsumenten sagen 95 Prozent, sie erwarteten fuer 2024 eine Verschlechterung der allgemeinen Wirtschaftslage in Deutschland.  Und auch wenn die Inflation zuletzt deutlich zurueckging (im November lag die Teuerungsrate mit 3,2 Prozent auf dem niedrigsten Stand seit rund zweieinhalb Jahren), so spueren viele noch immer die hoeheren Preise bei Lebensmittel und Energie. Was also erwartet uns fuer 2024? Wie blicken wichtige Wirtschaftskoepfe auf ihre Branchen? Und was braucht Deutschland, um besser zu werden? BjÃ¸rn Gulden (58), Vorstandsvorsitzender von adidas:  Ich hoffe, die Stimmung in Deutschland wird im naechsten Jahr besser. Ich glaube und hoffe, dass wir mit der Fussball-Europameisterschaft in Deutschland wieder ein Sommermaerchen wie 2006 erleben werden. Das wird auch dem Konsum helfen. 2024 soll das Jahr des Sports sein. Mit der EM in Deutschland, den Olympischen Spielen in Paris und der Copa AmÃ©rica in den USA haben wir drei Mega-Sportevents. Das wird gut fuer die Stimmung, gut fuer das Geschaeft, und es wird unserem Turnaround helfen.  Ich glaube nicht, dass der Wohlstand in Deutschland in Gefahr ist. Wir werden alle ein bisschen mehr anpacken muessen, die Politik muss Dinge ein wenig schneller entscheiden, und ihr, die Medien, duerft euch nicht nur auf das Negative fokussieren. Wir brauchen in Deutschland mehr Fokus auf das Positive. Als Norweger kann ich es ja sagen: es ist nicht alles so schlecht in Deutschland! Oliver Blume (55), CEO von VW/Porsche : ""Deutsche Autos geniessen hohes Ansehen, weltweit. Unsere Marken haben Tradition und Strahlkraft. Die deutschen Autokonzerne stehen fuer Pioniergeist, Praezision, fantastische Marken und jahrzehntelange Erfahrungen und Erfolge. Wir wissen, Groessenvorteile ueber Technologien, Plattformen und Komponenten zu skalieren. Dadurch sind wir effizient und haben die Kraft fuer Zukunftsinvestitionen. All das basiert auf einer massgeblichen Grundlage: hochqualifizierte und motivierte Menschen in unseren Unternehmen in Deutschland. Sie bringen unsere Wirtschaft voran. Unser System der dualen Berufsausbildung ist weltweit hochgeachtet. Unsere Universitaeten sind hoch angesehen. Unsere Forschungseinrichtungen geniessen vielfach Weltruhm. Die Innovationskraft unseres Landes ist ungebrochen. Der Erfindungsreichtum unserer Unternehmen ist das Erfolgsrezept. Es gibt viele Newcomer im Markt, die schnell auf aktuelle Trends reagieren. Der Wettbewerb spornt uns an und darueber entstehen wiederum Innovationen. Wir haben die grosse Chance, unsere Tradition weiterzuentwickeln. Als Autoindustrie muessen wir dabei mit unseren Staerken agieren. Wichtig ist, dass wir uns fokussieren und Tempo machen. Wichtig ist es, in Chancen zu denken. Auf Erfolge aufbauen, aus Niederlagen lernen. Wie im Sport. Erfolg ist Teamarbeit. Und der Weg dahin eine Gemeinschaftsaufgabe  von Wirtschaft, Politik und Gesellschaft."" Marie-Christine Ostermann (45), Praesidentin der Familienunternehmer: ""Wenn jetzt das Wachstumschancengesetz durch den Bundesrat kaeme, koennten wir optimistischer sein. Denn miese Standortbedingungen vertreiben Unternehmen ins Ausland. So schrumpft unsere Wirtschaftskraft hierzulande. Die Bundesregierung ist im Zugzwang, sie muss das Ruder rumreissen. Anfaenge sind mit dem Haushaltskompromiss gemacht. 2024 wird fuer viele Familienunternehmer und fuer die Bundesregierung zum Lackmustest  wenn sich die Bedingungen hier nicht merklich bessern, werden Investitionen staerker ins Ausland fliessen. Die letzten Jahre haben gezeigt, dass zu den Problemen im Land jederzeit grosse Krisen hinzu kommen koennen. Darauf sollten wir gefasst sein und nicht jedes Mal panikartig nachsteuern muessen. Mit Weitsicht und generationengerechter Politik sind unsere Familienunternehmen schon durch manche Krise gekommen. Daran sollte sich die Regierung ein Beispiel nehmen. Ich glaube, dass der Wohlstand in Deutschland in Gefahr ist. In den letzten Jahren wurde uns vorgegaukelt, dass alle Probleme mit mehr Geld loesbar seien.  Das ist mitnichten der Fall, wie auch das Haushaltsurteil zeigt. Buerokratiestau, hohe Rentenverpflichtungen, Lehrer und allgemein Fach- und Arbeitskraeftemangel sind alles Probleme, fuer die es grundlegende Reformen braucht. Der Regierung muss klar sein, dass vor dem Ausgeben erst das Erwirtschaften kommt und das klappt nur, wenn die Rahmenbedingungen hier stimmen."" Janna Ensthaler (40), Unternehmerin und ""Hoehle der Loewen""- Investorin: ""Meine Prognose: Das Wirtschaftsjahr 2024 wird etwas besser als 2022 und 2023, aber insgesamt durchwachsen. Die Energiepreise und Zinsen werden erstmal hoch bleiben und es gibt weiterhin viel zu wenig Investitionsbereitschaft. Die Inflation scheint aber gezaehmt und die Loehne steigen wohl staerker als die Preise, was dem Konsum hilft - das ist der Lichtblick.  Ausserdem gibt es grosse politische Risiken fuer die Wirtschaft im naechsten Jahr. Gleich drei Bundeslaender koennten unregierbar werden im Herbst. Und wenn Trump die US-Wahlen gewinnt, droht der EU ein neuer Handelskrieg, der insbesondere Deutschland treffen wuerde. Unser Unternehmen investiert in junge Technologieunternehmen. Die guten News sind: Die Innovationskraft Deutscher Start-ups war nie staerker als heute. Allerdings sind hohe Zinsen Gift fuer Folgeinvestitionen, wodurch manches tolle Projekt scheitert. Das ist gerade jetzt besonders schlimm, weil mit KI und in der Energiewirtschaft neue Mega-Technologien entstehen und sich aktuell entscheidet, ob Deutschland wie bei der Internet-Welle wieder nur zuschaut oder diesmal aktiv mitspielt.  Droht in Deutschland ein Wohlstandsverlust? Wenn wir nichts aendern, dann ja. Deutschland braucht eine neue Dynamik und ein Geschaeftsmodell, das nicht mehr so stark vom Export abhaengt.  Ein erster konkreter Schritt waeren endlich vernuenftige, unbuerokratische Anreize beim Wohnungsbau. Und vielleicht sollten wir weniger Entwicklungshilfe in anderen, wirtschaftlich starken G20-Staaten betreiben, und lieber Infrastruktur in Deutschland finanzieren. Und schliesslich braucht es auch wieder einen besseren Brand, um als Standort wieder attraktiv zu werden. Mittlerweile werden wir in der Welt zunehmend als einer dieser seltsamen Orte wahrgenommen, der Atomkraftwerke abschaltet und mit gendern beschaeftigt ist. Das ist nicht hilfreich."" Ernst Prost (66), Ex-Chef des Mineraloelherstellers Liqui Moly: ""Wenn sich die Politik zusammenreisst und die Wirtschaft sich in Zeug legt, wird es ein hervorragendes Jahr. Aber von nichts kommt eben nichts. Wirtschaft ist nicht was passiert, sondern was man macht.  Der Erfolg haengt von allen Beschaeftigten und Verantwortungstraegern in diesem Land ab. Es mag schon mal besser gewesen sein, aber es sah auch schon sehr viel schlechter aus. Ich moechte daher nicht den Teufel an die Wand malen. Man kann alles besser machen, aber jammern und wehklagen bring einen nicht weiter. Mehr machen, weniger jammern."" Stefan Schneider, Chefvolkswirt fuer Deutschland, Deutsche Bank Research:  ""Im Jahresdurchschnitt duerfte das Bruttoinlandsprodukt erneut um etwa ¼ Prozent schrumpfen. Ab dem Fruehjahr duerfte aber die dank sinkender Inflation und kraeftiger Lohnerhoehungen steigende Kaufkraft den privaten Verbrauch und damit auch die Gesamtkonjunktur allmaehlich beleben. Allerdings duerften sich Investitionen und Export im kommenden Jahr nur schwach entwickeln. Der Bankenbranche in Deutschland und Europa hat es geholfen, dass die EZB die Negativzinsen abgeschafft hat und wieder zu einem normalen Zinsumfeld zurueckgekehrt ist. 2024 wird dieser Rueckenwind allerdings nachlassen, die Zinsen duerften wieder etwas sinken und die Kreditausfaelle werden wahrscheinlich moderat steigen.  Wegen der schwachen Wirtschaftsentwicklung und dem unter Druck stehenden Immobilienmarkt wird das Kreditgeschaeft mit Unternehmen und Privatleuten wohl nur gedaempft verlaufen.  Insgesamt ist aber von einer weiterhin robusten Ergebnisentwicklung auszugehen. Es ist davon auszugehen, dass die Wachstumsraten erst einmal gedaempft bleiben. Die Zeitenwende und die Transformation der Wirtschaft sowie das dauerhaft schwierige geopolitische Umfeld werden uns in den naechsten Jahren noch viel Geld kosten.  Kritisch ist zudem das strukturell niedrige Trendwachstum. Der Sachverstaendigenrat schaetzt, dass insbesondere der Renteneintritt der Babyboomer das Trendwachstum der naechsten zehn Jahre auf lediglich 0,4% p.a. verlangsamen wird.  Mit anderen Worten: Uns drohen ueber die kommenden Jahre und Jahrzehnte Wohlstandsverluste.  Deutschland sollte alle Kraft darauf verwenden, seine Wettbewerbsfaehigkeit zu verbessern, um so seinen Wohlstand dauerhaft zu sichern. Um das zu schaffen, brauchen wir Investitionen  oeffentliche und insbesondere auch private."" Tina Mueller (55), CEO von Weleda und Ex-Douglas-Chefin: ""Auch 2024 wird fuer die Wirtschaft ein herausforderndes Jahr, da Deutschland den Klimaschutz vorantreiben muss und das unter hohem Kostendruck und bei zugleich andauernden geopolitischen Instabilitaeten. Ich bin zuversichtlich, dass das Konsumklima mit zurueckgehender Inflation im Laufe von 2024 sich weiter aufhellt. Die deutsche Wirtschaft wird ihre technologische Staerke ausspielen und den Wandel mit Einsatz von kuenstlicher Intelligenz, Unternehmertum und Mut gestalten.  Jammern hilft nicht. Wir muessen eine Aufbruchstimmung erzeugen und die Ã„rmel hochkrempeln, wie es die erfolgreichen Generationen vor uns ebenfalls getan haben. Unser Wohlstand ist nicht bedroht, wenn wir intelligente und kreative Loesungen finden. Die Kosmetikbranche ist 2023 gewachsen und wird auch 2024 deutlich an Dynamik gewinnen. Die Menschen streben nach Jugendlichkeit, Gesundheit und Fitness - alles moeglichst im Einklang mit der Natur. In unruhigen Zeiten etwas Gutes fuer sich zu tun, hat einen enormen psychologischen Wert und traegt zum individuellen Glueck bei. Umso mehr, wenn man es zusammen mit Familie und Freunden erlebt. Die Menschen sehnen sich nach sozialer Naehe."" Philippe Rogge (54), CEO von Vodafone Deutschland:  ""Meine drei Wuensche fuer Deutschland 2024: 1. Schliessen wir die letzten Funkloecher im Land und starten wir in die Glasfaser-Champions-League. Das ist wirklich moeglich. Wenn wir Netzbetreiber zusammen die Chancen ergreifen, die sich uns in diesem Jahr eroeffnen. Lasst uns an einen Tisch setzen und gemeinsam einen Weg einschlagen, bei dem wir Geld ab sofort vor allem in neue Mobilfunkstationen, statt in gedruckte Lizenzscheine stecken. Denn: Jede Million mehr, die eine Auktion kostet, bedeutet 5 Mobilfunkmasten weniger fuer all die Handynutzer in unserem Land.  Deutschland braucht Mobilfunkstationen, denn nur die schliessen Funkloecher  an Zuggleisen, entlang von Autobahnen und auf dem Land.  Auch beim Glasfaserausbau brauchen wir mehr digitale Nationalmannschaft als Bundesliga. Mit einem Matchplan, der vorsieht, dass wir die Ressourcen, die wir haben, viel mehr teilen als bislang.  2. Bauen wir eine Buerger-App. Schluss mit langen Wartezeiten und gedruckten Formularen auf unseren Ã„mtern. Wir brauchen eine App fuer alle Menschen. Eine App, die unseren Alltag wirklich einfacher macht. Weil wir alles mit ihr machen koennen: Den neuen Wohnsitz beantragen, den Fuehrerschein bestellen und den Personalausweis digital ablegen. Belgien, Ã–sterreich und andere Nationen machen es vor. Deutschland, das kannst du auch!  3. Das aktuelle Jahr hat gezeigt: Die Spaltung in unserem Land ist groesser geworden. Wir lieben es, recht zu haben.  Aber wir haben verlernt uns zu verstehen. Und uns zu versoehnen. Das ist unsere groesste Aufgabe im neuen Jahr. Denn Graeben ueberwinden wir nicht, in dem wir sie mit Hass und Shitstorms bei Social Media aufschuetten. Wir ueberwinden sie nur, wenn wir Bruecken bauen.  Bruecken aus Toleranz und Respekt. Wir brauchen dringend mehr von diesen Bruecken. In Deutschland und auf der Welt. """,,,,,11946,False
bild,https://www.bild.de/politik/inland/politik-inland/war-das-akw-aus-verfassungswidrig-jura-professor-verklagt-die-regierung-86485968.bild.html,"kohleausstieg, grenzen, klimapolitik, cdu, klimaschutz, klimaneutral",2023-12-27,2023-12-27,2024-10-20,Felix Rupprecht,,"die Gruenen, Atom-Strom, Habeck Robert Dr., Atomausstieg, Klimaschutz, texttospeech",War das AKW-Aus verfassungswidrig? Jura-Professor verklagt die Regierung,Der Ausstieg aus der Atomkraft koennte verfassungswidrig sein. Ein Jurist klagt.,"Der deutsche AKW-Ausstieg koennte verfassungswidrig sein! Jura-Professor Michael Kotulla (63, Uni Bielefeld) verklagt die Regierung vor dem Bundesverfassungsgericht mit einer Verfassungsbeschwerde, die BILD vorliegt. Nach Auffassung der Beschwerdefuehrer verstoesst die Bundesregierung gegen ihre Pflicht zum Klimaschutz und zum Schutz der Freiheit kuenftiger Generationen.  Prof. Kotulla tritt als Prozessbevollmaechtigter seiner Tochter Katharina Kotulla (29) auf. Beschwerdefuehrer sind daneben Kevin Thomas Gniosdorz (32), Tim Gerrit Knopff (28) und Rafael Sarlak (33). Sie sind Mitglieder der CDU-Nachwuchsorganisation Junge Union. In ihrer Argumentation stuetzen sie sich auf den Klimabeschluss des Verfassungsgerichts aus dem Jahr 2021. In dem Urteil hatte das Gericht argumentiert, die Bundesregierung muesse schon heute CO2-Mengen zuteilen, um in Zukunft besonders drastische Freiheitseinschraenkungen zu vermeiden und die kuenftige Freiheit durch die heutige Klimapolitik nicht unverhaeltnismaessig zu belasten. Heisst: Je groesser der heutige CO2-Ausstoss ist, desto staerker muesste der Gesetzgeber in Zukunft auf die Bremse treten und diekuenftigen Emissionen durch Einschraenkung von Freiheiten begrenzen. Das Ziel der Klimaneutralitaet sei im gesetzgeberischen Prozess bei der Beendigung der Nutzung der Atomkraft nicht hinreichend beruecksichtigt worden. In Deutschland wird 2023 fast 40 Prozent des Stroms aus Kohle, Gas etc. gewonnen.  Brisant: Ausgerechnet jetzt will die Bundesnetzagentur sogar den Kohleausstieg verschieben! Die Behoerde soll mehreren Kohlekraftwerk-Betreibern untersagt haben, Kraftwerksbloecke vor dem 31. Maerz 2031 stillzulegen. Die Kohlekraftwerke muessen laenger am Netz bleiben, als die Ampel-Regierung will. Der geplante Kohleausstieg bis 2030 ist damit so gut wie vom Tisch. Katharina Kotulla sagte zu BILD: Der Kanzler muss endlich ehrlich Rechenschaft vor den Buergern ablegen: Wie will er kuenftig die Versorgung unseres Wirtschaftsstandortes mit grundlastfaehiger und sauberer Energie sicherstellen? Davon haengt unser Wohlstand ab. Wer Klimaschutz ernst meint, darf auf keine emissionsarme Moeglichkeit der Energieerzeugung verzichten. Mit dem verschobenen Kohle-Ausstieg wird die Argumentation womoeglich gestuetzt: Die Bundesregierung koennte gegen ihre Pflicht zum Klimaschutz und zum Schutz der Freiheit kuenftiger Generationen verstossen haben. Die Beschwerde richtet sich dabei gegen das geaenderte Atomgesetz mit dem Ausstieg aus der Kernkraft zum 15. April 2023, das Gesetz zum beschleunigten Ausbau von LNG-Terminals sowie gegen das Energiewirtschaftsgesetz zur Versorgungssicherheit. Das Verfassungsgericht koennte im Erfolgsfall der Beschwerde die Ã„nderung des Atomgesetzes der Ampel fuer nichtig erklaeren, die zum AKW-Aus gefuehrt hatte. Allein die Abschaltung der letzten drei Kernkraftwerke im April 2023 hat schaetzungsweise einen Mehrausstoss an CO2 in Hoehe von 15 Millionen Tonnen verursacht, argumentieren die Beschwerdefuehrer. Das sind mehr als sechs Prozent der deutschen Emissionen im Energiesektor. Dabei waeren gerade im Energiesektor die groessten Einsparungen erforderlich, weil er mit 37 Prozent den groessten Anteil an den deutschen CO2-Emissionen ausmacht.",,,,,3240,False
