news_outlet,provenance,query_keywords,creation_date,last_modified,crawl_date,author_person,author_organization,news_keywords,content_title,content_description,content_body,Fake News,Extreme bias,clickbait,credible,body_len,has_label
bild,https://www.bild.de/politik/ausland/politik-ausland/tuerkei-wahl-wie-gefaehrlich-wird-dieser-herausforderer-fuer-erdogan-83129994.bild.html,"linke, grenzen",2023-03-18,2023-03-18,2024-10-20,Marc Oliver Ruehle,,"Tuerkei, Ankara, Istanbul, Republikanische Volkspartei, Erdbeben, Erdogan Recep Tayyip, Kurden, Tuerkei Unruhen",Tuerkei-Wahl: Wie gefaehrlich wird dieser Herausforderer fuer Erdogan?,Nach vielen Jahren und zahlreichen Niederlagen hat sich Kemal Kilicdaroglu jetzt als Praesidentschaftskandidat der Opposition in der Tuerkei durchgesetzt.,"Dieser Mann hat einen langen Atem! Nach vielen Jahren und zahlreichen Niederlagen hat sich Kemal Kilicdaroglu (74) nun als Praesidentschaftskandidat der Opposition in der Tuerkei durchgesetzt.  Kilicdaroglu tritt bei der Wahl am 14. Mai gegen Recep Tayyip Erdogan (69) an  und koennte den islamisch-konservativen Staatschef nach 20 Jahren an der Macht tatsaechlich abloesen: Kilicdaroglu liegt in aktuellen Umfragen mit 57,1 Prozent deutlich vor Erdogan (42,9 Prozent)! Kilicdaroglu ist fuer Erdogan eine echte Gefahr, weil er einer vom Volk ist und in bescheidenen Verhaeltnissen lebt. So einen offenbar sehr ehrlichen Politiker findet man nicht so schnell. Und er spaltet nicht, sondern verbindet. So gelang es ihm, die Rechte und die Linke zusammenzufuehren, erklaert der politisch engagierte Boxweltmeister Uensal Arik (42) im Gespraech mit BILD. Lange schien Kilicdaroglu wenig ausrichten zu koennen gegen Erdogan, der laut ist und gern den starken Mann gibt. Doch nun machen viele Tuerken den Praesidenten fuer die schleppende Hilfe nach dem verheerenden Erdbeben Anfang Februar mit ueber 47 000 Toten verantwortlich. Genau das nutzt Kilicdaroglu aus: Er wirft der Regierung Inkompetenz im Umgang mit der Katastrophe vor und prangert die Korruption im Machtapparat an. Die Menschen haben durch das Erdbeben gesehen, dass Erdogan nicht in das Wohl seines Volkes und Landes investiert hat. Durch Korruption entstandene Apartments und schlecht gebaute Strassen waren zertruemmert und schuld, dass die Hilfe nicht an die Ungluecksstellen gelangen konnte, erklaert Arik.  Seit 2010 steht Kilicdaroglu an der Spitze der sozialdemokratischen CHP  der Partei von Staatsgruender Mustafa Kemal Atatuerk.  Unter seiner Fuehrung oeffnete sich die einst streng saekulare Republikanische Volkspartei konservativen Kreisen und der Minderheit der Kurden  moegliche Stimmen, die ihm jetzt zum Machtwechsel verhelfen koennten. â–º Auf die Gefahr hin, seine eigenen Reihen zu veraergern, schloss er Buendnisse mit rechten Parteien und nahm auch verschleierte Frauen in die CHP auf. Ende vergangenen Jahres brachte der Abgeordnete aus Izmir mit Blick auf die religioese Waehlerschaft ein Gesetz ein, das Frauen das Recht auf das Tragen eines Kopftuchs garantieren soll. 2019 eroberte die CHP die Buergermeisteraemter in mehreren Grossstaedten, darunter Istanbul und Ankara, und beendete dort damit die jahrelange Herrschaft von Erdogans AKP  erste Zeichen des Wandels! Gestaerkt durch diese Siege, verschaerfte der Erdogan-Herausforderer den Ton. Dies ist mein Kampf fuer eure Rechte. Die Reichen sind reicher geworden und die Armen aermer, sagte er im April 2022  und zeigte sich dabei in seiner dunklen Wohnung. Denn der Strom war ihm abgestellt worden, weil er aus Protest gegen die stark gestiegenen Tarife seine Rechnung nicht bezahlt hatte. Kritiker monieren, Kilicdaroglu mangele es fuer das hoechste Staatsamt an Charisma. Und auch seine Herkunft gilt als Handicap: Er stammt aus der historisch rebellischen Provinz Dersim (heute Tunceli, Ostanatolien), in der hauptsaechlich Kurden und Aleviten leben. Auch Kilicdaroglu gehoert der islamischen Glaubensrichtung der Aleviten an, die strengen Sunniten als Ketzer gelten  bei einem Wahlsieg waere Kilicdaroglu der erste alevitische Praesident der Tuerkei! Arik sieht in Kilicdaroglu endlich die Chance, Kurden, Tuerken, Aleviten und weitere miteinander zu verbinden, statt sie gegeneinander abzugrenzen. Erdogan hat da klaeglich versagt. Er glaubt: Die Menschen haben die Tyrannei und Diktatur satt, Kilicdaroglu verkoerpert die Demokratie.",,,,,3582,False
bild,https://www.bild.de/politik/ausland/politik-ausland/tuerkei-wahl-erdogans-lohnplus-versprechen-bei-wiederwahl-83866772.bild.html,"arbeitslosigkeit, rki",2023-05-10,2023-05-10,2024-10-20,,BILD,"Tuerkei, Ankara, tuerkische Lira, Erdogan Recep Tayyip, Tuerkei Unruhen",Tuerkei-Wahl: Erdogans Lohnplus-Versprechen bei Wiederwahl,Verzweiflungstat oder Wahl-Taktik?  Tuerkei-Praesident Recep Tayyip Erdogan (69) steckt kurz vor der Wahl (Sonntag) im Umfrage-Tief  jetzt gibt's Geld.,"Verzweiflungstat oder Wahl-Taktik?  Tuerkei-Praesident Recep Tayyip Erdogan (69) steckt kurz vor der Wahl (Sonntag) im Umfrage-Tief  und greift jetzt tief in die Tasche: ALLE seine Beamten sollen kuenftig ein sattes Lohnplus von 45 Prozent bekommen! Ein Versprechen mit Hintergedanken: Lohnplus gegen Waehlerstimme! Von der Lohnerhoehung profitieren mehr als 700 000 Beamte. Der Mindestlohn fuer Staatsangestellte soll in Zukunft bei 15 000 Lira (ca. 700 Euro). Auch die Pensionen fuer Beamte will Erdogan erhoehen.  Fest steht: Erdogan muss um seine Wiederwahl zittern. Sein Herausforderer Kemal Kilicdaroglu (74) fuehrt in den Umfragen. Der Herausforderer wird von sechs Parteien unterstuetzt, die das Ziel haben, Erdogan nach zwei Jahrzehnten im Amt abzuloesen.  Und Erdogan gibt der Opposition Futter fuer den Wahlkampf. Die tuerkische Waehrung (Lira) liegt am Boden, die Arbeitslosigkeit ist hoch. Noch immer kaempft die Tuerkei gegen die Folgen des Erdbebens im Februar.  Geht es nach Erdogan, soll das Lohnplus fuer Beamte die wirtschaftliche Situation Tausender verbessern. Doch der Lohnaufschlag koennte die Teuerungsrate weiter anheizen. Im letzten Oktober schoss sie auf 85 Prozent hoch, im April lag sie immer noch bei 44 Prozent.  Die wirtschaftliche Schieflage koennte Erdogan zum Verhaengnis werden. Sein Herausforderer Kilicdaroglu versprach, bei einem Wahlsieg eine Waehrungspolitik nach den international gaengigen Lehren zu verfolgen und die Unabhaengigkeit der tuerkischen Zentralbank wiederherzustellen.  Erdogan verhinderte das bislang aus ideologischen Gruenden. Er verpoent Zinsen als unislamisch. Darum sorgte er dafuer, dass die (alles andere als unabhaengige) Zentralbank immer mehr oel ins Feuer goss und den Leitzins seit August von 14 auf 8,5 Prozent drueckte, statt ihn anzuheben.   (jjf)",,,,,1819,False
bild,https://www.bild.de/lgbt/2021/lgbt/lgbt-bewegung-in-der-tuerkei-erneut-festnahmen-bei-studentenprotesten-75878056.bild.html,rki,2021-03-26,2021-03-26,2024-10-20,Marco Schenk,,"Tuerkei, Istanbul, Student, Universitaet, lesbisch, schwul, Homophobie, proteste, transsexuell, Erdogan Recep Tayyip, Homosexualitaet, LGBT, bisexuell",LGBT-Bewegung in der Tuerkei: Erneut Festnahmen bei Studentenprotesten,Bei Protesten gegen die Festnahme von Studenten haben tuerkische Sicherheitskraefte erneut dutzende Menschen festgenommen.,"Bei Protesten gegen die Festnahme von Studenten haben tuerkische Sicherheitskraefte erneut dutzende Menschen festgenommen.  Wie AFP-Reporter berichteten, draengte die Polizei am Freitag Studenten vor einem Gericht in Istanbul zurueck. 42 Menschen seien festgenommen worden, teilte ein Anwalt der Studenten mit. Die Demonstranten protestierten gegen die am Vortag erfolgte Festnahme von Studenten mit einer Regenbogenfahne. Studierende und Akademiker der Bogazici-Universitaet sowie Unterstuetzer protestieren zudem seit Anfang Januar gegen die Ernennung des neuen Universitaets-Rektors durch Staatschef Recep Tayyip Erdogan (67).  Grund: In frueheren Jahren waren die tuerkischen Universitaetsrektoren noch hochschulintern gewaehlt worden, doch nach dem Putsch-Versuch von 2016 sicherte sich Erdogan auch den Zugriff auf die Hochschulen. An der Bogazici-Universitaet, an der die Veranstaltungen auf Englisch abgehalten werden, hat sich ueber die Jahre eine stark linksgerichtete Studentengemeinde versammelt. Ausloeser der Proteste war ein Bild mit Pride-Fahnen, das an der Bogazici-Universitaet aufgehaengt wurde. Darauf ist eine Szene rund um die Kaaba zu sehen  das muslimische Heiligtum in Saudi-Arabien.  Die Kaaba ist dabei fast vollstaendig von einem mythischen Wesen verdeckt. Die Ecken des Bildes zieren eine Regenbogenfahne, die Lesben-Flagge, die Transgender-Flagge und die Fahne der Asexuellen. Die Urheber des Bildes sind bis heute nicht bekannt. Erdogan verglich die Demonstranten daraufhin mit Terroristen. LGBT, so etwas gibt es nicht, sagte er und fuegte hinzu: Dieses Land ist patriotisch und moralisch. Irre: Derweil Erdogan der queeren Bewegung vorwarf, die nationalen Werte nicht zu teilen, legte der tuerkische Innenminister Sueleyman Soylu (51) nach und erklaerte, LGBT-Menschen seien entartet. Homosexualitaet ist in der Tuerkei, anders als in vielen muslimischen Laendern, nicht verboten. Allerdings: Bis heute werden Mitglieder der LGBTQ-Community im Land heftig diskriminiert. Mehr LGBTQ-News gibt's auf Facebook und auf Instagram  jetzt Queer BILD folgen. ",,,,,2084,False
bild,https://www.bild.de/politik/ausland/politik-ausland/nato-beitritt-von-schweden-und-finnland-so-wollen-sie-erdogan-ueberzeugen-82900246.bild.html,"rki, annalena baerbock",2023-02-15,2023-02-15,2024-10-20,Nadja Aswad (zzt. Stockholm) und Julian Roepcke,,"Tuerkei, Finnland, Schweden, Ukraine, USA, NATO, putin wladimir, Erdogan Recep Tayyip, Ukraine-Konflikt, Baerbock Annalena, texttospeech",Nato-Beitritt von Schweden und Finnland: So wollen sie Erdogan ueberzeugen,"Wie lange blockiert Tuerkei-Praesident Erdogan noch den Beitritt von Schweden und Finnland zum Militaerbuendnis? BILD kennt die Plaene, um ihn zu ueberreden.","Wie lange blockiert der tuerkische Praesident Erdogan noch den Beitritt von Schweden und Finnland zum Militaerbuendnis? Seit bald einem Jahr ringen 28 der 30 Nato-Mitgliedstaaten mit der Tuerkei und Ungarn um die Aufnahme von Finnland und Schweden.  â–º Denn: Der tuerkische Machthaber Recep Tayyip Erdogan (68) blockiert die Aufnahme der nordischen Laender, die dem Buendnis gemeinsam beitreten wollen. Unterstuetzt wird er dabei von Ungarns Ministerpraesident Viktor Orban (59). Das Problem: Gruenes Licht fuer die Aufnahme kann von der Nato nur einstimmig gegeben werden. Bislang war das undenkbar, doch das schreckliche Erdbeben in der Tuerkei hat vielleicht auch EIN Gutes: Nato und Tuerkei finden zueinander. Bereits wenige Stunden nach dem Erdbeben hat die Nato eine breit gefaecherte Hilfsaktion gestartet: In Bruessel erklaerte Nato-Generalsekretaer Jens Stoltenberg (63) am Dienstagmorgen: Die Nato-Verbuendeten leisten der Tuerkei umfangreiche Unterstuetzung. Diese Unterstuetzung muss fortgesetzt werden, und wir muessen solidarisch sein (â€¦). Konkret heisst das, dass die Nato-Alliierten der Tuerkei mehr als 5000 Rettungskraefte und Dutzende Militaermaschinen mit Hilfsguetern geschickt haben. Zudem liefert die Nato den obdachlos gewordenen Tuerken eine Zeltstadt, um sie vor Wind und Wetter zu schuetzen. Beistand, Helfer und Maschinen in groesster Not  und ein klares Signal an den tuerkischen Praesidenten: Sieh her, unsere Hand ist ausgestreckt! BILD erfuhr, dass es durchaus einen Zusammenhang zwischen der Nato-Mission fuer die Opfer des Horror-Bebens und dem Ziel gebe, Erdogan im Hinblick auf den Beitritt Schwedens zu erweichen. Allerdings gibt es nicht nur Zuckerbrot fuer den Schweden-kritischen Tuerkei-Herrscher. BILD erfuhr: Die F16-Kampfflugzeuge, die Erdogan von den USA haben will, gibt es erst nach einem Evet (tuerk. fuer Ja) zu Finnland UND Schweden in der Nato. Doch offenbar hat man sich fuer alle Szenarien gewappnet: Schlimmstenfalls scheint die Nato sogar bereit, der Tuerkei-Blockade nachzugeben! Stoltenberg hat am Dienstag ueberraschend signalisiert, auch fuer einen GETRENNTEN Beitritt von Schweden und Finnland offen zu sein. Den hatte man zuvor unbedingt vermeiden wollen. Auch in Finnland wird gerade darueber debattiert, vorerst allein beizutreten  das nordische Land habe schliesslich rund 1340 Kilometer gemeinsam Grenze mit Russland. Aus Nato-Kreisen hiess es am Dienstag, die Aufnahme Finnlands sei strategisch wichtiger als die von Schweden. Zentral sei, dass beide Laender so schnell wie moeglich offizielle Nato-Mitglieder wuerden, so Stoltenberg. Aussenministerin Annalena Baerbock (42, Gruene), die am Montag und Dienstag Finnland und Schweden besucht, hat erneut auf eine schnelle Aufnahme beider Laender gedrungen. Beim Nato-Gipfel in Madrid im letzten Sommer haben wir gemeinsam die Grundlage fuer den Beitritt gelegt. Und wir erwarten natuerlich von allen Nato-Mitgliedern, dass sie diesen Beschluss ohne weitere Verzoegerung umsetzen, sagte Baerbock. Sie werbe fuer einen gemeinsamen Beitritt, erklaerte sie vor Journalisten. Auch Schweden signalisiert mittlerweile seine Bereitschaft, erst nach Finnland in die Nato zu kommen.  Schweden-Aussenminister Tobias Billstroem (49) in Stockholm: Es war immer klar, dass dies ein natuerlicher Prozess ist, bei dem zwei Parlamente und zwei Staaten, Finnland und Schweden, auch ihre eigenen internen Prozesse zu beruecksichtigen haben, und schliesslich muessen wir uns auch darueber im Klaren sein, dass das tuerkische Parlament dies ebenso tut. Und das fuehrt uns zu dem Schluss, dass der Ratifizierungsprozess eine tuerkische Entscheidung ist, auf die weder Finnland noch Schweden Einfluss haben. Doch auch Schweden moechte die Bedenken der Tuerkei auf humanitaerem Wege ausraeumen. Eine Geberkonferenz fuer die Opfer des Erdbebens in der Tuerkei und den Wiederaufbau tuerkischer Staedte soll im Maerz auf Einladung Billstroems in Bruessel stattfinden. Die Tuerkei verweigert bislang die Ratifizierung der sogenannten Beitrittsprotokolle. Das Land begruendet seine Haltung vor allem mit der angeblichen Unterstuetzung Schwedens von Terrororganisationen wie der PKK oder der in der EU nicht als verboten eingeordneten YPG aus Syrien.",,,,,4238,False
bild,https://www.bild.de/news/ausland/news-ausland/klima-kleber-so-hart-greifen-unsere-nachbar-laender-durch-85598522.bild.html,"rki, fossile brennstoffe",2023-10-03,2023-10-03,2024-10-20,Michael Behrendt und Tilman Luz,,"Holland, Italien, grossbritannien, Polizei, Klimaaktivisten, Letzte Generation, texttospeech",Klima-Kleber: So hart greifen unsere Nachbar-Laender durch!,"Waehrend die Klima-Kleber hierzulande mit Samthandschuhen angefasst werden, greifen unsere Nachbarn knallhart durch!","Berlin/Den Haag/Rom/Manchester   Waehrend die Klima-Extremisten in Deutschland von der Polizei mit Samthandschuhen angefasst werden, greifen unsere Nachbarn knallhart durch!  Neulich in Berlin: Ein Klima-Krimineller sorgt fuer Chaos im Berufsverkehr. Der Fahrer eines Transporters aus dem Landkreis Maerkisch-Oderland zieht den Aktivisten ohne Brutalitaet von der Stossstange seines stehenden Fahrzeugs weg, um wieder voranzukommen. Dann kommen drei Polizisten, bedraengen allerdings den Fahrer  und lassen seelenruhig zu, dass der Klima-Extremist sich wieder vor das Fahrzeug setzt. Das Video macht in den sozialen Netzen die Runde. Mit lauter Stimme wird der friedliche Fahrer von der Staatsmacht angewiesen, den Klima-Aktivisten loszulassen. Die Polizei laesst in diesem Fall bewusst zu, dass Buerger genoetigt werden, ihre Fahrt nicht fortsetzen zu koennen.  Was war da los? Die Berliner Polizei sagte am Sonntag dazu auf Anfrage von BILD, dass das Video bekannt sei. Es werde geprueft, wann und wo sich der Zwischenfall ereignet habe. Mit einem Ergebnis koenne am Montag gerechnet werden.  Die Aktivisten der Letzten Generation gehen der Bevoelkerung nicht nur in Deutschland gehoerig auf die Nerven. Auch unsere Nachbarn muessen sich mit den radikalen Klima-Kriminellen rumschlagen. Doch im Gegensatz zu unserer Staatsgewalt wissen sich andere Laender zu helfen. In Italien richtet sich der Protest der Ultima Generazione, des italienischen Ablegers der ,Letzten Generation ', vor allem gegen Gebaeude, Denkmaeler und Kunstwerke. Im Juli verabschiedete der Senat deshalb ein Knallhart-Gesetz: Wer Kunstdenkmaeler oder historische Gebaeude besudelt, wandert bis zu sechs Monate in den Bau. Alternativ werden Geldstrafen bis zu einer Hoehe von 1000 Euro verhaengt.  Bemerkenswert: Oftmals ist die Polizei schon waehrend der Aktionen vor Ort. Die Urteile werden von den Gerichten dann im Eilverfahren gesprochen. Bei der Ultima Generazione nicht minder beliebt sind Nack-Proteste, wie kuerzlich in Turin geschehen. Splitterfasernackt und zusammengekettet, legten Klima-Kriminelle den Verkehr lahm.  In Faellen von Nacktheit im oeffentlichen Raum sind die Strafen in Italien noch drakonischer: Bussgelder zwischen 5000 und 10 000 Euro kommen auf die Stoerenfriede zu, je nach Ermessen koennen auch Gefaengnisstrafen zwischen vier Monaten und vier Jahren verhaengt werden. Auch in Holland sind die Behoerden wenig zimperlich im Umgang mit den Aktivisten. Statt zu Olivenoel und Pinsel greift die Polizei zum Wasserwerfer. Am Samstag hatten Hunderte Klima-Kriminelle die A 12 bei Den Haag blockiert, darunter Hundert deutsche Mitglieder der deutschen Letzten Generation. Die Polizei nahm rund 600 der Aktivisten fest.  In einem weiteren Video ist zu sehen, wie Polizisten Aktivisten, die zuvor die Autobahn blockiert hatten, in einen Bus hieven. Die Klima-Kriminellen reagieren hysterisch auf das robuste, aber dennoch massvolle Verhalten der Beamten. Ganz so, als waeren sie die Opfer und nicht etwa die Autofahrer. Auf der Insel sind es die Aktivisten von Just Stop Oil, die fast taeglich durch Farb- oder Blockade-Aktionen von sich reden machen. Durch ihre aktivistischen Einlagen will die radikale Klima-Gruppe die britische Regierung zum Ausstieg aus fossilen Brennstoffen zwingen. Der englische Staat zeigt sich indes unerbittlich: Fuer die Stoerung der oeffentlichen Ordnung werden bis zu zehn Jahre Knast verhaengt.",,,,,3423,False
bild,https://www.bild.de/news/ausland/news-ausland/article-63cc3074e151491846a8dcab-82635678.bild.html,rki,2023-01-22,2023-01-22,2024-10-20,,BILD,"Tuerkei, Schweden, Koran, Erdogan Recep Tayyip, Rechtsextremismus, Desk-Delta",Schweden: Rechtsextremer verbrennt Koran in Stockholm,"Die Tuerkei erklaerte zu der Verbrennung, es handele sich um einen islamfeindlichen Akt, der sich gegen Muslime richte.","Wieder Koran-Skandal in Schweden. Der Chef der rechtsextremen daenischen Partei Harte Linie hat in der schwedischen Hauptstadt Stockholm hat eine Ausgabe des Korans verbrannt. Rasmus Paludan (41), der auch die schwedische Staatsbuergerschaft besitzt, zuendete den Koran am Samstag nahe der tuerkischen Botschaft an. Damit verschaerfen sich die ohnehin schon angespannten Beziehungen zwischen beiden Laendern.  Paludan hatte in der Anmeldung seiner von den Behoerden genehmigten Kundgebung erklaert, sein Protest richte sich gegen den Islam und den Versuch des tuerkischen Praesidenten Recep Tayyip Erdogan, die Meinungsfreiheit in Schweden zu beeinflussen. Das Aussenministerium in Ankara erklaerte umgehend, man verurteile den abscheulichen Angriff auf unser heiliges Buch aufs Schaerfste. Schweden muesse gegen den Taeter vorgehen, die internationale Gemeinschaft sich gegen Islam-Feindlichkeit stellen. Der schwedische Aussenminister Tobias Billstrom (49) sprach von entsetzlichen islamfeindlichen Provokationen. Schweden habe zwar eine weitreichende Meinungsfreiheit. Aber das bedeutet nicht, dass die schwedische Regierung oder ich selbst die geaeusserten Meinungen unterstuetzen. â–º Die Tuerkei hatte zuvor einen fuer Ende Januar geplanten Besuch des schwedischen Verteidigungsministers Pal Jonson abgesagt und das mit der Genehmigung der Kundgebung Paludans begruendet. Jonson wollte in Ankara ueber Schwedens Antrag zur Aufnahme in die Nato sprechen, den das Land nach Russlands Invasion der Ukraine gestellt hatte. Die Tuerkei, die Mitglied in dem Buendnis ist, blockiert einen Beitritt seit Monaten. Der Politiker Paludan hatte auch schon in der Vergangenheit Demonstrationen veranstaltet, bei denen er den Koran verbrannte.  Im April 2022 war es nach einer Koran-Verbrennung Paludans zu schweren Gewaltexzessen junger Muslime in zahlreichen schwedischen Staedten gekommen. Die Tuerkei erklaerte zu der Verbrennung, es handele sich um einen islamfeindlichen Akt, der sich gegen Muslime richte und unsere heiligen Werte beleidigt. Einen solchen Protest unter dem Deckmantel der Meinungsfreiheit zuzulassen, sei voellig inakzeptabel. Saudi-Arabien rief dazu auf, die Werte des Dialogs, der Toleranz und der Koexistenz zu verbreiten. Hass und Extremismus wuerden abgelehnt, teilte die Diktatur mit. In Stockholm gab es am Samstag noch zwei weitere genehmigte Demonstrationen. Auf der einen wurde zur Unterstuetzung von Kurden aufgerufen und zugleich gegen den Antrag Schwedens auf Beitritt zur Nato demonstriert. Auf der anderen hielten pro-tuerkische Demonstranten eine Kundgebung vor der Botschaft ab. Auf der Demonstration gegen die schwedische Nato-Bewerbung und zur Unterstuetzung der Kurden standen Redner vor einem grossen Banner mit der Aufschrift Wir sind alle PKK. Sie bezogen sich damit auf die kurdische Arbeiterpartei PKK, die unter anderem in der Tuerkei, in Schweden und den USA verboten ist. Schweden und Finnland hatten sich 2022 nach dem Einmarsch Russlands in der Ukraine um eine Aufnahme in die Nato beworben. Damit es dazu kommt, muessten alle 30 Mitgliedstaaten des Buendnisses zustimmen. Die Tuerkei hat dafuer aber Bedingungen gestellt, auch die Wiederaufnahme von Waffenlieferungen.  Finnland und Schweden haben ein Abkommen mit der Tuerkei unterzeichnet, um die Einwaende Ankaras auszuraeumen. Schweden hatte zuletzt erklaert, es habe seinen Teil erfuellt, aber die Tuerkei verlange mehr  einschliesslich der Auslieferung von 130 Personen, die die Tuerkei fuer Terroristen halte. In der Tuerkei stehen demnaechst Praesidentschaftswahlen an, bei denen der seit vielen Jahren regierende Erdogan erneut antritt. Einige seiner potenziellen Gegenkandidaten liegen bei den Zustimmungswerten vor Erdogan.",,,,,3731,False
bild,https://www.bild.de/politik/ausland/politik-ausland/erdogans-wahlkampf-tricks-an-allem-sind-immer-die-anderen-schuld-60293174.bild.html,"rki, inflation",2019-02-24,2019-02-24,2024-10-20,,BILD,"Tuerkei, Ankara, Istanbul, Partei der Nationalistischen Bewegung, Partei fuer Gerechtigkeit und Aufschwung, Republikanische Volkspartei, Erdogan Recep Tayyip, Tuerkei Unruhen",Erdogans Wahlkampf-Tricks: Am 31. Maerz sind Kommunalwahlen in der Tuerkei,"In 36 Tagen entscheidet die Tuerkei, wie es in den Grossstaedten weitergeht. Aktuelle Umfragen zeigen, dass die Partei des Praesidenten diesmal zittern muss.","In 36 Tagen duerfen die Buerger der Tuerkei mal wieder abstimmen  Kommunalwahlen. Besonders umkaempft dabei: die Grossstaedte. Und obwohl Teile der Opposition laengst kaltgestellt wurden, muss Praesident Recep Tayyip Erdogan (64), dass seine AKP deutlich verliert.  Vor allem in prestigetraechtigen Grossstaedten wie Istanbul und Ankara droht Erdogan eine Niederlage. Grund: Die Menschen sind mit der wirtschaftlichen Situation sehr unzufrieden. Erdogan will daran aber vollkommen schuldlos sein  obwohl er seit 17 Jahren die Tuerkei regiert! â€¢ Einer seiner billigen Wahlkampf-Tricks: Der Praesident ist nur dann fuer die Politik verantwortlich, wenn es gut funktioniert. Wenn es dagegen schlecht laeuft, macht er Andere verantwortlich.  Beispiel Wirtschaftskrise: Die Teuerung der Lebenshaltungskosten wird den Haendlern angelastet, die Erhoehung der Zinsen den Banken, fuer die Waehrungskrise die USA.   â€¢ Ein weiterer Trick: Wer nicht fuer ihn ist, arbeitet mit Terroristen zusammen, behauptet der tuerkische Praesident gern. Das Thema wird bei den Kommunalwahlen unerwartet stark betont! Zuletzt gab der tuerkische Innenminister Sueleyman Soylu bekannt, wie viele Operationen es gegen terroristische Organisationen gab: 129 787 Einsaetze. Diese Zahlen zu hoeren waere sogar fuer die Laender beaengstigend, dessen finanzielle Situation gut, aber deren Gewissen arm sind, stichelte Soylu in Richtung Westen.   Hintergrund: Die pro-kurdische HDP stellt in vielen Grossstaedten und Kommunen, in denen es fuer die AKP knapp werden koennte, keinen eigenen Kandidaten auf. Ein Schachzug gegen Erdogan, dessen Partei sich mit der nationalistischen MHP verbuendet hat.  Auf der anderen Seite steht ein Zusammenschluss der groessten Oppositionspartei CHP mit der nationalen IYI Partei und der konservativen SAADET. Indem die pro-kurdische HDP teilweise auf eigene Kandidaten verzichtet, duerfte sie das Oppositionsbuendnis staerken. Die Wahrscheinlichkeit, eine Mehrheit gegen Erdogan und seine Verbuendeten zu erzielen, steigt damit. ",,,,,2033,False
