news_outlet,provenance,query_keywords,creation_date,last_modified,crawl_date,author_person,author_organization,news_keywords,content_title,content_description,content_body,Fake News,Extreme bias,clickbait,credible,body_len,has_label
bild,https://www.bild.de/politik/ausland/politik-ausland/hamas-vergewaltigte-frauen-und-maedchen-unvorstellbarer-sadismus-86312850.bild.html,israel,2023-12-03,2023-12-03,2024-10-20,,BILD,"Gaza-Streifen, Gaza, Israel, Hamas, Nahost-Konflikt, texttospeech",Hamas vergewaltigte Frauen und Maedchen: Unvorstellbarer Sadismus,"Berichte von Augenzeugen und Helfern zeigen: Palaestinenser vergewaltigten, verstuemmelten, erschossen wehrlose Zivilistinnen","Am 7. Oktober begingen palaestinensische Terroristen und Zivilisten nicht nur das schlimmste Massaker an Juden seit dem Holocaust  sie vergewaltigten und misshandelten auch massenhaft Frauen und Maedchen. Auch Wochen nach dem Hamas-Ueberfall auf Israel kommen immer neue Berichte ueber brutale sexuelle Gewalttaten ans Licht. Sie belegen, mit welcher Grausamkeit die Angreifer vorgingen  und dass viele palaestinensische Taeter es offenbar gezielt auf Frauen abgesehen hatten oder die Gelegenheit nutzen, um ihrem Sadismus, Frauen- und Judenhass freien Lauf zu lassen. Die Berichte von Augenzeugen, Helfern und Polizisten belegen eine Dimension der Gewalt, wie sie das juedische Volk seit 1945 nicht mehr erleiden musste. Sie sind erschreckend und verstoerend  und muessen dennoch gehoert und dokumentiert werden, um das Ausmass des Grauens begreifbar zu machen. Ein Helfer des Rettungsdienstes Zaka erzaehlte etwa vor einem parlamentarischen Sonderausschuss ueber das Grauen, das ihn am 7. Oktober in einem Grenzort erwartete: Die Leiche einer Frau, nackt, mit einem scharfen Gegenstand, der in ihrem Intimbereich steckte. An anderen Orten habe er mehrere tote Frauen mit nacktem Unterleib vorgefunden. Die Berichte ueber hoechst sadistische Gewalt am Tag des Massakers naehren auch die Sorge um junge Frauen, die sich noch in der Gewalt der Terrororganisation befinden und deren Freilassung die Hamas bisher verweigert hat. Ein Sanitaeter erzaehlte, er habe in einem Haus im Kibbuz Beeri ein 14-jaehriges Maedchen vorgefunden, das vergewaltigt und ermordet worden sei. Sie habe auf dem Boden ihres Schlafzimmers gelegen, mit nacktem Unterleib, gespreizten Beinen und Samenspuren auf ihrem Ruecken. Der Jugendlichen sei in den Kopf geschossen worden. Die Polizistin Shelly Harusch erzaehlte bei der Sitzung eines parlamentarischen Ausschusses, es seien bisher rund 1500 Zeugenaussagen zu den Vorfaellen gesammelt worden. Die Untersuchung konzentriert sich auch auf sexuelle Vergehen gegen die Opfer. Festgenommene Hamas-Terroristen gaben im Verhoer an, sie haetten auch den Auftrag gehabt, Frauen zu vergewaltigen. Nach Polizeiangaben gibt es verschiedene Augenzeugenberichte von Vergewaltigungen durch Terroristen auf dem Nova-Musikfestival am 7. Oktober. Ein Ueberlebender berichtete von einer Apokalypse der Leichen. Er habe viele junge Frauen ohne Kleidung gesehen, einige seien verstuemmelt gewesen, einige mit verstuemmeltem Unterleib. Eine Teilnehmerin, die sich im Gebuesch vor den Moerdern versteckt hatte, berichtete von grausamen Gewalttaten an einer jungen Frau. Sie beugten sie nach vorne und mir wurde klar, dass sie sie vergewaltigen, einer nach dem anderen. Dann wurde sie einem anderen Mann weitergegeben, der eine Uniform trug, erzaehlte die Augenzeugin.  Die Israelin weiter: Sie war am Leben, als sie vergewaltigt wurde. Er zog ihr an den Haaren und schoss ihr in den Kopf, noch waehrend er sie vergewaltigte. Er zog noch nicht einmal seine Hose hoch. Sie schnitten ihre Brust ab und spielten damit auf der Strasse. Augenzeugen berichteten, Frauen seien neben den Leichen ihrer Freunde vergewaltigt worden. Manche seien anschliessend getoetet, andere nach Gaza verschleppt worden. Auf einem von Terroristen verbreiteten Video war die Entfuehrung einer jungen Frau mit blutgetraenkter Hose zu sehen. Ein anderes Video zeigte, wie der leblose Koerper der Deutschen Shani Louk auf einem Pick-up in den Gazastreifen mitgenommen wurde. Eine freiwillige Helferin erzaehlte von schrecklich geschundenen Frauenkoerpern, die dorthin gebracht wurden. Die Arme und Beine einer weiblichen Soldatin seien etwa an vielen verschiedenen Stellen gebrochen gewesen. Die weiblichen Opfer seien oft einmal in den Koerper und dann sehr oft in den Kopf geschossen worden. Es ging offenbar nur um Verstuemmelung, sagte sie. Die Helferin berichtet von vielen Hinweisen auf sexuelle Verbrechen. Manche Leichen seien etwa mit blutigen Unterhosen bekleidet gewesen. Andere Mitarbeiter haetten von Leichen mit verstuemmelten Geschlechtsteilen berichtet. In manchen Leichen seien Handgranaten deponiert gewesen. Wir mussten schnell rauslaufen, um uns in Sicherheit zu bringen. Es seien daraufhin Sprengmeister gerufen worden. Die Juraprofessorin Yifat Bitton sagt, viele der Ueberlebenden seien zutiefst traumatisiert und nicht alle koennten ueber ihre Erlebnisse sprechen. Sexuelle Angriffe seien immer noch stark mit Stigma und Scham verbunden. Dies ist eine weitere Last fuer die Opfer, sagte Bitton. Es koennte dauern, bis alle von ihren schlimmen Erlebnissen erzaehlen. Man kenne es auch aus anderen Kriegen, dass Frauen als Mittel der Demuetigung vergewaltigt wurden. Graeueltaten dieses Ausmasses und dieser Schwere habe man aber in Israel vorher noch nicht erlebt.",,,,,4764,False
bild,https://www.bild.de/politik/inland/politik-inland/attacke-von-hendrik-wuest-afd-ist-eine-brandgefaehrliche-nazi-partei-86839070.bild.html,"kohleausstieg, migration, cdu, afd, linke, erneuerbare energien",2024-01-20,2024-01-20,2024-10-20,peter poensgen,,"Schaeuble Wolfgang, CDU, Merkel Angela, Unfaelle, Geburtstag, Wuest Hendrik",Attacke von Hendrik Wuest: AfD ist eine brandgefaehrliche Nazi-Partei,Der Neujahrsempfang der NRW-CDU in Duesseldorf stand im Zeichen des Gedenkens an den Jahrhundert-Politiker Wolfgang Schaeuble (â€  81). Aber nicht nur.,"Der Neujahrsempfang der NRW-CDU in Duesseldorf stand im Zeichen des Gedenkens an den Jahrhundert-Politiker Wolfgang Schaeuble (â€  81). Schaeuble haette am Samstag im Duesseldorfer Ehrenhof vor 1000 Gaesten eigentlich die traditionelle Rede halten sollen. Aus Respekt vor dem Verstorbenen verzichtete die CDU darauf, einen anderen Gast einzuladen. Ministerpraesident und CDU-Landeschef Hendrik Wuest (47) wuerdigte Schaeuble als den besten Diener des Staates, den es geben konnte. Er habe fuer diese Veranstaltung zugesagt, ihm gleich aber am Telefon gesagt: Wenn meine Gesundheit es zulaesst. Heute wissen wir, dass seine Gesundheit es nicht zugelassen hat, so Wuest. Wuest warnte, heute stehe das Europa von Schaeuble und Helmut Kohl auf dem Spiel, dem Kontinent drohe schwerer Schaden. Gemeinsame Loesungen auf die grossen Fragen unserer Zeit seien noetig. Bei einem Treffen von Rechtsextremisten in Potsdam seien brandgefaehrliche Plaene geschmiedet worden. Wuest: Die AfD steht nicht auf dem Boden des Grundgesetzes. Sie ist keine konservative und keine werteorientierte Partei. Das ist eine brandgefaehrliche Nazi-Partei. Am rechten und linken Rand werde behauptet, man gehe fuer die Mehrheit auf die Strasse  tatsaechlich werde gerade bei den vielen aktuellen Demonstrationen im Land Flagge gezeigt. Wuest dankte allen herzlich, die das in dieser Situation gerade tun.  Seine Mahnung: Wir muessen stark bleiben, um auch in Zukunft weiter helfen zu koennen. Es sei nicht klug, vor den Europawahlen wieder ueber Migration zu streiten. Eine Allianz der Mitte, ein parteiuebergreifender Schulterschluss der Demokraten, sei jetzt noetig, auch damit das Sterben im Mittelmeer endlich aufhoere. Wuest: Die Menschen spueren doch, was los ist vor Ort und erwarten zu Recht wirksame Loesungen fuer grosse Herausforderungen. Buergermeister wuerden sich bereits melden und sagen: Wir sind am Limit! Was den Ministerpraesidenten noch bewegt: das Thema Energie. Wuest mahnt zum Thema Kohleausstieg: Es kann keinen Ausstieg ohne Einstieg geben. Der Kohleausstieg 2030 wird gelingen, wenn die Voraussetzungen dafuer geschaffen wurden. Nur wenn die neuen Gas-Kraftwerke jetzt schnell kaemen, gebe es 2030 ausreichend grundlastfaehige Energie, nur dann koenne der Kohleausstieg auch gelingen. Der Job von NRW an dieser Stelle bestehe im Ausbau der erneuerbaren Energien  spielte Wuest den Ball nach Berlin weiter.",,,,,2402,False
bild,https://www.bild.de/regional/berlin/berlin-regional-politik-und-wirtschaft/robert-habeck-alte-kohlekraftwerke-im-winter-wieder-anschalten-84146128.bild.html,"kohleausstieg, fdp, spd, klimaneutral, erneuerbare energien, christian lindner, robert habeck",2023-06-02,2023-06-02,2024-10-20,Michael Sauerbier,,"Kohlekraftwerk, Woidke Dietmar Dr., Habeck Robert Dr., Heizkosten, Energiewende, push-automatisch",Robert Habeck: alte Kohlekraftwerke im Winter wieder anschalten,Ueberraschung bei Habecks Besuch in Brandenburg! Als Gruener will er bis 2030 aus der Braunkohle aussteigen. Doch als Wirtschaftsminister braucht er Reserven.,"Potsdam  Ueberraschung bei Habecks Besuch im Braunkohle-Land Brandenburg! Als Gruener will Robert Habeck (53) bis 2030 aus der Braunkohle aussteigen. Doch als Wirtschaftsminister will er die schmutzigen Reserve-Kraftwerke im naechsten Winter wieder anheizen. Ende Juni sollen die Kraftwerks-Reservebloecke abgeschaltet werden, verkuendete der Minister in der Potsdamer Staatskanzlei, danach koennen sie mit einer Sondergenehmigung ueber den Winter wieder genutzt werden. Den noetigen Antrag will Habeck jetzt bei der EU in Bruessel stellen. Ich muss die Weiternutzung begruenden, sagte er, wir brauchen eine zusaetzliche Kapazitaetsreserve fuer den Winter. Denn volle Gasspeicher, Wind- und Sonnenstrom reichen in der dunklen Jahreszeit nicht aus. Und die Kernkraftwerke sind abgeschaltet. Das will Habeck rasch aendern. Wir bauen jetzt ein Wasserstoff-Kernnetz, das Haefen, Kraftwerke, Ein- und Ausspeisepunkte in ganz Deutschland verbindet  eine Art Wasserstoff-Autobahn. Derzeit plant der Bund Trassen, Standorte, Gasmengen und Verguetung. Habeck: Bis Jahresende starten wir die Ausschreibung fuer die neuen Kraftwerke. In fuenf Jahren sollen die klimaneutralen Stromfabriken fertig sein. Alle grundlastfaehig wie Kohlekraftwerke  anders als Sonne und Wind. Habeck setzt darauf, dass sich Kohlestrom wegen der jaehrlich teureren Abgabe (COâ‚‚-Zertifikate) bis 2030 nicht mehr lohnt. Die Kohle-Laender Brandenburg, Sachsen und Sachsen-Anhalt halten am Ausstiegsdatum 2038 fest. Habeck: Die Debatte um den Kohleausstieg wird sich nach der Wirklichkeit richten. Wenn fossiler Strom billiger als erneuerbarer ist, ist das oekonomisch nicht richtig. Deshalb muessen wir die Netzentgelte senken. Verrueckt: Zurzeit zahlen Brandenburgs Stromkunden 515 Euro Netzentgelt pro Jahr, die Berliner nur 341, die Bayern 321 Euro pro Haushalt. Weil Brandenburg viel mehr oekostrom produziert. Habeck: Alle Bundeslaender muessen ihren Beitrag leisten! Auch Regionen, die bisher nicht so stark bei den erneuerbaren Energien sind. Gemeint: Bayern, Hessen, Baden-Wuerttemberg. Sie bauen kaum Wind- und Solarkraftwerke, haben die billigsten Netzentgelte. Habeck sauer: Erneuerbare muessen ein Vorteil fuer die Regionen sein und kein Nachteil! Strom-Grossverbrauchern wie Stahl- und Aluhuetten, Papier- und Zementfabriken versprach der Wirtschaftsminister Billigpreise. Der Industrie-Strompreis von 6 Cent wird kommen, sagte Brandenburgs Regierungschef Dietmar Woidke (61, SPD) nach dem Gespraech mit Habeck. Noch offen ist der Zeitpunkt fuer das Discount-Angebot an die Industrie. Der Grund: Ueber die milliardenteure Strom-Subvention muss Habeck noch mit Finanzminister Christian Lindner (44, FDP) verhandeln. Der hat bisher noch jeden Habeck-Plan zurechtgestutzt. Doch wenn es um Geldgeschenke fuer die Wirtschaft geht, macht auch Lindner mit.",,,,,2827,False
bild,https://www.bild.de/politik/inland/politik-inland/fdp-will-harte-einschnitte-diese-asyl-leistungen-sollen-jetzt-gekuerzt-werden-85924798.bild.html,"migration, fdp, migrationspolitik, christian lindner",2023-10-30,2023-10-30,2024-10-20,Peter Tiede,,texttospeech,FDP will harte Einschnitte: Diese Asyl-Leistungen sollen jetzt gekuerzt werden,Die FDP-Spitze forderte eine radikale Wende in der deutschen Migrationspolitik!  Vor allem an eines wollen sich die Liberalen in der Ampel wagen: Sie wol...,"Die FDP-Spitze forderte eine radikale Wende in der deutschen Migrationspolitik!  Vor allem an eines wollen sich die Liberalen in der Ampel wagen: Sie wollen alle Spielraeume nutzen, um die Sozialleistungen fuer Asylbewerber zu senken. Ziel: den Anreiz fuer illegale Migranten senken, nach Deutschland zu kommen.  Justizminister Marco Buschmann (46, FDP) zu BILD: Wir brauchen eine neue Realpolitik mit Blick auf die irregulaere Migration nach Deutschland. Es kommen zu viele Menschen, die auf unseren Sozialstaat angewiesen sind.  Und: Das Motto der Merkel-Ã„ra Wir schaffen das muesse einem Besser machen weichen. Konkret fordert Buschmann: Die europaeische Aussen-Grenze muessen wir besser schuetzen, damit wir besser kontrollieren, wer nach Europa kommt. Wir muessen unsere Sozialleistungen in den Blick nehmen. Bei der Hoehe der Leistungen und der Dauer des Bezugs nach dem Asylbewerberleistungsgesetz haben wir Spielraeume, die wir nutzen sollten.  Anstelle von Barauszahlungen sollten wir auf ein unbuerokratisches System von Bezahlkarten umstellen. So werden etwa Zahlungen an Schleuser oder Transfers ins Ausland unterbunden. FDP-Generalsekretaer Bijan Djir-Sarai (47) fordert in BILD:  Die realpolitische Wende in der Migrationspolitik ist dringend notwendig. Wir muessen auch bei den Sozialleistungen fuer Asylbewerber ansetzen. Diese, so der FDP-General, seien ein zentraler Pull-Faktor fuer die irregulaere Migration nach Deutschland.  Er fordert: Wir muessen daher alle rechtlichen Spielraeume nutzen, um die Leistungen auf ein mit anderen europaeischen Staaten vergleichbares Niveau abzusenken. Bisher wird eine Absenkung der Sozialleistungen an Asylbewerber stets aus rechtlichen Gruenden abgelehnt. Doch Justizminister Buschmann und FDP-Chef Christian Lindner (44) haben ausgelotet, was trotzdem moeglich ist. Ihre Kuerzungsliste haben sie in einem Gastbeitrag in der Welt am Sonntag veroeffentlicht: So umfasse der sogenannte Warenkorb, nachdem Ansprueche fuer Asyl-Antragsteller berechnet werden, etwa auch Leistungen fuer die Nutzung von Festnetzanschluessen, Eintrittsgelder fuer Kultur- und Freizeitveranstaltungen oder Zeitungen und Zeitschriften.  Buschmann/Lindner schreiben dazu: Man kann mit guten sachlichen Gruenden bezweifeln, ob fuer Menschen in einer Erstaufnahmeeinrichtung, die mit Medien haeufig in Gemeinschaftsraeumen versorgt werden, solche Ausgaben wirklich anfallen. Zwar habe das Bundesverfassungsgericht untersagt, die Leistungen fuer Menschen in Erstaufnahmeeinrichtungen pauschal zu kuerzen, so die beiden Minister. Kuerzungen muessen detailliert und sachlich begruendet werden. Eine solche sachliche Begruendung fuer die Absenkung des Leistungsniveaus ist jedoch moeglich: Die individuellen Bedarfe bei der Berechnung der Leistungshoehe koennen kritisch hinterfragt werden. Die Spielraeume seien groesser, als viele meinen, so die beiden: So koennte der niedrigere Anfangssatz an Sozialleistungen deutlich laenger gezahlt werden als die derzeit erlaubten 18 Monate. Grund: Die 18 Monate orientierten sich an den alten Verfahrensdauern. Nur: Diese seien deutlich laenger als frueher. Also: Muessten die Leistungen auch nicht so frueh angehoben werden. Stattdessen sollen die Migranten so lange nur Grundleistungen nach dem Asylbewerberleistungsgesetz beziehen, bis ihr Aufenthaltsstatus rechtskraeftig geklaert ist. Die Umstellung von Bar- auf Sachleistungen und Geldkarten muesse kommen. Auch um zu verhindern, dass die Gelder genutzt werden, um Schulden bei Schleusern zu bezahlen.  Die beiden Spitzen-Liberalen halten in harten Faellen gar eine Kuerzung quasi auf null fuer rechtlich machbar: Migranten, die laut Dublin-Verordnung eigentlich in einem anderen EU-Staat humanitaeren Schutz erhalten muessten, sollten sich auch dorthin begeben: Die Leistung sollten fuer sie auf die Erstattung der notwendigen Reisekosten in den fuer sie zustaendigen Staat abgesenkt werden. Sie beziehen sich dabei auf das Sozialrecht: Dort gelte, dass Sanktionen zulaessig sind, wenn zumutbare Mitwirkungshandlungen, die auf eine Verbesserung der eigenen Situation zielen, unterlassen werden. Die Minister warnen vor einer Selbsttabuisierung in der Migrationsdebatte. ",,,,,4196,False
bild,https://www.bild.de/politik/inland/politik-inland/jubel-fuer-hamas-terror-koennen-juden-hasser-abgeschoben-werden-85713248.bild.html,"abschiebung, israel, fdp, cdu, robert habeck",2023-10-12,2023-10-12,2024-10-20,Karina Moessbauer und Luisa Volkhausen,,"Gaza, Israel, Terrorismus, Hamas, Antisemitismus, demonstrationen, asyl, Abschiebung, texttospeech",Jubel fuer Hamas-Terror: Koennen Juden-Hasser abgeschoben werden?,Die grosse Frage: Wie kann Deutschland mit diesem Israel-Hass umgehen?,"Mitten in unseren Staedten  in Berlin, Hamburg oder Frankfurt  haben Menschen seit dem Hamas-Terror gegen Israel den Tod israelischer Kinder, Frauen und Maenner bejubelt. Auf der Sonnenallee in Berlin wurden Suessigkeiten verteilt, um den Terror zu feiern.  Fuer Wirtschaftsminister Robert Habeck (Gruene) ist klar: Diejenigen, die wir nicht haben wollen, weil sie sich nicht anpassen wollen, weil sie Verbrecher sind, weil sie den Tod von Juden in Israel in Deutschland feiern, die muessen dann eben auch zurueckgefuehrt werden  sofern das geht ... Auch Unions-Parlamentsgeschaeftsfuehrer Thorsten Frei (50, CDU), fordert: Auslaender, die diese barbarischen Terrorakte billigen und ihren Hass auf Juden hierzulande zur Schau tragen, treten das Gastrecht mit Fuessen und sollten, wenn immer moeglich, ausgewiesen werden. Die Mittel, die das Aufenthaltsgesetz vorsehe, muessten von den Laendern konsequent genutzt werden. Wer gegen den Staat Israel hetzt, wer Juedinnen und Juden auf unseren Strassen angreift oder anpoebelt, muss binnen Stunden aus dem Verkehr gezogen werden, sagt sogar Gitta Connemann (59, CDU), Vize-Praesidentin der Deutsch-Israelischen Gesellschaft. Connemann fordert daher, dass sofort Schwerpunktstaatsanwaltschaften eingesetzt werden. Wer mittags auf der Sonnenallee antisemitische Parolen bruellt, muss nachmittags vor dem Richter stehen. Und auch Bundesjustizminister Marco Buschmann (46, FDP) mahnt: Menschen, die diese grausamen Taten auf unseren Strassen feiern, werden mit strafrechtlichen Konsequenzen oder sogar einer Ausweisung rechnen muessen. ABER: GEHT das ueberhaupt?  Fakt ist: Die rechtlichen Anforderungen an Abschiebung und Ausweisung sind hoch.  â–º Abschiebegrund steht gegen Bleiberecht. Bspw. wird bei hier geborenen Migranten das Bleiberecht stark gewichtet. Fuer eine Ausweisung braucht es in der Regel schwere oder wiederholte Straftaten. Antisemitismus kann dabei strafverstaerkend wirken.  ABER: Selbst wenn die rechtlichen Huerden genommen sind, scheitern die Rueckfuehrungen in der Praxis oft, weil etwa in die palaestinensischen Gebiete oder in den Libanon selten abgeschoben wird.  Asylexperte und Jura-Professor Daniel Thym (49, Uni Konstanz) sagt deutlich: Selbst wenn jemand nachweislich Mitglied der Terror-Organisation Hamas ist, braucht es fuer eine Abschiebung praktisch ein Land, wohin er abgeschoben werden kann. In der Vergangenheit habe es bereits immer wieder Verschaerfungen der Ausreiseregelungen gegeben, erklaert der Experte. Solange es aber an der praktischen Machbarkeit scheitert, haben diese Verschaerfungen nur eine Symbolwirkung. Und trotzdem: Auch diese Symbolwirkung haelt Thym fuer wichtig.",,,,,2670,False
bild,https://www.bild.de/politik/2023/politik/joschka-fischer-verteidigt-armee-israel-kann-sich-schwaeche-nicht-erlauben-86307862.bild.html,"linke, israel",2023-12-03,2023-12-03,2024-10-20,,BILD,"Gaza-Streifen, Gaza, Israel, die Gruenen, Hamas, Nahost-Konflikt, Fischer Joschka, Desk-Delta",Gruenen-Urgestein ueber Migrationspolitik: Wir haben EINEN Fehler gemacht â€¦,Dieses Interview des Gruenen-Politikers Joschka Fischer hat es in sich.,"Sieben Jahre lang war Joschka Fischer (75) Deutschlands Aussenminister, jetzt kritisiert er die deutsche Fluechtlingspolitik  und das fuer einen Gruenen-Politiker ungewoehnlich kritisch In einem Zeit Online-Interview ruegt der Ex-Minister: Unser Land war immer offen fuer Fluechtlinge, aber wir haben einen Fehler gemacht: Wir haben nicht definiert, was es heisst, hier leben zu wollen. â–º Fischer: Offen zu sein heisst eben nicht, dass wir fuer alles zu haben sind. Wir sind das Land, das Auschwitz moeglich gemacht hat. Das habe Konsequenzen fuer alle Buerger und Buergerinnen. Wer das nicht begreift, hat die falsche Adresse gewaehlt. An Fluechtlinge in Deutschland richtete der Gruenen-Politiker einen klaren Appell: Auch wer meint, Frauenunterdrueckung gehoere zum Alltag, ist bei uns falsch. Jungs und Maedchen sind gleich. Er bemaengelt: Dass wir unsere Werte, die Werte des Grundgesetzes, nicht staerker durchsetzen, habe ich nie verstanden. Auch ueber den Krieg zwischen Israel und der Terror-Gruppe Hamas spricht Fischer Klartext. Er sagt: Israels hartes militaerisches Vorgehen sichert seine Existenz! Als Aussenminister habe er festgestellt, dass es unglaublich schwer sei, jungen Menschen die israelische Position zu erklaeren, so Fischer. Wenn man sieht, wie Menschen im Westjordanland Steine werfen auf israelische Soldaten, die ihrerseits mit modernsten Waffen ausgestattet sind, hat man den Eindruck, das sei unfair. â–º Dann stellte der Gruenen-Politiker klar: Aber Israel kann sich Schwaeche nicht erlauben. Sonst wird es nicht mehr existieren. Als junger Mann hatte er der linken Protestbewegung der 68er angehoert, die sich mit den Palaestinensern solidarisierte. Darueber sagt Fischer heute, er habe nach dem Sechs-Tage-Krieg  empfunden, dass dieses Volk von Israel unterdrueckt wurde. Fischer: Aber das bedeutete zu keinem Zeitpunkt, dass ich Israels Existenzrecht infrage gestellt haette. â–º Ueber das Massaker vom 7. Oktober mit mehr als 1200 Toten sagt er: Ich habe die Hamas unterschaetzt. â–º Heutige Palaestina-Demos kritisiert der Ex-Aussenminister im Zeit-Interview fuer Parolen wie Free Palestine from German guilt. Fischer rechnet ab: Was fuer ein gefaehrlicher Quatsch! Palaestina kann nicht von deutscher Schuld befreit werden. Die deutsche Schuld ist allein unsere Angelegenheit. â–º Ueber den Krieg im Nahen Osten sagt Fischer in dem Interview: Der Iran ist das grosse Hindernis fuer den Frieden. Das Mullah-Regime habe in der ganzen Region ein Terror-Netzwerk aufgebaut, das es finanziere und mit Waffen ausstatte.",,,,,2554,False
bild,https://www.bild.de/regional/duesseldorf/duesseldorf-regional-politik-und-wirtschaft/100-000-euro-fuer-fotos-und-videos-opposition-nennt-wuest-insta-praesident-86544300.bild.html,"spd, fdp, cdu",2023-12-26,2023-12-26,2024-10-20,,BILD,"Wuest Hendrik, Rhein Boris, Nordrhein Westfalen, Landtag Nordrhein-Westfalen, Instagram, Fotograf",100 000 Euro fuer Fotos und Videos: Opposition nennt Wuest Insta-Praesident,"Fast 100 000 Euro Steuerzahlergeld in nur elf Monaten  so viel hat sich NRW-Ministerpraesident Hendrik Wuest (48, CDU) Fotos und Videos kosten lassen.","Duesseldorf  Fast 100 000 Euro Steuerzahlergeld in nur elf Monaten  so viel hat es sich NRW-Ministerpraesident Hendrik Wuest (48, CDU) kosten lassen, damit handverlesene Fotografen und Kameraleute ihn optisch ins beste Licht ruecken konnten.  Das passt ins Bild des Insta-Praesidenten, das die Opposition im Landtag von ihm zu zeichnen versucht. Exakt haben Hochglanz-Fotos und edle Film-Clips fuer Wuest in diesem Jahr stolze 98 417,64 Euro gekostet. Das ergibt sich aus einer Aufstellung der Staatskanzlei auf Anfrage der Deutschen Presse-Agentur. 2023 wurden im besagten Zeitraum zur Begleitung von Terminen des Ministerpraesidenten 120 foto- und videografische Dienstleistungen in Rechnung gestellt, so die Staatskanzlei. In Einzelfaellen seien mehrere Termine als eine Dienstleistung abgerechnet worden. Die Staatskanzlei hatte zuletzt Anfang August die Kosten fuer Fotografen mit 61 151,53 Euro beziffert. Bis Ende November seien  nun inklusive videografischen Dienstleistungen   noch mal 37 266,11 Euro aufgelaufen. 2022 hatte die Staatskanzlei nach frueheren Angaben nur fuer fotografische Dienstleistungen bei Terminbegleitungen des Ministerpraesidenten 79 653,11 Euro bezahlt. Die Opposition von SPD und FDP hatte sich in der Vergangenheit wiederholt an den Foto- und Videoauftraegen gerieben und Wuest in Anlehnung an ein populaeres Soziales Netzwerk Insta-Praesident genannt. Die Staatskanzlei sieht das naturgemaess anders und betont, dass fuer eine zeitgemaesse und angemessene politische Kommunikation mit einem verstaerkten Fokus auf ein digitales Angebot eine professionelle fotografische Begleitung von Terminen oder Veranstaltungen notwendig sei.  Die Bilder wuerden nicht nur in Sozialen Medien verwendet, sondern auch ueber die Online-Mediatheken des Landes zur Verfuegung gestellt.",,,,,1803,False
