news_outlet;provenance;query_keywords;creation_date;last_modified;crawl_date;author_person;author_organization;news_keywords;content_title;content_description;content_body;Fake News;Extreme bias;clickbait;credible
politplatschquatsch;https://www.politplatschquatsch.com/2024/08/wahrhaft-wehrhaft-anschlag-auf-die.html;europa, krieg, ampel, kultur, abschiebung, cdu, rechtsstaatlichkeit, us, spd, sp, schi, frankreich, grenzen, islamisch, terror, ns, rna, demo, politik, ss, migration, zuwanderung, regierung, asyl, alice weidel, saskia esken, robert habeck, genfer konvention, angela merkel, friedrich merz;26.08.2024;26.08.2024;01.11.2024;;;;Wahrhaft wehrhaft: Anschlag auf die Grundrechte;Die Sehnsucht nach Remigration von Menschen mit rechtsgültigem Aufenthaltstitel hat mittlerweile auch die SPD ergriffen.;"Die Sehnsucht nach Remigration von Menschen mit rechtsgültigem Aufenthaltstitel hat mittlerweile auch die SPD ergriffen.Die Fahnder brauchten kaum  mehr als 24 Stunden, dann hatten sie den Attentäter von Solingen in die Enge getrieben. Der junge Syrer Issa al H. wusste sich angesichts des Ermittlungsdrucks keinen Ausweg mehr. Er stellte sich der Besatzung eines Streifenwagens - ein Umstand, der allein schon dafür spricht, dass die Innenminister von Bund und Ländern drei Monate nach dem Entsetzen von Mannheim keine Rücksicht mehr nehmen auf die Außenwirkung, die die Überpräsenz von Uniformen, strenge Grenzkontrollen und fortwährende Pressekonferenzen der Verantwortlichen haben könnten. Auf der Suche In normalen Zeiten müsste ein Bürger Stunden durch eine deutsche Stadt laufen, ehe ihm Streifenbeamter oder gar ein besetzter Funkwagen begegnet. Doch seit Samstagnacht sind die Zeiten schon wieder nicht mehr normal. Die Bedrohung der Lebensweise, die sich Europa ebenso wie Deutschland schon durch den Mordfeldzug von Islamisten in Paris vor knapp zehn Jahren nicht hatte nehmen ließen, sie rechtfertigt eine Verschärfung, die bisher unvorstellbar war. Polizei auf der Straße. Grenzkontrollen. Umfassende Abschottungsvisionen Regierten die Führer der freien Welt auf den islamistischen Terrorangriff in Frankreich, dem 130 Menschen zum Opfer fielen, noch mit einem friedlichen Marsch vor eigens einbestellten Kameraleuten, hat nach den Geschehnissen von Solingen schon kurz nach der Festnahme des mutmaßlichen Täters der Generalbundesanwalt die Ermittlungen an sich gezogen. Es ist das größte Geschütz, das der Rechtsstaat auffahren kann. Schon bei den Ermittlungen zum Terroranschlag auf die Nord-Stream-Pipelines waren die Bundesermittler so hartnäckig an der Spur der Täter geblieben, dass heute kaum mehr ein Zweifel an der Urheberschaft dreier ukrainischer Tauchlehrer besteht.Keine guten NachrichtenFür Issa al H., der sich vor zwei Jahren als vermeintlich schutzbedürftiger Kriegsflüchtling in Deutschland eingeschlichen hatte, sind das keine guten Nachrichten. Dem Mann aus der syrischen Erdöl-Stadt Deir-al-Sor, 2014 vom IS besetzt, 2017 von den syrischen Regierungstruppen erobert, bis heute aber beständig von zahlreichen Fraktionen umkämpft, droht nun nicht nur eine Anklage wegen dreifachen Mordes und achtfachen Mordversuches. Sondern auch eine Verurteilung wegen Mitgliedschaft in der Terrorgruppe Islamischer Staat. Allein darauf steht eine Freiheitsstrafe von einem Jahr bis zu zehn Jahren.Es wird eng für den Attentäter, denn die Demokratie zeigt sich nun wahrhaft wehrhaft. 2023 hatte Issa al-H. das Angebot deutscher Behörden, nach Bulgarien abgeschoben zu werden, noch abgelehnt. Er war für ein halbes Jahr untergetaucht und hatte anschließend subsidiären Schutz als Kriegsflüchtling gewährt bekommen. Aus der Flüchtlingsunterkunft in der Solinger Innenstadt heraus brach er zu seinem Mordfeldzug auf, als Tatwaffe nutzte er ein Messer aus der Asylheimküche.Alles wie immer Im politischen Berlin hat das Bekanntwerden der Umstände, die den tödlichen Anschlag ermöglichten, einen Wettbewerb um die schnellsten und drastischen Verschärfungen des vom Grundgesetz gewährten Asylrechts ausgelöst. Die Forderung von CDU-Chef Friedrich Merz nach einem Aufnahmestopp für Afghanen und Syrer konterte die SPD-Vorsitzende Saskia Esken mit eigenen Remigrationsideen. Esken will jetzt nicht mehr nur keine Asylverfahren an den EU-Außengrenzen, weil diese ""zwangsweise Externalisierung von Asylverfahren gegen die Genfer Flüchtlingskonvention verstößt"", sondern Abschiebungen auch in Kriegs- und Krisengebiete Keine Rücksicht auf Menschenrechte, die bisher auch Straftäter beanspruchen dürfen, will auch Vize-Kanzler Robert Habeck nehmen. ""Menschen, die das Asylrecht so missbrauchen, haben jeden Schutzanspruch verwirkt"", sprang er auf den Zug der Verschärfer auf, den der Bundespräsident im Stil eines echten Souveräns lenkt: sein Satz ""wir müssen uns vor solchen Angriffen schützen"" hält das Spielfeld nach allen Seiten offen.Im Zug der Verschärfer Alles wie immer also, nur diesmal noch schriller und jenseits jeder Rechtsstaatlichkeit. Der Terroranschlag von Solingen, er wird zum Anschlag auf die Grundrechte. Merz, Habeck, Esken, Söder, sie alle klingen wie Alice Weidel. Die Angst vor Strafe an der Wahlurne, vor dem Verlust von parlamentarischem Einfluss und - im Falle der Ampelparteien - dem Rückhalt auch der letzten noch treuen 15 Prozent in Thüringen und Sachsen bestimmt die Strategie.Der Schaden für Deutschland, einst für sein ""freundliches Gesicht"" (Angela Merkel) und eine Willkommenskultur bekannt, die alle Führungsgremien aller demokratischen Parteien gemeinsam trugen, ist immens. Ohne Zuwanderung - eine halbe Million Neuankömmlinge jährlich gelten als Mindestmenge - wird das Land weiter unter einem wachsenden Fachkräftemangel leiden. Wie im Osten, den Einwanderer wegen des dort weit verbreiteten Faschismus heute schon meiden, drohen auch die Vielfaltsregionen im Westen ohne den bisher garantierten Zustrom nach und nach auszutrocknen Umkehr auf dem Irrweg Doch diese Konsequenzen spielen in der Debatte um die jetzt für erforderlich gehaltenen Zeichen, Symbole und plakativen Maßnahmen keine Rolle. Eine Woche vor den Landtagswahlen in Thüringen und Sachsen will eine allergrößte denkbare Koalition aller Parteien, die sich gern die der ""Mitte"" nennen, ""den Irrweg der erzwungenen Multikulturalisierung"" vielleicht nicht beenden. Aber den Eindruck vermitteln, sie wolle es ""Es reicht"", hat Friedrich Merz ein sofortiges Ende der 2015 von der CDU begonnenen Politik der offenen Grenzen gefordert. Die SPD, die damals den Vizekanzler stellte und das halbe Kabinett, wird mitmachen, ganz egal wobei. Nancy Faeser hat bereits ""einen verstärkten Kampf gegen den islamistischen Terrorismus"" angekündigt - erstmals seit dem Oktober vergangenen Jahres, als die Bundesinnenministerin die 2019 erstmals identifizierte Gefahr zur Chefsache gemacht hatte. Neu diesmal im Regal: Auch der Islamismus als solcher werde nun bald ""mit aller notwendigen Härte"" bekämpft.";1;1;1;0
politplatschquatsch;https://www.politplatschquatsch.com/2024/01/klimageld-absage-nie-versprochen-und.html;klimaschutz, pandemie, schi, krieg, ampel, demo, politik, christ, ss, us, spd, klima, ns, fdp, regierung, sp, robert habeck, olaf scholz, christian lindner;16.01.2024;16.01.2024;01.11.2024;;;;Klimageld-Absage: Nie versprochen und doch gebrochen;Finanzminister Lindner hat dem Klimageld jetzt ein Ende gemacht: Es wird keine Auszahlung geben, weil alles Geld bereits weg ist.;"Immer wieder ritten verschiedene Medien auf dem Thema ""Klimageld"" herum. Finanzminister Lindner hat dem jetzt Ende gemacht: Es wird keine Auszahlung geben, weil alles Geld bereits weg ist.Jeder ahnte es, viele wussten es und einige machten sich sogar einen Spaß daraus, das Thema zur fortlaufenden rechtswidrigen Delegitimierung der Bundesregierung zu nutzen. Obwohl sich bereits am Tag nach der Unterzeichnung des Koalitionsvertrages zwischen SPD, Grünen und FDP abgezeichnet hatte, dass die vereinbarte Einführung eines Klimageldes wohl eher sehr viel später als viel zu früh erfolgen würde, ließen selbst demokratische Medien keine Ruhe. Unverdrossen stocherten sie immer wieder in einem Thema herum, bei dem sich die drei Regierungspartner nicht einmal auf einen amtlichen Namen hatten einigen können.  Keine Kontonummern nirgends ""Pro-Kopf-Bonus"" (SPD), ""Energiegeld"" (Grüne) oder ""Klima-Dividende"" (FDP)? Oder doch lieber ""Klimaprämie""? Auf Vorschlag der Bundesworthülsenfabrik (BWHF) in Berlin gelang es schließlich immerhin, medial die Bezeichnung ""Klimageld"" durchzusetzen. Doch so reibungslos die Einführung der neuen CO2-Steuer geklappt hatte, so schwierig gestaltete sich die Rückzahlung der daraus fließenden Milliarden an die Bürgerinnen und Bürger. Keine Kontonummern hatte man nirgends, kein Geld sowieso, andere finanzielle Verpflichtungen auch und alle Hände voll mit Krieg und Krise und Pandemiefolgen und Klimakampf zu tun sowieso.Als der Sozialdemokrat Hubertus Heil im Mai 2022 seine ""feste Überzeugung"" äußerte, ""dass wir dauerhafte und gezielte Entlastungen für alle mit geringen und mittleren Einkommen brauchen"" und deshalb kategorisch darauf drang, eine ""Rückerstattung des CO2-Preis durch Klimaprämie oder Energiegeld"" (Deutschlandfunk) vorzunehmen, hatte das eher romantische als praktische Gründe Schwärmerische Liebe Heil stieg über die übliche sozialdemokratische Mitarbeiterschiene zum Minister auf, als Nomenklatura-Kader der SPD hegt er bis heute schwärmerische Beziehung zu all den ihm so fremden Armen, Arbeitslosen und Alleinerziehenden. Sein Vorstoß, nun aber mal zur Sache zu kommen, begann mit einer Pressemitteilung, mit der er auch sofort wieder endete. Heil selbst kam seitdem nie mehr auf die Idee zurück, mit ""Klimageld sozialen Ausgleich zu schaffen"".Die Hoffnung der Koalitionäre war, dass sich das Wissen um das Wahlversprechen aller drei Regierungsparteien mit der Zeit verlieren würde. Ein Schweigegelübte und die feste Solidarität der Sprachrohrmedien schien den Erfolg des wagemutigen Unternehmens zumindest zeitweise sicherstellen zu können: Zwischen Heils unabgesprochenem Vorpreschen und den Weihnachtsfeiertagen 2023 lagen 19 Monate, in denenkein Mensch vom  Klimageld sprach, kein Blatt ein Klimageld forderte und kein Sender das Ausbleiben des Klimageldes beklagte. So dass kein Politiker klarstellen musste, dass jeder einzelne Cent natürlich längst anderweitig ausgegeben und wenigstens noch dreimal in selber Höhe für zusätzliche Zwecke verplant ist.Nichts mit bequem von der Klimasteuer leben. Nichts mit sozialem Ausgleich, nichts mit einer sozialen Staffelung ""nach dem Prinzip: Diejenigen, die es am nötigsten brauchen, bekommen am meisten. Diejenigen, die es nicht so nötig brauchen, bekommen etwas. Und diejenigen, die viel verdienen, bekommen nichts"", wie sie Hubertus Heil vorgeschlagen hatte. Die Ressourcen des Staates sind begrenzt. Daher sollte das Klimageld nicht mit der Gießkanne an alle ausgeben werden. Fast zwei Jahre später aber ist es nun amtlich: Die Ressourcen des Staates sind am Ende. Daher soll das Klimageld nun gar nicht mehr ausgezahlt werden.Ein offenes Geständnis Wie so oft war es an Finanzminister Christian Lindner, die Wahrheit amtlich zumachen. Wie Bundeskanzler Olaf Scholz hatte sich auch Klimawirtschaftsminister Robert Habeck zuvor ausdauernd weggeduckt. Jedem in der Bundesregierung war zwar lange klar, dass man am Ende der Amtszeit auch dieses Versprechen gebrochen haben würde. Doch zuzugeben, dass schon seit Monaten niemand im politischen Berlin mehr ein Interesse daran hatte, die schöne schwarze Kasse mit den Milliardeneinnahmen aus der CO2-Abgabe mit irgendjemandem von der Straße zu teilen, würde nur weiter Vertrauen zwischen Regierten und Regierenden zerstören.Lindner, dessen Partei ohnehin kein Vertrauen mehr zu verlieren hat, macht nun Tabula Rasa. Klimaschutz gebe es nicht zum Nulltarif. Schuld an der bisher nicht erfolgten Auszahlung an Arme, Arbeitslose und Alleinerziehende, die am heftigsten unter der mehrfach angehobenen CO2-Steuer leiden, seien reiche Besitzer von neuen Wärmepumpen in Vororten und energetisch sanierten innerstädtischen Altbauten. Niemals sei überhaupt eine Auszahlung des Klimageldes vor 2025 versprochen worden. Damit liege die Koalition voll im Plan mit ihrer Absicht, ""einen sozialen Kompensationsmechanismus über die Abschaffung der EEG-Umlage hinaus"" zu entwickeln und als ""Klimageld"" an die Bürgerinnen und Bürger zurückzuzahlen.Wer kein Vertrauen genießt, kann keines mehr verlieren Nur eben später oder noch besser noch später. Mit seinem unerwarteten Manöver zeigt sich Lindner als gewiefter Taktiker mit großem Weitblick. Der 45-Jährige weiß, dass das Klimageld-Thema vor den anstehenden Wahlen abgeräumt werden muss, damit sich die derzeitigen Koalitionäre nicht zwei lange Wahlkampfjahre fortlaufend gegen den Vorwurf verteidigen müssen, auch dieses Wahlversprechen gebrochen zu haben Jetzt, wo das Ansehen der Ampel so schlecht ist, dass ein weiterer Verfall kaum mehr vorstellbar scheint, ist die Gelegenheit günstig, reinen Wein auszuschenken, selbstbewusst gezapft: Im Grunde sei das alles nie wirklich beabsichtigt gewesen. Im Grunde seien die Nachbarn, die Wärmepumpensubventionen abgegriffen hätten, schuld, dass es dann auch wirklich nicht zu einer Auszahlung kam.";0;0;0;1
politplatschquatsch;https://www.politplatschquatsch.com/2020/01/frankfurter-rundschau-geschichte-einer.html;spo, xi, cdu, mittelstand, afd, us, klima, weltklima, sp, schi, grenzen, csu, ns, klimaschutz, sparen, politik, ss, trump, regierung;24.01.2020;24.01.2020;01.11.2024;;;;Frankfurter Rundschau: Geschichte einer Radikalisierung;"Man kann zusehen, wie der Schlamassel immer dicker wird. Die FR hat längst nicht nur die Bundesregierung im Bestreben überholt, nichts mehr links neben sich zu dulden, sondern auch sich selbst. Noch vor fünf Jahren hatte es hier ""Merkels Märchenstunde"" geheißen, später wurde daraus die Frage ""Kann denn Merkel böse sein?""  Heute badet das Blatt seine Kanzlerin in standing ovations.";"Selbstverständlich sind sie hier für einen allenfalls noch verengten Meinungskorridor. Selbstverständlich für radikale Schritte hin zu mehr Klimaschutz. Selbstverständlich würde es, ging es nach der verbliebenen Restredaktion  der Frankfurter Rundschau, keine AfD mehr geben, ja, überhaupt nichts rechts von der CDU, die CSU eingeschlossen. Wäre die Feder wirklich ein Schwert und bei der Frankfurter Rundschau GmbH könnten sie damit am besten kämpfen, Deutschland sähe längst anders aus als man es kennt: Eine Art DDR, nur ohne Bitterfeld, dafür aber mit jeder Menge an den neuseeländischen Maori orientierten Taburegeln, die es dem Staat ersparen, zwischen Recht und Unrecht eine Strafbarkeitsgrenze zu ziehen. Alles würde bei der FR ausgemacht, von Denkern wie Katja Thorwarth, Sylvia Kotting-Uhr Bretty Sarapuu, Katja Berlin und Stephan Hebel, bürgerlich gekleidete Revolutionäre, deren Namen ausgedacht klingen, die aber überzeugt sind, jeder Satz, den sie niederbringen, könne auslösen, wovon sie träumen: Einen Ruck, der das Land in eine Zeit katapultiert, in dem eine mutige Regierung die Unternehmenssteuern erhöht, dass es quietscht, den Armen gibt und dem Klima hilft. Alt, aber ohne Zukunft  Zur ""Taz"", zum Neuen Deutschland und zur ""Jungen Welt"" ist es von der Frankfurter Rundschau des Jahrgangs 2019 nur noch einen Spaziergang weit weg. Das Blatt, da nach Aachener Nachrichten und Berliner Zeitung als dritte deutsche Tageszeitung eine Lizenz der Information Control Division der US-Militärregierung bekam, hat sich seit den Zeiten Karl Gerold, der die FR einst als ""linksliberal"" bezeichnet hatte, grundlegend gewandelt. Aus der Zeitung, die keine der Arbeiter-, sondern eher eine der Gewerkschaftsbewegung war, gelesen von Arbeitern, mehr aber aber noch vom arbeitenden Mittelstand der Brigadiere, Ingenieure, Universitätsdozenten und mild links überzeugten Lehrer*Innen (m/w/d), wurde auf dem endlos langen Weg in den Auflagenkeller, der so dunkel ist, dass die FR bereits seit sieben Jahren keine Zahlen mehr meldet, ein zuweilen feucht geiferndes Kampfblatt für die jeweilige Überzeugung der Woche. Immer stramm auf Regierungslinie  Windschnittig positioniert ein schmales Trüppchen von schreibfreudigen Ideolog*Innen die altehrwürdige Zeitung immer dort, wo der gesunde Menschenverstand nicht hinkommt. Ginge es nach den Meinungsführern der nach einer Kette von Notverkäufen inzwischen im Besitz der für ihre entschiedenen Gewinnoptimierungsmethoden bekannten Ippen-Gruppe angelangten Zeitung, wären deutsche Immobilienbesitzer längst enteignet, ein Sonderkommando der Bundeswehr hätte Donald Trump impeacht und  wer das Wort ""Meinungsfreiheit"" mahnend in den Mund nähme, bekäme ein Bußgeld wegen Wiederbetätigung aufgedrückt. Das unterscheidet sich nicht allzusehr vom Stoff, den andere Blätter bieten, verzweifelt bemüht, den anhaltenden Auflagenschwund mit noch mehr Erziehungshilfe nach unten und Politikberatung nach oben aufzuhalten. Doch die Frankfurter Rundschau schafft bei alldem ein besonderes Kunststück: Kein anderes Blatt aus der alten Bundesrepublik steht einerseits fest an der Seite der Bundesregierung. Während es andererseits jedes Bemühen derselben, Überwachungsgesetze auszuweiten, neue Verbote anzuordnen oder Steuern zu erhöhen harsch deshalb kritisiert, weil die Überwachung immer noch nicht weit genug geht, die Verbote nicht ausreichend umfassend sind und die Steuern nie hoch genug. Wenn eine Bundesbildungsministerin, beileibe nicht die hellste Kerze auf der Torte der Spitzenpolitik,  also vor einer ""Verengung des Diskurses"" warnt, weil Menschen offenbar glaubten, „dass man nicht mehr alles äußern darf“, dann ist die FR weniger beunruhigt über die Diagnose als empört darüber, dass jemand sie stellt. Eine ""unverantwortliche Aussage"" sei das nämlich ""und nur mal wieder Wasser auf die Mühlen des rechtsextremen, homophoben, sexistischen, frauenverachtenden Teils der Bevölkerung, der nicht damit leben kann, dass man ihnen ins Gesicht sagt, dass ihre Meinung sie als rückständige Menschenfeinde enttarnt"". Erklärungen von oben nach unten  Rückständig wäre das letzte, was die FR sein wollte. Obwohl rein rechnerisch jeder einzelne Text das Blatt seit Jahren Leser gekostet hat, bleibt es stur bei seinem Argumentationsmuster. Es wird von oben nach unten erklärt und Regierungspolitik als prinzipiell sehr gut begründet, nur dass sie eben nie weit genug geht. Was von oben kommt, ist gut, was unten dazu gedacht und gesagt wird, latent gefährlich. Wer gegen begründete Maßnahmen von Kabinett oder EU protestiert, weil er anderer Ansicht ist, liegt falsch. Denn echte Kritik ist hier nur mehr zulässig, wenn sie sich außerhalb der Landesgrenzen begibt. Oder die Richtigen trifft. Man kann zusehen, wie der Schlamassel immer dicker wird. Die FR hat längst nicht nur die Bundesregierung im Bestreben überholt, nichts mehr links neben sich zu dulden, sondern auch sich selbst. Noch vor fünf Jahren hatte es hier ""Merkels Märchenstunde"" geheißen, später wurde daraus die Frage ""Kann denn Merkel böse sein?""  Heute badet das Blatt seine Kanzlerin in standing ovations  und ein bisschen klingt es, als sei man selbst auch ein wenig stolz, dabei mitgeholfen zu haben. Das Verbot von Ölheizungen, eine Aktion, die Deutschland zurückkatapultieren wird ins Zeitalter des Holzfeuers, dem Finanzminister aber Mehreinnahmen in Höhe von 25 Milliarden Euro verspricht, geht der FR natürlich nicht weit genug. Nicht erst 2026 dürfe das kommen und nicht so, dass alte Ölheizungen weiterlaufen. Nein, sofort und dann vollständig, fordert die Zeitung, die im Frühjahr 2019 bereits zum sechsten Mal eine eigene Frankfurter Automobilausstellung veranstaltete. ""Faszination für das Automobil"" (FR) zog damals  ""rund 8.000 Autofans"" an, wie die unerbittlich für das Weltklima streitende Zeitung stolz berichtet. Auch bei Moral ist es eben immer gut, wenn man sie doppelt hat.";;;;
politplatschquatsch;https://www.politplatschquatsch.com/2024/01/verstaatlichung-der-staatsbahn-comeback.html;schi, demo, politik, amerika, ss, us, klima, spo, ns, linke, sp;26.01.2024;26.01.2024;01.11.2024;;;;Verstaatlichung der Staatsbahn: Comeback der Bonzenschleuder  ;Der Linkspolitiker Sören Pellmann fordert eine Verstaatlichung der Deutschen Bahn. Die ist aber bereits Staatseigentum;"Ein Marx aus der amerikanischen KI in einem Zug der deutschen Staatsbahn fordert für einen Pendler aus Sachsen deren Verstaatlichung.Linkssein, revolutionär und gegen die Verhältnisse, das war über Generationen hinweg ein Gewissenszustand, der sich bei jungen Menschen einstellte, wenn sie eine Ahnung davon überkam, wie hart, schwer zu verstehen und bis in die feinsten Kapillaren des Alltag als ungerecht misszuverstehen die Welt und das Leben auf ihr sein kann. Der Linke, seit Rosa Luxemburg gern auch die, lehnte sich auf gegen diese Verhältnisse. Er machte Strukturen aus, die sie zementierten. Er fand Wissenschaftler wie Marx, Engels, Lenin und Stalin, denen es gelang, die Ursachen aller Leiden zu ermitteln. Die Besitzverhältnisse! Das Eigentum. Das Profistreben Die Eigentumsfrage als linke Lebenslüge Wer Eigentum an Produktionsmitteln hat, hat privilegierten Zugriff auf die Früchte der Arbeit, die Menschen an diesen Produktionsmitteln erledigen. Er kann sich nehmen, ehe andere zugreifen dürfen. Ihm gehört nicht nur was ist, sondern was nach der Nutzung übrigbleibt. Daraus, so folgern kommunistische Theoretiker bis heute, ergibt sich die Notwendigkeit, zu enteignen, was immer ist, damit es neu verteilt gerechter zugehen kann, also etwa wie damals, als alles noch allen gehörte und den Reichen nur zwei Prozent aller Spareinlagen.Nicht alles sollte unter allen verteilt werden, aber der Rest ist unbedingt zu verstaatlichen, weil nur eine Neuregelung der Eigentumsfrage zu einer  weitgehenden Erneuerung der Demokratie führen kann, so ist die Beschlusslage in der Linkspartei, die dieser Erneuerung zwingend bedarf, droht sie doch bereits in wenigen Monaten von der politischen Landkarte zu verschwinden.Sören Pellmann, ein altgedienter Funktionär der früher als SED selbst wirtschaftslenkenden und -leitenden Linkspartei, würde den leidigen Bahnstreik nun am liebsten zum Anlass nehmen, mit den Enteignungen jetzt anzufangen. ""Einen Scheiß regelt der Markt"", reitet der Mittvierziger mit einer selbstgebastelten Marx-Kachel den Empörungsgaul gegen die Lokführergewerkschaft. Deren Streik sei ""Symptom des Versagen der Deutschen Bahn"". Die müsse deshalb verstaatlicht werden.Keine Solidarität mit den Arbeitern Pellmann, mit 16 in die damals ""PDS"" genannte heutige Linkspartei eingetreten und über die übliche Nomenklatura-Schiene mit Abgeordnetenpraktika in den Bundestag gelangt, spricht als Betroffener von Privatbesitz. Trotz aller Klimaappelle pendelt der nebenberuflich als Leipziger Stadtrat beschäftigte Lehrer zwischen Berlin und Leipzig.Jeder ausgefallene Zug, jede Verspätung beeinträchtigt Pellmann direkt und lässt ihn romantisch von einer Bahn träumen wie sie früher war: Ein Staatsunternehmen, das pünktlich ist Und dann vielleicht eines Tages auch wieder die ""Bonzenschleuder"" fahren lässt, die zu DDR-Zeiten SED-Funktionäre und Betriebsdirektoren von Leipzig nach Berlin beförderte.Fakten spielen für den Sachsen dabei keine Rolle, auch die Solidarität mit den um bessere Lebensverhältnisse kämpfenden Lokführer*innen bleibt auf der Strecke. Pellmann, Monatseinkommen über 10.000 Euro, stellt sich nicht etwa hinter die Forderungen der Bahner, die derzeit nicht einmal halb so viel Gehalt beziehen wie er Sondern er nutzt die Gelegenheit, die Verstaatlichung eines Unternehmens zu fordern, das sich bis heute zu hundert Prozent im Besitz des Staates befindet. Wie Dutzende und Aberdutzende weiterer Unternehmen könnte selbst eine Linkspartei, die neben den Banken, der Energieversorgung, der Telekommunikation und der Wohnungswirtschaft auch den  ""Eisenbahnverkehr"" (Die Linke) zu einem staatlichen Monopol machen will, die Deutsche Bahn nicht verstaatlichen, weil sie bereits staatlich ist Sehnsucht nach einer anderen Welt Details als der Realität, die den wahren Linkspolitiker nicht irritieren. Die Sehnsucht nach einer Welt, in der es der wieder sozialistische Staat allein ist, der ""privilegierten Zugriff auf die Früchte der Arbeit"" hat, die Menschen an seinen Produktionsmitteln erledigen müssen, ist nicht nur größer als traditionelle Solidarität der Linken mit Menschen, die für ein besseres Leben kämpfen. Sondern auch stärker als die  Einsicht, dass ein Staatsbetrieb so wenig verstaatlicht werden kann wie ein nackter Mann in der Lage ist, Kleidung abzulegen Sören Pellmann, Sohn eines hochrangigen SED-Politikers, der nach dem Ende der DDR als Unterstützer der linksextremistischen Antikapitalistischen Linken aktenkundig wurde, ist damit realistisch im Sinne eines erfundenen Che-Guevara-Zitats: ""Seien wir realistisch, fordern wir das Unmögliche.""Nun ist es ja auch bald vollkommen egal.";;;;
