news_outlet;provenance;query_keywords;creation_date;last_modified;crawl_date;author_person;author_organization;news_keywords;content_title;content_description;content_body;Fake News;Extreme bias;clickbait;credible
politplatschquatsch;https://www.politplatschquatsch.com/2024/08/kampf-gegen-telegram-frankreich-landet.html;schi, krieg, europa, frankreich, demo, politik, usa, ss, us, spo, terror, ns, regierung, sp;27.08.2024;27.08.2024;01.11.2024;;;;Kampf gegen Telegram: Frankreich landet Faesers größten Coup;"Kein Fußbreit den Feinden der Meinungsfreiheit. Telegram-Gründer Pawel Durow  sitzt im Rahmen des ""Bekämpfungsrechts"" in Erzwingungsgewahrsam ";"PPQ-Kolumnistin Svenja Prantl hatte schon vor Jahren klare Forderungen an die Politik gerichtet. Nun endlich hat die EU im französischen Terrorrecht eine Handhabe gefunden, den Bedrohern der Freiheit die Instrumente zu zeigen. Sie hat lange gekämpft, mehrere Jahre. Hartnäckig blieb Bundesinnenministerin Nanny Faeser bei der Stange, ohne dass es die Öffentlichkeit noch mitbekam. Nach außen hin sagte sie den Kampf gegen das den Kurznachrichtendienst Telegram ab. Das früher als Hauptkampfmittel der belorussischen Opposition gelobte Unternehmen hatte die Sozialdemokratin zwar vorgeführt, verhöhnt und blamiert. Faeser aber schien sich daran gar nicht zu stören. Sie lächelte die Angriffe weg, akzeptierte das Versagen der zuständigen Behörden als weiteren Fall von verlorener Kontrolle und ließ sich auch von totalitären Scharfmachern treiben, die von einem ""Trockenlegen des Sumpfes"" träumten. Die Geduld der Jägerin Ein Trick, wie die Welt heute weiß. Nancy Faeser, in den Jahrzehnten politischer Nah- und Fernkämpfe nicht nur mit Wassern gewaschen, hat Telegram nur in Sicherheit wiegen wollen. Der Bundeshetzkanal, auf dem sich Leugner aller Art versammeln, Maßnahmekritiker sich austauschen und Schwurbler ihr querdenkendes Publikum bedienen, sollte nur glauben, dass sich die Bundespolitik abreagiert habe und nun einen einfacher zu besiegenden Gegner suchen werde. Faesers plante, was sie sagt: Eine europäische Lösung. Und sie wurde verstanden, wie der Hinweis auf eine noch ausstehende Einigung der 27 Mitgliedsstaaten immer verstanden wird: Nächstmöglicher Termin St. Nimmerleinstag.Auch das hat wohl zum trickreichen Plan gehört, um der ""App der Opposition"" (Tagesschau) endlich beizukommen. Mit der Festnahme von Telegram-Gründer Pawel Durow auf dem Flughafen von Paris zeigt sich Faesers kluges Kalkül. Es mag manchmal länger dauern, bis der Rechtsstaat seien Feinde greifen kann. Er mag manchmal nicht selbst vor Ort sein, wenn es ihnen an den Kragen geht. Aber er vergibt nicht, verzeiht nicht und lässt nicht locker, bis er den Hintermännern einer App, die ""Rechte nutzen, um sich zu vernetzen und Falschnachrichten zu verbreiten"" (ZDF), die Instrumente zeigen kann.Der Sonderrechtsstaat greift zuNancy Faeser hat sich nicht zum französischen Coup rund um Durow geäußert, doch das gehört zum Geschäft. Der gebürtige Russe hatte sein Heimatland einst verlassen, um Nachstellungen zu entgehen. Der Kreml hatte ihm vorgeworfen, nicht umfänglich mit den Behörden zusammenzuarbeiten, um Oppositioneller und Kritiker habhaft zu werden. Auch ähnliche, aber legitime Forderungen europäischer Behörden hatte der mittlerweile in Dubai lebende Milliardär ins Leere laufen lassen Frankreich, schon seit längerer Zeit ohnehin ohne gewählte Regierung, nutzte die Gelegenheit, dem eingebürgerten Geschäftsmann klarzumachen, wer in Europa das Sagen hat. Es sind Frauen wie Nancy Faeser und Männer wie Thierry Breton, die von ihren Parteien damit betraut wurden, ein Auge auf alles zu haben und den Feinden unserer Ordnung keinen Fußbreit Boden zu gewähren. Nicht Betreiber von Internet-Plattformen, denen Hunderte von Millionen vertrauen.Eine Festnahme mit Signalwirkung. Kaum saß Pawel Durow wegen des Vorwurfs, er  habe ""nicht genug gegen Drogenhandel, Betrug und Kindesmissbrauch auf Telegram unternommen"" in einer als ""Gewahrsam"" bezeichneten Gefängnisunterbringung, die als Antwort auf die terroristischen Anschläge von 2015 erfunden worden war, meldete sich mit Elon Musk ein anderer Verteidiger einer falsch verstandenen Meinungsfreiheit.Es sei absurd, eine Plattform oder ihren Besitzer dafür verantwortlich zu machen, wenn Dritte den Dienst missbrauchten, behauptete der Besitzer des Nachrichtendienstes X. Europa verhalte sich totalitär: ""Es ist das Jahr 2030 in Europa und du wirst hingerichtet, weil du ein Meme geliked hast"", behauptet Musk, der wohl schwant, dass er der nächste Kandidat für einen Gefängnisaufenthalt sein könnte.Verwarnhaft für Verweigerer Faktenchecker konnten ihn jedoch schnell widerlegen. Weder habe die in den meisten EU-Staaten extralegale Unterbringung Durows in einer Zelle etwas mit dem Kampf der EU gegen einen Wildwuchs bei der Meinungsfreiheit zu tun, hieß es in Brüssel, noch sei das als Waffe gegen widerspenstige Großkonzerne eingeführte ""Gesetz für digitale Dienste"" (DSA) Grundlage der Verwarnhaft für den 39-Jährigen Es gehe nicht um Meinungsfreiheit, hieße es aus der EU-Kommission. Die französischen Behörden handelten auf Basis des französischen Strafrechts und ""im Rahmen einer gerichtlichen Untersuchung erfolgt, die die Pariser Staatsanwaltschaft Anfang Juli eingeleitet"" hatte. Da Pawel Duwow ""unzureichend mit den Strafverfolgungsbehörden zusammengearbeitet"" habe, ""um gegen Aktivitäten wie Betrug und organisierte Kriminalität auf Telegram vorzugehen"", gelte er als ""mitschuldig"" an der Verbreitung, dem Anbieten oder Zugänglichmachen von pornografischen Bildern von Minderjährigen bis zur Organisierter Kriminalität.Das neue Konzept von Normalität und Freiheit Schwere Vorwürfe, die nach dem in Frankreich seit Mitte der 90er Jahre eingeführten Regeln des sogenannten ""Bekämpfungsrechts"" eine Art Erzwingungsgewahrsam erlauben. Der Frankfurter Rechtsprofessor Günter Frankenberg nennt das ein ""neues Konzept von Normalität und Freiheit"", das langjährige ""kriegerische und autoritären Neigungen legitimiert bzw. verschärft"" habe.Genau der richtige Boden, um einem wie Pawel Durow klarzumachen, womit er es zu tun hat. Flankiert vom offenen Eingeständnis des französischen Präsidenten Emmanuel Macron, dass die Festnahme des Telegram-Chefs ""in keiner Weise eine politische Entscheidung"" gewesen sei, funktioniert das Wegsperren eines überreichen, gut vernetzten und einflussreichen Multimilliardärs wie ein Signalfeuer für alle, die noch nach dem richtigen Kurs im Umgang mit den aktuellen Leitlinien der Meinungsfreiheit suchen. Übertreibe es nicht. Behalte alles für Dich, bei dem Du denkst, es könnte vielleicht nicht allen gefallen. Und leg Dich ja nie mit dem Staat an, denn der hat den längeren Atem.";;;;
politplatschquatsch;https://www.politplatschquatsch.com/2024/01/klimasparpaket-wirkt-ende-der-erwarmung.html;klimawandel, schi, usa, ss, us, klima, ns, regierung, sp, olaf scholz;14.01.2024;14.01.2024;01.11.2024;;;;Klimasparpaket wirkt: Ende der Erwärmung;25.000 Klimajahre gespart: Die Maßnahmen der Regierung gegen die Erwärmung wirken sogar kurzfristig;"Deutschlands Klimaanstrengungen wirken bereits.Ganz genau wusste es am Ende nur die ""Tagesschau"", sonst war ja niemand dabeigewesen. Doch aus Hamburg kam schon Anfang November die alarmierende Nachricht: So heiß wie 2023 war die Erde ""seit mindestens 125.000 Jahren nicht"" gewesen, das hatten ""EU-Wissenschaftler"" herausgefunden. Die Folgen waren klar: ""Extremwetterereignisse mit Tausenden Toten"" (Tagesschau) drohten. Verhindern ließ sich das nicht mehr. Insgesamt 74.000 Menschen starben tatsächlich, allein 58.000 von ihnen bei dem verheerenden Erdbeben in der Türkei. Notfallfonds wirkt bereits Aber zumindest in Berlin wurde reagiert. Bei seiner Stippvisite auf der Klimakonferenz in Dubai kündigte Bundeskanzler Olaf Scholz einen neuen Notfallfonds für vom Klimawandel besonders betroffene Staaten wie Deutschland an. Wenig später schon strich die Bundesregierung Subventionen für klimaschädlichen Traktordiesel, der CO2-Preis wurde erhöht, Zuschüsse für verzichtbaren Güterverkehr auf der Schiene wurden zusammengekürzt, Elektroautoprämien über Nacht kassiert und Bürgergeldversprechen zurückgenommen Die Zweifler zweifelten, die Hetzer hetzten. Deutschland allein könne gar nichts bewirken, hieß es. Der Aufwand sei zu groß, die Einsparung zu klein. Doch inzwischen ist klar: Wohl noch keine Bundesregierung weltweit hat in so kurzer Zeit mit einem so bunt gemischten Paket an Sparmaßnahmen so viel erreicht. War es im November noch heißer gewesen als in den davorliegenden 125.000 Jahren, haben die EU-Wissenschaftler des  EU-Klimawandeldienst Copernicus ihre Berechnungen korrigiert. Nun ist es im vergangenen Jahr nicht mehr heißer gewesen als in den 125.000 Jahren zuvor, sondern nur noch heißer als in den 100.000 Jahren zuvor.Sinken durch Anstieg  Den neuen Erkenntnissen zufolge lag die globale Temperatur nun nur noch 1,48 Grad über dem Durchschnitt der Jahre 1850 bis 1900. Obwohl im vergangenen Jahr noch von einer um 1,3 Grad über dem vorindustriellen Niveau liegenden Temperatur geschrieben worden war, ist in den zurückliegenden zehn Wochen offenbar eine Abkühlung eingetreten.     Die zeigt, dass es ""wahrscheinlich ist, dass die Temperaturen 2023 wärmer waren als in den vergangenen 100.000 Jahren"" Die ""ziemliche Sicherheit"", dass man sagen könne ""dass dies das wärmste Jahr der vergangenen 125.000 Jahre ist"", wie die stellvertretende Direktorin des Copernicus Climate Change Service (C3S) gesagt hatte, sie ist geschwunden. Die Klimabemühungen der Bundesregierung zeitigen erste Erfolge, die globale Klimauhr wurde um 25.000 Jahre zurückgedreht.";;;;
politplatschquatsch;https://www.politplatschquatsch.com/2024/08/politisch-medialer-komplex-treiber-und.html;rna, schi, ampel, demo, politik, spd, usa, ss, afd, us, spo, familie, rechtsextremismus, terror, ns, linke, regierung, sp;28.08.2024;28.08.2024;01.11.2024;;;;Politisch-medialer Komplex: Treiber und Getriebene;Deutsche Medien am Ende der Geduld, die sie fast ein Jahrzehnt als alternativlos verteidigt hatten.;"Absetzbewegungen.Als wäre eine Tür plötzlich zugeschlagen, ein Auto frontal vor eine Mauer gefahren, ein Sargdeckel zugeklappt. Hetzer, Hasser und Zweifler reiben sich die Augen. Ist das noch meine ""Zeit""? Ist das noch der ""Spiegel"", den ich abbestellt hatte? Was ist los bei der FAZ, bei der SZ und der Taz? Woher kommt diese Sehnsucht nach Maßnahmen, Einschränkungen der Grundrechte, dieses Schwurbeln von einem ""verunsicherten Land"", in dem ""selbst Leute, die die Vielfalt feiern, fangen an zu zweifeln""? (SZ). Was ist passiert, dass die Ampel ""sich jetzt ehrlich machen"" (Zeit) soll und ""jede Brandmauer anders""(Taz) ist? Schuld hat nicht mehr ""das Messer"" und die Ankündigung entschlossenen staatlichen Handelns wird als""Ritual, als Phrasen hilfloser Politiker"" verächtlich gemacht.  Am Ende der Geduld Deutsche Medien am Ende der Geduld, die sie fast ein Jahrzehnt als alternativlos verteidigt hatten. Selbst im SPD-Medienimperium erklingen Klagen über ""Staatsversagen"", bislang ein klares Erkennungsmerkmal rechter Populisten. Deutlich leiser sind die Warnungen vor einer Instrumentalisierung des Terroranschlags, deutlich kleiner sind die Schlagzeilen über den Aufstand der Anständigen, die nach der Tragödie von Solingen ""Hand in Hand für Demokratie und Menschenrechte"" auf die Straße gingen, um ""ein klares Signal für Demokratie, Menschenrechte, ein solidarisches Miteinander in unserer Stadt und ganz Sachsen"" (RND) und gegen den Rechtsextremismus zu setzen.Es scheint Konsens nicht nur im politischen Berlin, sondern auch in den Medienhauptstädten der Republik: Wer jetzt noch punkten will, muss das Ruder herumreißen. Und denen nach dem Mund schreiben, die anfangs als Pegida gegen die ""Islamisierung des Abendlandes"" marschierten und später begannen, je mehr falsch zu wählen, je weniger ihre Wahlentscheidung praktische Folgen hatte.Wahlhelfer des Rechtsrucks Die besten Wahlhelfer des Rechtsrucks sind es schlagartig nie gewesen. Als sei es seit Jahren nach jedem Anschlag, jeder Partypeople-Zusammenkunft und jedem Mord auf offener Straße ihr beständiges Gebet gewesen, dass ""die Bundesregierung nun handeln"" (Die Zeit) müsse, werden die pflichtschuldigen Betroffenheitsadressen der Parteispitzen und Regierungsvertreter für die Familien der Toten und Genesungswünsche für die Verletzten nur halbherzig als ""wichtig"" begrüßt, damit die ""Betroffenen wissen, dass Politik und Gesellschaft sie nicht alleinlassen"". Diese Solidarität aber reiche nicht, weil es ""jetzt"" vielmehr ein Signal der Entschlossenheit der demokratischen Parteien brauche, ""das mit mehreren Maßnahmen unterfüttert ist"".Das ""Signal des Schreckens"" (FR) aus Solingen, es hat nicht nur in den Parteizentralen Panik ausgelöst, es hat auch in den Elfenbeintürmen der Leitmedien alle Gewissheiten erschüttert. Glaubten die Aktivisten dort bisher, sie müssten nur lange genug und möglichst immer noch mehr und deutlicher beteuern, dass alles eines Tages gut werden werde, wenn alle nur fest an das ""Wir schaffen das glaubten, hat der ""Anpassungsdruck"" (FR), dem Bundeskanzler Scholz mit seiner ""im großen Stil abschieben""-Parole im Oktober vergangenen Jahres sichtbarsten Ausdruck verlieh, inzwischen auch die erreicht, deren gesamtes Glaubensgebäude auf der Grundlage basiert, dass kein Glas je voll und das Boot immer toll ist.Bedeutung für die Presselage Die Auswirkungen des Wechsels des Betrachtungswinkels - nicht der erste, aber vielleicht der letzte - sind noch kaum abzuschätzen. Denn für die Regierungspolitik haben Medien auch im Deutschland der 2000er Jahre noch immense Bedeutung: Neben Umfragen ist die von Presseausschnittdiensten tagesaktuell zusammengestellte ""Presselage"" der wichtigste Orientierungspunkt beim Steuern des Staatsschiffs. Wer im politischen Raumschiff sitzt, zwischen Kabinettssitzung und Treffen des Parteivorstandes und Expertenbriefing und Fernreise und Pressekonferenz und Friesland Bio Weiderind im Borchardt, der hat kaum eine andere Chance, mitzubekommen, was da draußen sonst noch so läuft.Gute Presse bedeutet gute Politik, ein guter Politiker tut, was die Zeitungen, Magazine und Gemeinsinnsender fordern, denn naturgemäß nörgeln und schimpfen die je weniger, je mehr sie den Eindruck haben, es werde so regiert, wie sie es vorgeschlagen haben Wer wie die SPD über eine eigene Medienfirma verfügt, die täglich Millionen zumeist unwissender Leser erreicht, bekommt sein eigenes Echo zurück. Andere dürfen sich wie die Grünen und die Linke darauf verlassen, dass die eigene Nähe zu einem Milieu, aus dem sich auch die wichtigsten Stimmen der Medienrepublik rekrutieren, zu einem harmonischen Miteinander beim Versuch führt, die einfachen Menschen draußen im Land von den Vorteilen gewisser Nachteile zu überzeugen.Beunruhigende Zeichen Es ist ein beunruhigendes Zeichen, dass dort jetzt etwas zerbrochen ist. Die festen Bande, über die jahrelang gespielt wurde, mit gemeinsamen Zeilen, gemeinsamen Reisen und Talk-Show-Kumpelei, sind erschüttert. Die, aus deren Argumenten und filigranen, liebevoll handgefertigten ""Faktenchecks"" das Luftpolster gewebt war, auf dem die Große Koalition und später die Ampel weitermarschierten, als der Rand des Abgrunds längst überschritten war, gehen von der Fahne und treten nach: Parteien seien ""schrumpfende Biotope mit unzureichender Bindung ans Wählerumfeld"" zitiert die Frankfurter Rundschau hochnäsig die, die immer alles richtig, aber nun doch schon immer alles falsch gemacht haben.Das Problem der Leitmedien waren nie die fehlenden Leser. Sie zogen ihre Bedeutung aus denen, die sie noch hatten. Wenige, aber wichtig. Multiplikatoren, eine frühe Vorform des Influencers, und längst auch in deren Nachbarschaft unterwegs. Multiplikatoren, die von Multiplikatoren beflüstert werden. Und verschwiegenen Runden Unter Drei zurückflüstern. Treiben und Getriebene, kaum mehr zu ermitteln, wer genau welche Rolle spielt Umso mehr schmerzt der Verrat, das Umkippen vor der Zeit und der Hohn, der sich hinter despektierlichen Bezeichnungen wie ""roter Sheriff"" versteckt, die auf einmal Konjunktur haben. Das Vergessen der eigenen Rolle beim versuch der Durchsetzung der Beschlüsse geht soweit, dass die besten Wahlhelfer AfD den Kanzler beschuldigen, der beste Wahlhelfer der AfD zu sein.";;;;
politplatschquatsch;https://www.politplatschquatsch.com/2024/01/nach-treffen-mit-rechtsextremistin.html;europa, ampel, hitler, abschiebung, israel, spo, linke, afrika, asylpolitik, usa, us, spd, klima, sp, schi, migrationspolitik, ns, rna, demo, politik, antifa, ss, migration, regierung, asyl, robert habeck, olaf scholz, janine wissler, annalena baerbock;14.01.2024;14.01.2024;01.11.2024;;;;Nach Treffen mit Rechtsextremistin: Kommt jetzt ein SPD-Verbot? ;Nach Treffen mit Rechtsextremistin: Brauchen wir ein SPD-Verbot? ;"Das Treffen des Sozialdemokraten Olaf Scholz mit der italienischen Rechtsextremistin Meloni wirft im Nachhinein Fragen auf. Was planten die beiden genau? Kaum einer nahm es zur Kenntnis, nirgendwo erregte es größere Aufmerksamkeit oder sorgte gar für einen Skandal. Als sich Bundeskanzler Olaf Scholz Mitte vergangenen Jahren nach Italien begab, um dort seine Amtskollegin Meloni zu treffen, war von ""freundschaftlicher Atmosphäre"" zwischen den alten Achsenpartnern die Rede, von zuversichtlichen Äußerungen, ""dass Europa eine gemeinsame Antwort in der Asylpolitik findet"" und von ""guten Beziehungen"" zwischen den beiden im Verlauf der Geschichte schon mehr als einmal miteinander verbündeten Staaten.  Übernahme menschenrechtsfeindlicher PositionenNach einem Treffen mit der italienischen Ministerpräsidentin Meloni in Rom warb Scholz sogar dafür, ""eine verlässliche Zusammenarbeit mit Herkunfts- und Transit-Staaten herbeizuführen"". Übersetzt in korrektes Deutsch meint das nichts weniger als die Übernahme der menschenrechtsfeindlichen Meloni-Position, sogenannte sichere Herkunftsländer nur bei der Schaffung von Arbeitsplätzen zu unterstützen, wenn diese sich bereitfinden, Flüchtende und Geflüchtete, die in der EU nicht gewollt sind, bei sich unterzubringen.In jenem Sommer 2023 schien das alles nicht mehr zu sein als eine Geste. Olaf Scholz ist in vielen Jahrzehnten auf dem diplomatischen Parkett geschult. Er weiß genau, dass es für ein höheres Ziel oft notwendig ist, Dinge zu versprechen, die man nicht wird halten können, dass aber immer die Chance besteht, dass bis zu dem Tag, an dem sich das herausstellt, alle vergessen haben, was man versprochen hat. Geschieht das nicht, auch darin ist Deutschlands wichtigster Sozialdemokrat Meister, vergisst man selbst.Am Arm der italienischen Faschistin Darauf hatten sich auch beim Treffen des Chefs der deutschen Fortschrittskoalition mit der italienischen ""Faschistin"" (RND) alle wichtigen Beobachter verlassen. Niemals würde Scholz die Ausweisung von Menschen ernsthaft planen, nur weil sie keinen legalen Aufenthaltstitel haben. Niemals würde er fragwürdigen Partnern in kaum andemokratisierten Staaten die Aufgabe anvertrauen, Deutschlands sozialen Frieden zu sichern, indem sie den Zustrom von Schutzsuchenden ins Land ausbremsen. Und schon gar nicht würde der ehemalige linke Sozialdemokrat, der in seiner Partei heute als einer der letzten Rechtsausleger gilt, all das in einem ""Pakt mit der Rechten"" (Stern) angehen, gemeinsam mit einer ausgewiesenen Rechtsextremen, die Italien geschafft hat, woran Demokratinnen und Demokraten hierzulande den Faschisten Höcke hindern wollen.Als Olaf Scholz bereits kurze Zeit später seinen eigenen großen Remigrationsplan verkündete, Stichwort ""konsequent Abschieben"", hielten selbst Beobachter im politischen Berlin für einen Zufall, allein geschuldet der Angst vor den anstehenden Landtags- und EU-Wahlen. Scholz wolle eigentlich keinen härteren Kurs in der Migrationspolitik durchsetzen, er blinke nur nach rechts, um ein Zeichen zu setzen, mutmaßten mit den Überlegungen im Willy-Brandt-Haus vertraute Kreise. Die Reaktionen auf seinen Vorstoß fielen vor allem gemischt aus Akzeptierte Annäherung an Rechte Kritik wurde kaum laut. Wie das Treffen des deutschen SPD-Mitgliedes mit der italienischen ""Postfaschistin"" (Deutschlandfunk) allgemeine Akzeptanz gefunden hatte, akzeptierte die für gewöhnlich sehr sensible deutsche Medienöffentlichkeit den Schulterschluss des bekennenden Antifaschisten Scholz mit der Frau, die stolz darauf ist, im Parteilogo den Sarg des Hitlervorbild Mussolini zu führen. Nur die bundesweit kaum bekannte Vorsitzende der marginalisierten Linken Janine Wissler versuchte, das Thema zur Profilierung zu nutzen, als sie mahnte: ""Statt in den Chor der Rechten einzustimmen, sollte der Kanzler dafür sorgen, dass es mehr bezahlbare Wohnungen gibt, deutlich mehr Geld für die Kommunen und dass die Arbeitsverbote endlich abgeschafft werden.""Scholz hat ihr nicht zugehört. Während seine Außenministerin Annalena Baerbock sich seit der Inthronisierung Melonis strikt weigert, Italien zu besuchen, hat der Kanzler die europafeindliche Rechtsextreme im Kanzleramt empfangen, sie mit ""liebe Giorgia"" begrüßt und mit ihr einen ""gemeinsamen Aktionsplan zur verbesserten Zusammenarbeit"" beschlossen.  In zentralen Themen gebe es zwischen den Ampelspitzen und der rechtsextremen Regierung in Rom ""keine Differenzen"" berichtete das teilstaatliche Portal T-Online damals.Zusammen gegen die Menschenrechte Was planen sie aber genau? Was eint Rechtsextreme aus Rom, Regierungspolitiker in Berlin, Minister und sozialdemokratische Parteistrategen? Dass Scholz und Meloni die anderen 25 EU-Regierungen gemeinsam dazu aufriefen, einer EU-Asyl-Reform zuzustimmen, die viele Menschenrechte infragestellt und steigende Flüchtlingszahlen nur noch als Belastung ansieht, erscheint vor dem Hintergrund der aktuellen Überlegungen zum Verbot von Parteien, die von Abschiebung, Aussiedlung und der Abschaffung doppelter und dreifacher Staatsbürgerschaften träumen, in einem neuen Licht.Selbst wenn EU-Kommissionspräsidentin Ursula von der Leyen sich bereits bereitgefunden hat, die neuen Abschottungsträume der deutsch-italienischen Achse etwa mit nordafrikanischen Tunesien vertragsfest zu machen, bleibt die italienische Inspiratorin dieser Strategie doch ""unverändert rechtsextrem"", wie die Germanistik-Professorin Camilla Miglio im Deutschlandfunk klargestellt hat. Jedes Treffen von Mitgliedern demokratischer Parteien mit solchen radikal rechten Kreisen, darunter Extremisten und Faschisten, lässt die Besorgnis wachsen, dass sich deren Einfluss noch verstärkt Im brennenden Haus Führende Politiker sehen darin ein Alarmsignal und fordern mehr Engagement auch der Bürger selbst. ""Im brennenden Haus nützt es nichts, mit den Brandstiftern zu reden"", warnt der frühere Ostbeauftragte, in Hamburg, der Stadt, die Olaf Scholz lange regiert hat, gehen Menschen für ein Verbot von Parteien auf Straße, wenn deren Mitglieder sich unverhohlen mit Extremisten und Faschisten treffen. Auch wenn ehemalige Experten abraten, weil ein Verbotsverfahren mit Sicherheit ohnehin länger dauern wird als es die SPD zumindest in Sachsen noch als Parlamentspartei geben wird, haben sich auch Prominente inzwischen für härtere Bandagen im Kampf um die Brandmauer ausgesprochen ""Man muss sich sehr genau einzelne Äußerungen, einzelne Personen, einzelne Gliederungen anschauen und dann natürlich auch Beweise sammeln, die hart genug sind, um ein Gerichtsverfahren durchsetzen zu können, eine Beweislage aufbauen und dann entsprechend agieren“, empfahl Bundesklimawirtschaftsminister Robert Habeck als Rezept für den Umgang mit Parteien, die Mitglieder dulden, die Kontakte zu Rechtsextremen pflegen ""Das halte ich schon für geboten"", sagte der Grüne auch mit Blick auf seine Parteikollegin Annalena Baerbock, die zuletzt mehrfach Treffen mit Mitgliedern der rechtsextremen Regierung Israels ""in der Hauptstadt Tel Aviv"" (Merkur) abgehalten hatte.";1;1;1;0
