news_outlet;provenance;query_keywords;creation_date;last_modified;crawl_date;author_person;author_organization;news_keywords;content_title;content_description;content_body;Fake News;Extreme bias;clickbait;credible
politplatschquatsch;https://www.politplatschquatsch.com/2024/01/ein-land-im-widerstand-endlich-wieder.html;ampel, kultur, spo, xi, nazi, usa, afd, us, spd, klima, sp, schi, tierwohl, ns, rna, demo, antifa, ss, regierung;22.01.2024;22.01.2024;01.11.2024;;;;Ein Land im Widerstand: Endlich wieder eine Einheitsfront;Ein ganzes Land im Widerstand gegen alle: Endlich eine Einheitsfront;"Nach 34 Jahren ist die Einheitsfront gegen rechts zurück.Nach dem Rückzug der Bauernverbände aus der deutschen Hauptstadt war das Thema Landwirtschaft schneller abgeräumt als der plötzlich überall auftauchende Klimaschnee. Eine Tierwohlabgabe polsterte den Übergang, der kalte Winter half katastrophaler Vereisung und Verkehrschaos. Das wahre Weltwunder aber entfaltete sich mit einer erdrutschartigen Geschwindigkeit, während die Aufmerksamkeit des Publikums noch bei Spitzenmeldungen über Dieselsubventionen, gewaltige Bauerngehälter und die reale Gefahr einer rechtsextremen Unterwanderung der Bauernverbände verweilte.  Am 10. Januar enthüllte das auch im Auftrag von Facebook mit dem erweiterten Meinungsfreiheitsschutz beschäftigte Spendenportal Correctiv den ""rechtsextremen Geheimplan gegen Deutschland"". Stunden später regte sich der erste Protest bei spontanen Spontandemos und in harschen Kommentaren Die AfD hatte nun ihre Unschuld verloren, ihr war die perfide Maske aus dem Gesicht gefallen, sie hatte sich, nach zehn Jahren unaufhaltsamer Radikalisierung, von einer rechtsextremen zu einer rechtsextremen Partei entwickelt, deren Absichten nun nicht mehr zu leugnen sind. Sie will an die Macht. Sie will alles anders machen. Sie will die Regierung stürzen, um ein putinsches System zu errichten Ein guter Aufstand Doch nur eine Woche danach stand das Volk auf. Der Anstand holte sich die Straßen zurück. Die anklagenden Kommentatoren in den großen Medienhäusern verstummten. Der Haushalt war unter Dach und Fach. Die Bauern wieder daheim. Hans Achtelbuscher ist Head of Insights am An-Institut für Angewandte Entropie der Kulturstiftung Im PPQ-Interview erläutert der Medienpsychologe, wie es der Bundesregierung gelang, sich aus einer ausweglos erscheinenden Situation zu lösen und sich an die Spitze einer Widerstandsbewegung zu stellen, wie sie Deutschland seit den Wintertagen des Jahres 1989 nicht mehr gesehen hat.PPQ: Herr Achtelbuscher, Sie stellen die derzeitigen Erschütterungen in der Gesellschaft in einen zeitgeschichtlichen Rahmen, der weiter zurückreicht als bis zum Beginn der Ampel-Koalition, mit dem der jüngste Aufschwung der rechtsextremistischen AfD ja zusammenfällt...Achtelbuscher: Unbedingt. Wenn wir Wissenschaftler uns in der Geschichte umschauen, haben wir es mit einer Situation zu tun, die uns an die Instrumentalisierung des Antifaschismus in moralischer und tagespolitischer Hinsicht erinnert, die die damals unter akuter Existenzangst leidende SED der untergehenden DDR im Januar 1990 initiierte. Am 3. Januar rief die gerade in ""SED/PDS"" umgetaufte Einheitspartei zu einer antifaschistischenKampfdemonstration ans sogenannte sowjetischeEhrenmal in Treptow. Das war am 28. Dezember 1989 mit Parolen beschmiert worden war, die von der SED als neofaschistisch bezeichnet wurden, was genug Anlass hergab, zur Solidarität zu rufen.PPQ: Das war, was wir heute einem Aufstand der Anständigen nennen?Achtelbuscher: Das war es. Die FDJ-Zeitung ""Junge Welt"" munitionierte diesen Aufstand gegen rechts mit einem Grundsatzartikel über die ""Ursachen des Entstehens, des politischen Wesens und der Ausbreitung rechtsradikaler, neonazistischer Organisationen in der DDR von 1986 bis Oktober 1989"", in dem beschrieben wurde, dass alles, was nicht explizit links ist, rechts ist. Und alles, was rechts ist, zudem identisch mit dem, was in der Forschung als rechtsextrem bezeichnet wird. Im Angesicht der gerade verlorenen Macht wurde versucht, Massen mit Hilfe einer drohenden Gefahr zu motivieren, sich hinter denen zu versammeln, die sich selbst als die einzigen sahen, denen es zustand, eine Machtergreifung der übelsten, schrecklichsten und menschenfeindlichsten Kräfte zu verhindern.PPQ: Es war ja schon bei Bauernaufständen die Gefahr an die Wand gemalt worden, dass Rechtsradikale und Rechtsextremisten die Demonstrationen unterwandern könnten und die Landwirte quasi wider Willen umgedreht und zu Staatsfeinden gemacht werden. Warum gelang das denn nicht?Achtelbuscher: Wir vermuten, dass diese These einfach zu krude war. Selbst Menschen, die selbst keinen Bauern kennen, ahnen zumeist, dass es sich bei diesen Leuten nicht um Frauen und Männern handelt, die von hippen rechten Influencern, völkischen Theoretikern oder gar identitären Stiefelnazis auf irgendeinen ideologischen Kurs gezwungen werden können. Für uns war eigentlich von Anfang an klar, dass dieser hilflose Versuch der Delegitimierung einer Bevölkerungsgruppe, der doch viele Sympathien gelten, scheitern muss. Wir haben ja dann auch schnell gesehen, wie der Kanzler, der Finanzminister und andere versucht haben, sich die Bauern mit vielen Entschuldigungen wieder gewogen zu machen. Auch das ist bekanntes Verfahren: Jemand, der keinen Einfluss auf eine bestimmte Entwicklung hat, tut so, als hätte er. Und wenn es gut geht, bedankt er sich, dass alle auf ihn gehört haben.PPQ: Nach Argumenten, die viele wirklich überzeugen, klingt das allerdings nicht. Fehlt es da nicht vollkommen an einer positiven Perspektive, an einem Ausblick, der Menschen mitnimmt?Achtelbuscher: Das ist das zentrale Problem. Es ist ja nicht nur die Wirtschaft, die bestenfalls noch stagniert, es ist die Gesellschaft. Wo ein früherer Bundespräsident noch nach einem Ruck verlangte, eine Formulierung, die im Grunde die Sehnsucht ausdrückte, dass diese Blockaden sich lösen und die Lähmung abfällt, lobt der aktuelle Amtsinhaber den Stillstand als stabiles Gerüst und aus dem besten Deutschland aller Zeiten, von dem er vor kurzem noch sprach, wird bei ihm nun ein gutes Land. Das hat schon etwas kapitulatives.PPQ: Dennoch ist es der Bundesregierung offenbar gelungen, wieder in die kommunikative Offensive zu kommen?Achtelbuscher: Das muss man zugestehen. Wir können genau sagen, dass der Ausgangspunkt dieses zumindest kurzzeitigen Stimmungswechsels die Entdeckung des gewaltigen Potenzials war, das diese ja inzwischen auch als ""Wannseekonferenz 2.0"" bezeichnete Runde dieser rechten Hinterbänkler hatte. Bei SPD und Grünen ist das sehr schnell entdeckt worden, auch in den Medienhäusern, die mit der Ampel sympathisieren, blieb der Assoziationsgehalt der Geschichte nicht lange verborgen. Das nahm dann schnell Fahrt auf und erstaunlicherweise klappte es diesmal auch sofort mit der Delegitimierung PPQ: Was genau meinen Sie damit?Achtelbuscher: Nun, es kommt nicht mehr drauf an, was genau war, wer genau teilgenommen hat, was wirklich gesagt worden ist und wenn es gesagt wurde, welche Erfolgsaussichten das hat, was ja wohl offensichtlich in einem rechtsextremistischen Fieber erdacht wurde. Nein, es kommt nur darauf an, dass alle anderen sich jetzt dagegen stellen müssen, wogegen auch immer. Der Teil der deutschen Gesellschaft, der immer bereit ist, Zeichen zu setzen, fühlt sich damit emotional angesprochen, er lässt sich doch noch einmal mobilisieren und mit seiner Hilfe gelang es nun eben, das gesellschaftliche Gespräch über all die Probleme, die diese Regierung augenscheinlich nicht in den Griff bekommt, zu beenden.PPQ: Die Wannseekonferenz als Rettungsring?Achtelbuscher: Wenn es nicht so dermaßen geschichtsvergessen wäre, nicht ein epochales Ausmaß an Skrupellosigkeit und Gewissenskälte verriete, müsste man gratulieren. Offen gestanden hätten wir in der Kommunikationsforschung nie gedacht, dass es dieser maladen Bundesregierung noch einmal gelingen kann, das kommunikative Ruder so herumzureißen, wie ihr das jetzt geglückt ist. Wir beobachten die Strategien Regierenden ja schon seit Jahren, wir beobachten sie in aller Welt und ich muss Ihnen aus persönlicher Erfahrung sagen, wenn es erst mal so weit schief gegangen ist, wie es Mitte Januar für die Ampel schiefgegangen zu sein schien, dann ist da im Grunde wenig zu retten. Dann stehen zwei Fakten wie Wasser und Feuer nebeneinander: Die Regierung hat einerseits das Vertrauen der Bevölkerung verloren, die Bevölkerung aber hat andererseits auch nicht mehr das Vertrauen der Regierung, was noch viel schlimmer ist. Die Regierenden misstrauen ihr, sie beargwöhnen sie, sie müssen, aus eigener Sicht, alles tun, um sie auszutricksen, zu täuschen und sie unter Kontrolle zu halten.PPQ: Eine Basis, das beide wieder zusammenfinden, ist das doch wohl kaum?Achtelbuscher: Beileibe nicht. So lange sich nicht eine der beiden Seiten vor der anderen zu Boden wirft, ist die Situation antagonistisch. Erstaunlicherweise aber ist es nun mit Hilfe dieser rechten Gefahr aber dennoch gelungen, wenigstens den noch empfangsbereiten Teil der Bevölkerung zu Gesten zu bewegen, die als Schulterschluss interpretiert werden können. Das hat natürlich damit zu tun, dass es einem Teil der Regierungsparteien über Jahre gelungen ist, im Vorfeld des direkten Regierungseinflusses Organisationen zu etablieren, die ihr in genau solchen Momenten zur Seite springen. Häuser wie Correctiv oder Campact liefern das Material, mit dem die vielen, vielen Sympathisanten in den großen Medienhäusern arbeiten können. Sie haben das vielleicht in Hamburg und München gesehen, einerseits waren dasDemonstrationen mit gerade mal 100.000 oder 150.000 Teilnehmern. Für diese Städte also mit ihren vielen vielen, vielen Einwohnern nicht mehr als überschaubare Zusammenkünfte. Aber angesichts dessen vonÜberfüllung zu sprechen und die Kundgebungen abzubrechen, beweist natürlich, dass das immens war, schier unvorstellbar groß. Und nur darauf kommt es ja an,dass alle das wirklich repetieren, weil kaum jemand in der normalen Bevölkerung Zeit hat, über solche Dinge nachzudenken und sich die Frage zu stellen, wie viel inneren Zusammenhang hat denn diese Nachricht? Was bedeutet sie denn?PPQ: Ist das nun ein grundlegender Umschwung oder sehen Sie die Gefahr, dass dieser schöne Erfolg sich schnell verbraucht?Achtelbuscher: Bis zu den entscheidenden Momenten im Sommer wird es nicht reichen. Der SED haben ihre Appelle an die antifaschistischen Gefühle seinerzeit nicht einmal zwei Woche geholfen, dabei wäre das für die Partei wichtig gewesen, weil sie dabei war, die Stasi neu zu organisieren. Dieser Augenblick jetzt, mit all diesen Großdemos, die größer sind als jemals zuvor, den müssen Sie sich wie ein Blitzlicht vorstellen: Der Sekundenbruchteil zeigt eine Atmosphäre, in der es so scheint, als sei die Kuh vom Eis und in trockenen Tüchern und der Rest nur noch Formsache, aber on the long run, wie in der Forschung sagen, fallen dann doch andere Gewichte auf die Waage. Wir kennen das Phänomen in der Kommunikationswissenschaft als ""suggestiven Schneeball"", das heißt, einer fängt an und er hat noch nicht ganz ausgesprochen, da sind die anderen schon alle dabei und das Ganze rollt dann den Berg runter und runter und runter und wird immer größer, so dass es ganz schnell wirkt als wäre es wirklich von Bedeutung. In diesem Moment müssen selbst die, die glauben, dass es nicht von Bedeutung ist, sich so verhalten, als hätte es Bedeutung.";0;1;1;0
politplatschquatsch;https://www.politplatschquatsch.com/2024/01/uberdosiskontrolle-die-neue.html;trump, ampel, demo, kultur, ss, us, spo, leiche, klima, terror, ns, rna, sp;25.01.2024;25.01.2024;01.11.2024;;;;Überdosiskontrolle: Die neue Bundessättigungsbeauftragte vorgestellt;Schutz vor medialen Überdosen: Die neue Bundessättigungsbeauftrage kurz vorgestellt;"Maren Müller-Sehl ist die erste Bundessättigungsbeauftragte Deutschlands. Sie soll ab Februar mediale Überdosen und Themenballungen verhindern.Radio an, rechts. Radio aus. Fernseher an, Klima. Fernseher aus. ""Tagesschau""-Kommentar. ""Wir müssen"". Tagesschau aus. Zeitung auf. ""So heiß wird es, wenn der Winter nicht so kalt bleibt"". Zeitung zu. So und ähnlich ging es auch Maren Müller-Sehl immer öfter. ""Ich habe mich oft vor mir selbst gefürchtet"", gesteht sie, ""aber am letzten Ende waren es wohl immer ganz tiefsitzende Instinkte, die mich bewogen haben, in den entsprechenden Augenblicken so und nicht anders zu handeln."" Schuldgefühle am ausgeschalteten RadioJa, sagt Müller-Sehl, die in Mecklenburg lebt und sich dort seit Jahren für die demokratische Kultur und Ordnung engagiert, ein gutes Gefühl habe sie nicht gehabt, wenn es ihr wieder passiert sei. ""Man ich ja doch der Meinung, dass all die Leute sich große Mühe geben, einem das Richtige zu erzählen, damit man die richtigen Schlüsse ziehen kann, um zu den richtigen Grundüberzeugungen zu gelangen.""Trotzdem, die 64-Jährige, die lange Jahre als Verwaltungsbeamtin in verantwortlicher Position gearbeitet hat, hatte Schuldgefühle. ""Als ich hörte, dass Anne Will ihre allerletzte Sendung moderiert, rutschte mir im Gespräch mit einer Freundin spontan der Satz heraus, ,die gibt es wohl immer noch'?"" Müller-Sehl schämte sich, war aber schnell wieder beruhigt. ""Meine Freundin gestand mir, dass sie das auch seit vielen, vielen Jahren nicht mehr geschaut hat.""Ein Mangel an gesellschaftlichem Gesamtverantwortungsbewusstsein, so viel war Maren Müller-Sehl klar. ""Mir ist doch bewusst, dass Frau Merkel dort immer wieder das Gespräch mit den Bürgerinnen und Bürgern gesucht hat, um ihre Entscheidungen noch besser zu erklären."" dennoch habe sie persönlich es nicht mehr ausgehalten, schon damals. ""Nicht, dass ich Frau Merkel nicht mochte"", sagt sie, ""aber ein bisschen war das immer wie Klippschule."" Dass viele Fragen nur eine alternativlose Antwort verdienten, habe sie ohnehin schon gewusst. ""Und dann waren die Themen ja auch wie aus einer Dauerschleife abgespielt.""Ein ""gewisser Überdruss""Müller-Sehl ist keine Leugnerin, keine Feindin der Gemeinschaft. Die viel jünger wirkende sportliche Frau mit dem weißblond gefärbten Haar hat bereits mehrere zivilgesellschaftliche Preise für ihren Einsatz erhalten, sie ist Vorsitzende von allein sechs Vereinen, Beisitzer in weiteren sieben und Mitglied in, wie sie selbst scherzhaft sagt, so vielen weiteren Gremien, ""dass ich es gar nicht mehr zählen kann"" Seit ein paar Jahren aber, das sage sie ganz ehrlich, habe sie eben innerlich ""einen gewissen Überdruss"" gespürt. Unendliche Belehrungen, aufgetürmt zu Bergen von Parolen. ""Sieben Tage, sieben Köpfe"", schmunzelt sie und sie sagt nach einigem überlegen etwas ""für mich ganz unerhörtes: Ich kam mir manchmal vor wie damals im Staatsbürgerkundeunterricht in der DDR.""Abschalten sei ihre Alternative geworden. Nicht mehr zuhören. Nicht mehr hinschauen. ""es war ja diese Woche das, in der nächsten Woche dasselbe, nur etwas anders."" Das Impfen und die schweren Waffen, die Energieversorgung und die Atomkraftabschaltung, der Frieden im Nahen Osten und der Trump. ""Ich konnte einfach nicht mehr, denn ich fühlte mich wie unter der chinesischen Wasserfolter."" Manchmal habe sie sich schon gefragt, wer sich das alles ausdenke ""Immer wieder dieselbe Botschaft immer wieder an die gleiche Adresse gerichtet von den gleichen Absendern im gleichen Wortlaut mit dem gleichen Duktus auf allen Sendern, in allen Spalten, in allen Magazinen, in Zeitungen und im Radio"". Das bringe doch gar nichts, bemerkte sie an sich selbst. ""Ich habe es ja einfach nicht mehr ausgehalten.""Das BBAA meldet sich Als an einem Abend Anfang Januar ihr Telefon klingelt und sich ein Mann mit Guten Abend,, Hegenzecht meldet, ist Müller-Sehl denn auch nicht schlecht verdutzt. ""Der Name sagte mir etwas, auch wenn ich ihn nicht sofort einsortieren konnte."" Wie sich herausstellt, ist der Chef des Bundesblockampelamtes im mecklenburgischen Warin am Apparat Herrnfried Hegenzecht leitet das BBAA schon seit vielen Jahren mit großem Erfolg, er ist Deutschlands oberster Meinungsfreiheitsschützer, aber auch Bundesverbotsbeauftragter. Seine Mission an diesem Abend, so beschreibt er selbst: ""Einen weiteren Schritt auf unsere Bürgerinnen und Bürger zugehen, sie dort abholen, wo sie sind, und eine Tür öffnen, um ihnen mehr Mitarbeit zu ermöglichen.""Maren Müller-Sehl hatte zuvor schon vom Bundesblogampelamt gehört, sie hatte sogar schon einmal mit einem der dortigen Beamten telefoniert, als ein Hetzer und Zweifler dabei war, ihr kleines Dorf im Mecklenburgischen zu terrorisiere. ""Ich wollte damals eigentlich nur wissen, ob es sich lohnt, den Mann anzuzeigen."" Freundlich, höflich, aber bestimmt habe ihrer der BBAA-Beamte abgeraten. ""Jemanden eine alte Wurst zu nennen, ohne dass man weiß, wer hat diese Wurst sein soll, sei nichts, um bei der Staatsanwaltschaft mehr als ein Achselzucken als Reaktion zu provozieren.""Eine viel tiefere Beziehung Ihr zweiter Kontakt zum BBAA aber entpuppte sich schnell als Startpunkt einer viel tieferen Beziehung. ""Herr Hegenzecht hat mir angeboten, mich um eine Stelle zu bewerben, die sie im Amt gerade geschaffen hatten."" Der neue Poster den oder des Bundessättigungsbauftragten (BSBA) sei als eine Art Frühwarnsystem angelegt, um eine drohende Informationsüberdosierung der Bevölkerung bei bestimmten Themen künftig zu verhindern.""Hegenzecht wird deutlich: ""Frau Müller-Sehl ist uns bei umfassenden Internet-Recherchen als sehr sensible Mitbürgerin aufgefallen, deren Scheuegefühle vor sogenannten Themenclustern, wie es sie immer wieder gibt, stellvertretend stehen für die Emotionen, mit denen viele Bürgerinnen und Bürger richtig umzugehen versuchen."" Einerseits gebe es bei einer großen Mehrheit die Bereitschaft, sich Dinge immer besser erklären zu lassen. Andererseits müsse dabei auf den Punkt genau dosiert werden, ""sonst verlieren selbst die gutgemeintesten Botschaften ihre Empfänger.""Überdosiskontrolle ab Februar Als Bundessättigungsbeauftragte werden Maren Müller-Sehl ab Anfang Februar zuständig für die Überdosiskontrolle beim Themenangebot in den Medien sein. ""Sie hat einen direkten Draht zu mir, so dass die Vorwarnzeit ganz kurz sein wird."" Sobald Müller-Sehl signalisiere, dass sie ein Thema nicht mehr hören könne, einen gerade erfolgreich präsenten Protagonisten nicht mehr zu sehen ertrage, ""Werde ich das durchstellen und wir schauen, was sich machen lässt.""";;;;
politplatschquatsch;https://www.politplatschquatsch.com/2024/08/messergewalt-was-und-die-daten-verraten.html;schi, grenzen, xi, kultur, politik, ss, us, ns, sp;25.08.2024;25.08.2024;01.11.2024;;;;Messergewalt: Was uns die Daten verraten;Der unspektakuläre Alltagsgegenstand Messer avancierte zur allgegenwärtigen Gefahrenquelle, zuletzt  unübersehbar;"Nach der Gewinn der Fußball-WM 2014 begann der unaufhaltsame Aufstieg des Messerthemas in Deutschland Was ist Eindruck, was ist Wirklichkeit? Wo darf der Einzelne einer kollektiven Wahrnehmung trauen und warum nicht? Welchen Wandel hat das Messer, eines der ältesten Werkzeuge des Menschen, in den zurückliegenden Jahren durchlaufen? Welche Transformation zeigt sich langfristig? Es geht um Zahlen und Daten, um Statistiken und deren Interpretation im politischen Bedeutungskampf. Das Schlachtfeld ist vermint, wer zur Sache spricht, tut gut daran, sich anschließend sofort in den Graben zu werfen.  Gesellschaftsgefährdende ProblematikWie in anderen Forschungsbereichen auch, war die Wissenschaft bei Messerfrage lange einer überwiegend einheitlichen Ansicht. Das Messer als solches zeigte trotz seiner latenten Gefährlichkeit aufgrund von Schärfe und Spitze keinerlei gesellschaftsgefährdende Problematik Verglichen mit der Zeit vor 100 Jahren verfügt der durchschnittliche deutsche Haushalt heute über etwa vier- bis sechsmal so viele Messer. Doch weder im Alltag noch in der Literatur gab es Auffälligkeiten, die darauf hätten hindeuten können, dass sich hier eine Gefährdungsblase aufbläst Niemand hatte die Absicht, Daten zur ""Messerkriminalität"" gesondert zu erheben, weil darin keinerlei Nutzen gesehen wurde. Wie die später in Mode gekommene Ausrufung von ""Waffenverbotszonen"" war auch die Ernennung von bestimmten Plätzen und Straßen zu bestimmten Zeiten zu ""Messerverbotszonen"" bis Dezember 2007 ""Messerangriff"" eine vollkommen unbekannte Maßnahme zur Sicherstellung der inneren Sicherheit. Weder existierten zuvor die entsprechenden Begriffe noch gab es Forderungen, sie zu erfinden.Seit der ""Messerangriff"" schließlich offiziell als eigene Kategorie in die Polizeistatistik aufgenommen wurde, zählen dazu ausschließlich Taten, ""bei denen der Angriff mit einem Messer unmittelbar gegen eine Person angedroht oder ausgeführt wird"". Das bloße Mitführen eines Messers reicht bis heute nicht aus, um aufgenommen zu werden.. Ein neues Licht auf die Betrachtung des vieldiskutierten Themas, das seit einigen Jahren gezielt zur Verunsicherung genutzt wird, werfen nun Daten, die der Medienforscher Hans Achtelbuscher mit Hilfe des US-Suchmaschinenkonzerns Google hat erstellen lassen. Grafiken, die der Experte für das Themensterben in den deutschen Medien und KI-automatisierte Sprachregelungsmechanismen in der Talkshow-Politik in Kürze im angesehenen Magazin ""Science Speed Economics"" veröffentlichen wird, weisen nach Achtelbuschers Analyse darauf hin, dass die Problematisierung des vor rund zweieinhalb Millionen Jahren vom Homo Habilis erfundenen Schneid- und Stechwerkzeugs erst in der jüngeren Vergangenheit seinen Anfang nahm.Popularisierung von Verboten ""Im Gefolge einer breiteren gesellschaftlichen Aufmerksamkeit für das Messer wurden Waffenverbotszonen und Messerverbote popularisiert"", sagt Achtelbuscher, der am An-Institut für Angewandte Entropie der Bundeskulturstiftung zum Einfluss subkutaner Wünsche auf die berichterstattete Realität forscht Nach dem Gewinn der Fußball-WM 2014 zeigten die Daten, die Google durch das Einscannen von Hunderttausenden von Büchern gewann, eine rasch beginnende Fetischisierung des Messers. ""Medial kann man von einer rasant aufkeimenden Faszination sprechen"", erläutert der Forscher. Der unspektakuläre Alltagsgegenstand Messer avancierte binnen eines Jahrzehnts zur allgegenwärtigen Gefahrenquelle, anfangs noch weitgehend unbeachtet, zuletzt aber unübersehbar.Entdeckung eines Phänomens Die Schwierigkeit, die die moderne Wissensgesellschaft in Deutschland mit dem Phänomen habe, sagt Achtelbuscher, bestehe darin, dass Informationen auch über Messer und die von der Bundesworthülsenfabrik BWHF im Jahr 2017 vorsorglich erfundene ""Messergewalt"" - damals noch speziell für die Lage in Großbritannien - sich objektiv grenzenlos erwerben ließen, ihr Verständnis aber Hilfsmittel zur Ordnung erfordere Achtelbuscher sagt: ""Um gewünschte Information aus den verfügbaren Inhalten herauszufiltern, reicht es nicht, dass sich der Einzelne der Flut der Information ergibt, wichtig ist vielmehr deren verständnisfördernde Organisation.""Milch vom Glas wischen Diese Methode des Information Retrieval hat die Forschungsgruppe des Medienkenners genutzt, um die im speziellen Anwendungsfall der Messerproblematik ""ein wenig Milch vom Glas zu wischen"", wie der Wissenschaftler es scherzhaft nennt. ""In den Grafiken, die wir durch eine KI haben erstellen lassen, ist der Anstieg des Interesses an Messern deutlich zu sehen.""Mit Hilfe von Fördermitteln, auf die Achtelbuscher und sein junges Team aus Datenanalysten, Programmieren und KI-Experten hoffen, soll nach dieser unumgänglichen Klärung der Frage, ob Buchautoren in Deutschland heute häufiger über Messer schreiben, Messergewalt beklagen oder Messerverbotszonen beschrieben, in den nächsten Jahren Ursachenforschung betrieben werden Hans Achtelbuscher ist optimistisch, dass sein agiler Forschungsverbund eines Tages handfeste Ergebnisse wird vorlegen können. Ziel sei es, Aufklärung zu betreiben und das Thema zu Enttabuisieren. ""Vielleicht"", hofft der angesehene Forscher, ""sind wir fertig, ehe die Duden-Redaktion ,Messergewalt"" und ""Messerverbot"" ins Waffenverzeichnis der deutschen Sprache aufnimmt.""";;;;
