news_outlet;provenance;query_keywords;creation_date;last_modified;crawl_date;author_person;author_organization;news_keywords;content_title;content_description;content_body;Fake News;Extreme bias;clickbait;credible
politplatschquatsch;https://www.politplatschquatsch.com/2024/08/an-der-grenze-des-sagbaren-comeback-des.html;schi, afrika, xi, demo, kultur, nazi, ss, us, spo, leiche, spd, rna, ns, linke, sp, armin laschet;23.08.2024;23.08.2024;01.11.2024;;;;An der Grenze des Sagbaren: Comeback des Fickers;"Jan Böhmermanns Aufforderung an Elon Musk, er solle sich ""ficken"" gehen, erlebt ein Comeback";"Noch immer reagiert Elon Musk nicht auf die gezielte Ansprache Jan Böhmermanns. Er hat das Aussehen, er hat das Talent, er hat die Leute hinter sich, die ihm die Scherze aufschreiben, die schenkelklopfenden Aktionen planen und ihm die richtige Richtung zeigen. Jan Böhmermann gelang es in nur einem Jahrzehnt, von einem Fernsehclown unter vielen zu obersten Bundessatiriker aufzusteigen. Er war politisch wie Dieter Hildebrandt, also SPD. Er war mutig wie Bruno Jonas, hatte also immer gute Anwälte. Und er legte sich unverhohlen mit den Stärksten an, so lange er wusste, dass sie nicht an ihn herankommen.  Methode Böhmermann Zur Methode Böhmermann gehörte immer schon, die Grenze des Sagbaren anzuvisieren und sie zu überschreiten. Gossensprache und Klosprüche sind Böhmermanns Spezialität, analfixiert wie viele große Künstler assoziiert er sofort ""Ficken"", ""Arschlöcher"" und ""Scheißen"", wenn er besonders deftig und heftig austeilen will. Während ""Nazi"" bei ihm der Beschimpfung bürgerlicher Parteien vorbehalten bleibt, wird ""Scheiße"" auf Feministinnen angewendet und ""Ziegenficker"" in Richtung des verhassten Staatsoberhauptes eines Nato-Partners abgeschossen. Es hat ihm nicht geschadet, aber auch nicht viel genützt. Im Kampf für das Gute, den Böhmermann seit 15 Jahren gegen große Teile einer widerstrebenden Gesellschaft führt, hat es sich der Spaßvogel mit weiten Teilen der Mitte verscherzt. Im linken ""Narrensaum"" (FAZ) aber hat der 43-Jährige sich den Ruf des Bundessatirikers ergrinst: Obschon nie lustig und nie amüsant, wird Böhmermann hier hoch angerechnet, dass er seine Scherzversuche auf Kosten der Richtigen macht. Von oben herab, gezielt auf Unbewaffnete, von denen der vielfache Fernsehpreisträger weiß, dass er Gegenwehr nicht zu befürchten hat.Der Kloakenkomiker Alle hat Jan Böhmermann so schon geschlagen. Armin Laschet hat er der  ""unverantwortlichen Scheiße"" überführt und ihm die Kanzlerschaft entrissen. Der deutschen Geschichtswissenschaft hat er nachgewiesen, dass alle irren und die parlamentarische Geschichte des Nationalsozialismus neu geschrieben werden muss. Widerspruch blockt der Demokrat demonstrativ, für Diskussionen hat er keine Zeit.Als Staatskünstler, den sämtliche Bürgerinnen und Bürger im Land mit ihren Gebührengeldern unterhalten, sieht sich der vielfach Talentierte einer gesellschaftlichen Stabilität verpflichtet, die auf eine klare Arbeitsteilung setzt, wie sie in seinen Kindertagen in jeder Grundschulstunde üblich war: Der Lehrer spricht. Die Kinder haben zuzuhören.Grimmepreis und Pupsgesicht Es läuft gut, gerade erst gab es wieder einen Grimme-Preis für gute Unterhaltung mit erzieherischer Botschaft. Zufrieden aber ist Jan Böhmermann trotzdem nicht. Denn da ist die eine Baustelle, auf der es einfach nicht vorangeht. Es geht um Elon Musk. Den Milliardär. Das ""misogyne, freiheitsfeindliche, infantile, narzisstische und doofe Pupsgesicht"", wie ihn Jan Böhmermann in einem Ausbruch von Kunstfreiheit nannte.So sehr er kann, so drastisch zieht der Komiker über den Mann her, den er zu seinem Endgegner gemacht hat. Und dann geht es ihm noch schlimmer als Thierry Breton, dem französischen EU-Kommissar, der Musk auch liebsten den Mund stopfen, ihn aus- oder einsperren oder aber zumindest enteignen würde. Der Afrikaner, der bei X 193 Millionen Follower mehr hat als Böhmi, tut gar nicht dergleichen. Nicht einmal, als er es damals noch im Guten versuchte, nahm Musk ihn zur Kenntnis.Bewirtschaftung von Aufregung Für jemanden wie den Selbstdarsteller aus Bremen ist das die Höchststrafe. Mit Aufregung und Ablehnung kann Jan Böhmermann leben, sie sind es, nach denen er giert. So schade es ist, dass seine frohe Botschaft von der Minderwertigkeit ganzer gesellschaftlicher Gruppen von diesen abgelehnt wird, so sehr gefällt ihm doch das Aufsehen, das deren Empörung ihm beschert Selbst noch nach Jahren: 2022 gab Böhmermann ein Interview, in dem er dem ihm verhassten Musk empfahl, er solle ""sich ficken gehen"". Ein Klassiker der Beleidigungskunst, filigran und formschön, kinderzimmergerecht und beispielhaft für die Art von subtilem Humor, den nur eine sehr alte Kulturnation hervorbringen kann.Und die Menschen goutieren es. In Zeiten, in denen so viel von Hass und Verrohung die Rede ist, dass selbst die Vorsitzende der ""Die-Gedanken-sind-frei""-Partei öffentlich darüber nachdenkt, wie sich die gesellschaftliche Kommunikation durch die gezielte Sperrung von Hohn, Spott und Widerspruch säubern lassen könnte, zeigt Jan Böhmermann, dass ein guter Witz weder lustig sein noch Spaß machen muss. Hauptsache, er ist stumpf, brutal und primitiv.Passende HumormethodeDass sein tiefsinniger, aber zugleich auch humoristischer Satz im Moment ein Erregungscomeback erlebt - passenderweise pünktlich vor dem Start einer Deutschlandtour, die den Absolventen der Meisterklasse für mediale Manipulation in den nächsten Monaten quer durch ein gespaltenes Land führen wird - gibt Böhmermanns Humormethode recht.Seine Art, Menschenverachtung als Schund und Schmutz zu tarnen, um gegen Abweichler, Andersmeinende und Anhänger falschen Glaubens zu hetzen, erfährt höchste gesellschaftliche Anerkennung. Wäre Fernsehen immer so, hätte die Demokratie kein Problem mit Menschen, die meinen, sie könnten einfach so wählen.";0;0;1;1
politplatschquatsch;https://www.politplatschquatsch.com/2024/08/zank-knatsch-und-murks-der-grenze-zum.html;klimaschutz, ampel, demo, christ, usa, ss, us, spd, klima, spo, ns, regierung, sp, olaf scholz, christian lindner, friedrich merz;04.08.2024;04.08.2024;01.11.2024;;;;"""Zank"", ""Knatsch"" und ""Murks"": An der Grenze zum Geldwunder ";Ihrem Ziel eines dynamischen Aufwuchses des Staates und seiner Ausgaben ist die SPD in den zurückliegenden Jahren ein gutes Stück nähergekommen.;"Ihrem Ziel eines dynamischen Aufwuchses des Staates und seiner Ausgaben ist die SPD in den zurückliegenden Jahren ein gutes Stück nähergekommen.Im kleinen, hochverschuldeten Sachsen-Anhalt funktioniert der Trick ohne Widerspruch und kleinliches Geningel. Statt selbst Schulden zu machen, die es nicht machen darf, nimmt das Land Kredite auf, die es dann als Darlehen an eine eigens gegründete landeseigene Firma weiterreicht. Im Handumdrehen verwandelt sich eine neue Millionenlast so in ein Guthaben: Das private Unternehmen hat zwar einen Kredit in den Büchern stehen. Beim Land aber kann wie durch ein Wunder ein Guthaben verbucht werden.  Das grün-rot-gelbe Geldwunder Die Wirtschaftsentwicklung stimmt optimistisch.Bundeskanzler Olaf Scholz, ehemals Finanzminister, schwebte Ähnliches vor, als er zum Stopfen des 17-Milliarden-Euro tiefen Finanzierungslochs im Bundeshaushalt vorschlug, den bundeseigenen Unternehmen Deutsche Bahn und Bundesautobahngesellschaft kein Geld zu geben, sondern Darlehen nach dem Sachsen-Anhalt-Modell. Eleganter noch als durch ein ""Sondervermögen"" könne eine Zahlungsverpflichtung jenseits des verfassungsrechtlich Zulässigen so zu einem Pfund werden, mit dem abseits der leidigen Schuldenbremse gewuchert werden kann So durchsichtig, so bewährt, dass es womöglich bald jeder nachgemacht hätte: Der Kredit für das neue Auto wird aufgenommen, das Geld sofort an die Oma weitergereicht, die kauft den Wagen und in der persönlichen Spalte beim demnächst eröffneten EU-Vermögensregister steht der Kredit nicht als Last, sondern als Sparbetrag.Aus Minus wird Plus Bedenken gab es trotzdem und als der Bundesfinanzminister ankündigt, die Verfassungsmäßigkeit des ""haushaltspolitische Kniffs"" (Tagesschau) zur Umgehung der Schuldenbremse durch Experten prüfen lassen zu wollen, war schon klar, dass der Vorschlag des Kanzleramts zum ""noch bestehenden Handlungsbedarf"" beim Verfüllen des Haushaltslochs demnächst hinfällig sein würde So gern die rot-grün-gelbe Koalition auch regiert, ohne allzu kleinlich an den verfassungsmäßigen Vorgaben zu kleben, so wenig kann sie es sich leisten, noch einmal vom höchsten deutschen Gericht in Karlsruhe einer gezielten Verletzung des Grundgesetzes überführen lassen.Ein kurzer Monat der Einigkeit Jeder hätte gern mehr gehabt. Doch alle mussten einsehen, dass ein leerer Formelkompromiss ohne Kürzungen alles sein wird, was sich mathematisch darstellen lässt. Nicht ganz einen Monat hatte die Einigung der Ampelspitzen dann Bestand Ein paar Tage lang gab es noch Überlegungen, wie die Bahn aus ihren eigenen fehlenden Einnahmen mit Hilfe größer werdenden Fehlbeträge - zuletzt kam sie auf ein Minus von 1,2 Milliarden in einem halben Jahr - zumindest den Eindruck erwecken könnte, das Bundesdarlehen eines Tages zurückzuzahlen Bei der Bundesautobahngesellschaft, die nicht einmal theoretisch über irgendwelche eigenen Geldquellen verfügt,  meckerte Chef Volker Geyer gleich, seine Quasi-Behörde könne kein Darlehen aufnehmen, weil sie ""keine Einnahmen"" habe und deshalb nicht einmal Zinsen zahlen könne.Dann bekam Bundesfinanzminister Christian Lindner, was er hatte haben wollen: Ein Gutachten besagt, dass der Trick tatsächlich ein Trick ist. Und schon steht alles wieder auf Null und die Bundesregierung hat nun doch nicht ""mehr Spielraum für andere Ausgaben"" (Tagesschau), weil der von Lindner, Scholz und Habeck in 80 Stunden langen Nachtsitzungen ausgetüftelte Weg zu mehr Schulden ohne mehr Schulden und Sparbemühungen ohne Senkung der Ausgaben nicht mehr gegangen werden kann.Zank, Knatsch und MurksDas Echo ist verheerend. Selbst Medien, die der Grundüberzeugung anhängen, dass alles, was die Ampel tut, besser ist als irgendetwas anderes, schlagzeilten über ""Zank um den Haushalt"", ""Ampel-Knatsch"" und ""Murks-Haushalt"", als wollten sie den ""Deutschland-Kurier"" rechts überholen. An der neuen Delegetimierungswelle, die demokratisch legitimierte Repräsentantinnen und Repräsentanten sowie Institutionen des Staates mitten in der Ferienzeit überrollt, beteiligen sich neben zahlreichen Leitmedien auch hochrangige Führungskader der Berliner Republik SPD-Chefin Esken etwa hat Lindners Rücktritt vom beabsichtigten Verfassungsbruch als rücksichtsloses Verhalten kritisiert, das die ""Grenze des Erträglichen"" überschreite. SPD-Fraktionschef Rolf Mützenich, Chef der AG ""Schwerter zu Sozialausgaben"" in der ältesten deutschen Partei, beklagte, dass ""das juristische Hauptgutachten die finanziellen Transaktionen im Kern für möglich hält"", Lindners Ministerium aber dennoch zur Auffassung komme, ""dass die verfassungsrechtlichen Zweifel überwiegen"" Dynamischer Aufwuchs des Staates Aus Sicht der SPD, die sich einem dynamischen Aufwuchs des Staates und seiner Ausgaben verpflichtet sieht, sei ausreichend Interpretationsspielraum vorhanden, eine erneute Klatsche aus Karlsruhe wegen eines Verfassungsbruchs zu riskieren.Nur weil die Steuereinnahmen laut Monatsbericht des Finanzministeriums um 7,8 Milliarden auf 176,5 Milliarden Euro stiegen und damit 4,6 Prozent höher liegen als im ersten Halbjahr 2023, kann mehr Geld nicht schaden, weil immer zu wenig da ist.Dass ein Bundesfinanzminister es nicht auf ein erneutes Urteil des Bundesverfassungsgerichtes ankommen lasse, sondern lieber einen grundgesetzkonformen Haushalt erstellen wolle, kommt in den Augen der SPD-Vorsitzenden einer Kapitulation vor dem Grundgesetz gleich. Selbst wenn alles Maßnahmen nur darauf zielten, die Schuldenbremse zu umgehen, so spekuliert der sozialstaatliche Flügel in der SPD, sei mit einem Urteil erst in Monaten zu rechnen. ""Und dann"", sagt ein mit der Materie vertrauter Strategieplaner, ""sind wir entweder sowieso abgewählt"". Oder die dringend benötigten Milliarden hätten eben gelangt, das Ruder herumzureißen und  der deutschen Sozialdemokratie einen Platz als Juniorpartner an der Seite von Kanzler Friedrich Merz zu verschaffen.Verteidigung oder Verfassung Für den Sozialflügel der SPD wäre das kein Beinbruch, wenn bis dahin die Basis gelegt ist für einen weiteren automatischen Aufwuchs von Staat und Staatsausgaben. Zuletzt war es gelungen, die Ausgaben für Sozialhilfe um fast 20 Prozent zu steigern. Bund, Länder und Kommunen schafften im letzten Jahrzehnt beinahe 600.000 neue Stellen, einzelnen Bundesministerien gelang es sogar, wie quicke junge US-Startups Wachstumsraten von mehr als 50 Prozent hinzulegen.Um die Entwicklung zu verstetigen, benötigt der Staat nun noch einmal deutlich mehr Geld, Geld, das ""weder auf Kosten des sozialen Zusammenhalts noch auf Kosten des Klimaschutzes"" (Mützenich) eingespart werden kann. Bleiben nur die Verteidigung oder die Verfassung - und um die Entscheidung, wo genau gezapft wird, schlägt die Ampel nun ihre letzte Schlacht.";0;0;0;1
politplatschquatsch;https://www.politplatschquatsch.com/2024/01/schwein-gehabt-symbol.html;schi, bsw, usa, ss, us, familie, ns, rna, sp;22.01.2024;22.01.2024;01.11.2024;;;;Schwein gehabt: Symbolischer Sonnenblumenschinken  ;Rügenwalder Ersatzwurst - Schwein gehabt: Symbolischer Sonnenblumenschinken  ;"Augen auf beim Schinken-Kauf: Das gelbe Vegan-Siegel steht für die Herstellung aus Sonnenblumenkernen.Ein Zeichen der Zeit, betriebswirtschaftlich geschickt gerechnet und vom Kundenvolk begeistert angenommen. Nach dem großen Erfolg seiner fleischlosen Frikadellen macht der frühere Fertigwursthersteller Rügenwalder Mühle nun mit Schinken-Spickern ohne Schinken den nächsten Schritt in die Ersatznahrungszukunft. Ein Schritt, der begeistert goutiert wir, nicht nur von den vielen, veganen Kunden. Sondern auch in den von Haus aus kritischen Medienlandschaft. Ein winziges Vegan-Siegel Äußerlich fast unverändert, abgesehen von einem winzigen Vegan-Siegel und einem unauffälligen Hinweis auf die Zubereitung des Fleischgerichtes ""auf der Basis von Sonnenblumenkernen"", setzte der ""deutsche Vorreiter bei vegetarischen und veganen Fleisch- und Wurstalternativen seinen 2014 gestarteten Kurs weiter fort und fokussiert sich noch stärker auf sein pflanzliches Sortiment"", wie der Hersteller selbst mitteilt. Zu den fünf bisher angebotenen ""würzigen Sorten"" des ""veganen Klassikers"" mit dem Namen eines traditionellen Fleischgerichtes kommt ein weiterer: Die durch den Abschied vom Schwein freiwerdenden Kapazitäten werden ab sofort für den ""Veganen Hauchschnitt"" genutzt.Für das Familienunternehmen aus dem niedersächsischen Bad Zwischenahn ist der vor zehn Jahren begonnene Umstieg auf Sonnenblumenkerne, Rapsöl, Schnittlauch und Paprika eine Erfolgsgeschichte. Mehr als 50 fleischlose Wurstprodukte hat man heute im Angebot, dagegen nur noch 22 Würste, deren Rezepturen noch nicht ohne Fleisch auskommen. Die Zahlen, die das Unternehmen damit schreibt, sprechen für sich: Knapp mehr als die Hälfte des Umsatzes machen die 50 veganen Ersatzprodukte aus, nur noch knapp weniger als die Hälfte die 22 aus traditionellen Rohmaterialien hergestellten Würste mit Fleischanteil.Symbolischer Schinken Dass es nun ausgerechnet den Schinken-Spicker trifft, hat Symbolcharakter. Die als ""feine Schinkenwurst"" beworbene Ware wurde bisher stets aus ""Schinkenwurst"" hergestellt, die ""mit kleinen Stücken würzigen Schinkens gespickt"" war. Ehe der in der Wurst landete, wurde ""er jedoch zunächst gepökelt"", beschreibt der Hersteller selbst. Dieser Vorgang verleihe ihm und damit der Schinkenwurst ""ein ganz besonderes Aroma: auf dem Brot, dem Brötchen oder einfach pur!""Dieses Rezept so zu adaptieren, dass vom Konsumenten beinahe unbemerkt geriebene Sonnenblume auf dem Brot landet, galt selbst unter Fachleuten lange Zeit als unmöglich. Frikadellen ja, so lange der Ersatzcharakter auf der Verkaufsverpackung nicht über die Maßen betont wird. Selbst Mortadella, eine graue Brühwurstsorte aus zermahlenem Schweinefleisch und Speckwürfeln, galt als schwierig, aber aufgrund der Konsistenz der Wurst auch als machbar Gelungen ist es erst, als eine Rezeptur entstanden war, die mit dem Hinweis ""auf Basis von Sonnenblumenkernen"" wirbt, um möglicherweise noch schreckhafte Umsteiger zu locken. Tatsächlich enthält das fertige Produkt nur zwei Prozent Sonnenblumenprotein. Der Rest des Schinkens besteht aus Wasser, Rapsöl, Verdickungsmitteln, Weizen, Hanf, Kartoffeln und Bambusfasern. Das ergibt betriebswirtschaftlich Sinn: Ein Kilogramm Schweinefleisch kostet etwa 2,67 Euro, ein Kilo Sonnenblumenkerne aber mehr als vier Euro. Da bietet es sich an, mit Weizen, Kartoffel und Fasern zu strecken, um den Kunden lecker Weizenbrei als Brotaufstrich schmackhaft zu machen.Schinken ohne Schinken Mit dem Schinken-Spicker ohne Schinken wird die noch recht junge Tradition der Bratwurst ohne Wurst nicht nur fortgeschrieben, sondern auf ein neues Level gehoben. Die EU, die bei mit der Europäischen Zusatzstoff-Verordnung VO (EG) Nr. 1333/2008 sichergestellt hatte, dass Eierlikör weder konserviert noch mit Süßungsmitteln versetzt  sein darf und zum Verkauf bestimmter Fisch die Bezeichnung der Fangmethode tragen muss, hatte vor vier Jahren sichergestellt, dass Fleisch kein Fleisch enthalten muss, Steaks ohne tierische Bestandteile auskommt und Ersatzprodukte ohne Beimengungen toter Tiere denselben Namen tragen dürfen wie Speisen, die mit Hilfe von Schlachthöfen hergestellt wurden.";;;;
politplatschquatsch;https://www.politplatschquatsch.com/2024/01/der-deutschlandfresser-er-ist-wieder-da.html;schi, europa, ampel, trump, demo, nazi, amerika, usa, ss, us, migration, terror, ns, corona, regierung, sp, angela merkel;24.01.2024;24.01.2024;01.11.2024;;;;Der Deutschlandfresser: Er ist wieder da; wenn Biden als letzte Brandmauer zwischen dem Fortschritt und four more years nicht hoch genug ist drohen Deutschland vier Jahre Trump;"Eigentlich kommt er nur zurück, um Deutschland zu schaden. Er geht durch die Vorwahlen wie das heiße Messer durch die Butter. ""Obwohl"" (Der Spiegel) vier Ermittlungs- und Gerichtsverfahren gegen ihn laufen, scheinen die Amerikaner mit dem Ignorieren der Unschuldsvermutung einer weniger leidenschaftliche Beziehung zu pflegen als deutsche Meinungsführer. Nach dem Sieg in Iowa nun der in New Hampshire. Amerika the beautiful wird wieder zum ""Land des Schreckens"", wie Marc Pitzke schon nach dem ersten beiläufigen Comeback Trumps aus Des Moine kabelte. Dunkle Zeiten ziehen auf. Ein finsterer Herrscher steht vor der Tür. Fast sieht es aus, als müssten sich Deutschland und als müsste sich das zerstrittene EU-Europa demnächst selbst nicht nur um sich kümmern, sondern auch um die eigenen Interessen. Die Angst vor dem Untergang Mit einer Regierung, die inzwischen Stiefel trägt, weil sie sich die Schnürsenkel nicht binden kann, und einer EU-Kommission, deren letzte Wortmeldung einer Neuordnung des Nahen Ostens galt, sind die Voraussetzungen dafür schwierig. Der Wiederaufbau nach Corona, der genug Geld übers Land regnen lassen sollte, um Zufriedenheit allerorten zu säen, er kommt nicht voran. Die große Transformation, sie treibt die Mitgliedsstaaten auseinander, die Atommächte dort, die Kohlennationen da. Nazipläne zur Remigration beschäftigen die Fernsehrunden, die Bahn streikt, die Bauern murren und vom Tag an, an dem die EU beschloss, eigene Seestreitkräfte zur Sicherung der Schiffsrouten am Roten Meer zu entsenden, bis zum Auslaufen der mit Warnflaggen und Abwehrhelmen munitionierten ""Hessen"" hat es zwei Monate gedauert.Nein, der alte Kontinent, er ist auf die Rückkehr des großen Verderbers nicht besser vorbereitet als beim ersten Mal. Damals, als Donald Trump als demokratischer Verkehrsunfall galt, ins Amt geputscht von mazedonischen Spammern, wie die großen Medienhäuser zu berichten wussten, brach nach den ersten Augenblicken der Verblüffung eines Zeit des Kampfes an. Aus ihren Schützengräben in Hamburg, Berlin, München und Frankfurt schossen sich ganze Heere von Warnern und Wächtern auf den  unberechenbaren, irren, schädlichen Loser, Lügner, Colatrinker und Fernsehgucker ein, wie ihn sein deutscher Lebensbegleiter Karl Doemens einst charakterisiert hat.Der Titelheld des ""Spiegel"" Trump errang nicht nur die US-Präsidentschaft, er  wurde binnen von nur vier Jahren auch Rekordhalter bei der Zahl der ihm gewidmeten ""Spiegel""-Titelbilder:  Barack Obama schaffte es in acht Dienstjahren als  ""Messias"" (Spiegel), ""Weltpräsident"", ""Superstar"" und Weltfriedensbringer 16 Mal auf die Titelseite des früheren Hamburger Nachrichtenmagazins. Trump holte sich in derselben Zeit 28 Coverbilder.  Auf jedem einzelnen war er schlimmer anzusehen als auf dem zuvor.Dazu kam mit dem Newsletter ""Trump Daily"" zeitweise ein eigener Trump-Informationsdienst, mit dem der inzwischen beim MDR untergekommene ""Spiegel""-Chef Klaus Brinkbäumer versuchte, die Gesellschaft gegen die Versuchung aus Amerika zu immunisieren. Geholfen hat es wenig, genützt hat es nichts. Zwar hätte Trump bei den deutschen Wählern keine Chance,ausgerechnet die aber dürfen bei der anstehenden US-Schicksalswahl nicht abstimmen. Dabei geht es, so wenigstens sind die ersten noch leicht ungläubigen Kommentare der deutschen Welterklärer zu verstehen, im November um nichts anderes als den alten deutschen ""Traum vom toleranten Amerika"", den Barack Obama einst in Berlin in Jubelstürmen präsentiert hatte. Alle zusammen gegen den Terror. 500 Dollar für jeden. Und eine Erhöhung der Truppenstärke der US-Streitkräfte um knapp 100.000 Soldaten  und stärkere Investitionen in die US-Luftstreitmacht. ""Sie ist das  Rückgrat unserer Fähigkeit, weltweit Druck auszuüben.""Wo der Hass hinfällt Niemanden haben sie in Berlin und Hamburg, in Köln und Kiel je mehr geliebt, zumindest seit Kennedy. Obama tat nie, was er sagte, aber er sagte, was sie hören wollten. Und nahm viel Arbeit auf sich, im Tausch gegen schweigende Zustimmung. Donald Trump bekam nach seiner Wahl sofort die Instrumente gezeigt: Angela Merkel, seinerzeit die ""mächtigste Frau der Welt"", gratulierte dem ""Horrorclown"" (Taz) zwar. Knüpfte ihre Glückwünsche aber knallhart an Bedingungen. Ein überaus verheißungsvoller Beginn. Besser wurde es auch nicht mehr. Die USA wurden, aus dem Hamburger ""Spiegel""-Hochhaus gesehen, zu einer Wüstenei, in der ""Demokratieverachtung und der Hass auf Andersdenkende dominierten"", wo die bedauernswerte Wahlentscheidung einer verachtenswerten ""Melange aus Globalisierungsverlierern,  White Trash, Verschwörungstheoretikern, Denkzettelwählern und Rassisten""  (Taz) eine große Demokratie zerstört.  Den ""Trump-Kult"" nennt es ""Die Zeit"", deren Überzeugung nach eine demokratische Wahl zur undemokratischen ""Krönung"" wird, wenn eine ""wandelnde  Abrissbirne""(SZ) in ein Amt befördert wird, das für  EU-Europa eine ähnliche Bedeutung hat wie der Papst für einen deutschen  Katholiken.Natürlich gibt es in der all die Bistümer mit ihrem Bischöfen, die Erzdiözesen und die Kardinäle, die deutsche Bischofskonferenz, das Kommissariat der deutschen Bischöfe  und das Zentralkomitee der deutschen Katholiken, eine Art Bürgerrat. Aber angesagt wird anderswo. Selbst mit Joe Biden im Weißen Haus, einem gebrechlichen alten Mann, bei dem die Hoffnung bestand, dass er europäische Interessen sehr hoch gewichtet, gelang es in vier Jahren nicht, den von Trump begonnenen Zollstreit beizulegen.Biden als letzte BrandmauerWas soll nur werden, wenn der Ex-Präsident wirklich zurückkehrt? Was geschieht, wenn Biden als letzte Brandmauer zwischen dem Fortschritt und four more years nicht hoch genug ist? Die Hoffnung der amtierenden Bundesregierung besteht natürlich darin, dass Trump erst ins Amt kommt, wenn die Ampel schon in ihre letzte Kurve biegt. Ehe sich die innenpolitischen Entwicklungen in den USA auf Deutschland auswirken, wäre nach derzeitigem Stand schon wieder die Union in Berlin am Ruder, in Brüssel säße dann zudem eine ganz andere Kommissarsriege, Frauen und Männer, die den europaweiten Rechtsruck verkörpern und ähnlich breitbeinig auftreten wie der alte neue alte Mann im weißen Haus.Die augenblicklich noch als Vizepräsidentin des Europäischen Parlaments bestallte Katarina Barley, die es aktuellen Umfragen zufolge bei den anstehenden EU-Wahlen schaffen wird, zwölf ihrer ehemals 21 Prozent Stimmenanteil zu verlieren, hat schon Bedenken geäußert, ob Wahlen mit einem Ergebnis, das einem Demokraten nicht gefallen kann, wirklich durchgeführt werden sollten. In den USA drohe ein ""Mann wieder Präsident zu werden, der aus seiner Verachtung für Demokratie keinen Hehl macht."" Man muss etwas tun. Man weiß nur nicht was.";0;1;1;0
